"","session_title","session_jel_code","number_of_authors","number_of_papers"
"426","The Economic Case or Health Equity","I1",11,3
"427","The Economic History of Social Issues","N3, J0",6,4
"428","The Economic Impact of Globalization","F6, F4",14,4
"429","The Economics of Controversial Policies and Unintended Consequences","I1, K0",5,2
"430","The Economics of International Trade Agreements","F1",10,4
"431","The Effect of Taxes and Transfers on Labor Supply, Savings, and Health Insurance","J00, I1",11,4
"432","The Effectiveness of Public Policies to Promote Employment and Safety","J6",8,4
"433","The Formation of Expectations and Macroeconomic Dynamics","E3, E5",13,4
"434","The Geography of American Despair and Declining Economic Opportunity","L0",8,4
"435","The Global Infrastructure Investment Challenge","F3, F4",4,3
"436","The Impact of the Digital Economy","F1, F1",5,5
"437","The Impact of Unconditional Cash Transfers in the United States","H2, I3",5,4
"438","The Life Cycle of Inventors Past and Present","O3, J6",15,4
"439","The Micro Origins of Macro","E0, F4",9,4
"440","The Nexus Between Monetary Policy and Financial Stability","E5, G0",8,4
"441","The Political Economy of Movement","N7, R4",8,4
"442","The Provision and Valuation of Non-wage Job Attributes","J3",9,4
"443","The Racial and Ethnic Implications of Policy in the Trump ERA","H3, J1",5,4
"444","The Role of the Employer in the Labor Market","J3",9,4
"445","The Supply Side of Higher Education:  University Choices and the Implications for Students","I2",8,4
"446","The Uneasy Path to Becoming a ‘Normal Country’: Effect of Transition on People and Firms in Ukraine","P3, O5",9,4
"447","Theoretical and Empirical Innovations in I.O. Models","L0",11,4
"448","Top Income Inequality","D3, J2",10,3
"449","Top Income Inequality and the Gender Divide","D3, J7",13,4
"450","Topics in Economic Development: Explorations and Evidence From Sub-Saharan Africa and South Asia","O1, J1",4,4
"451","Topics in Energy Issues","H0, Q4",9,4
"452","Topics in Health Economics","I1",11,4
"453","Topics in International Real Estate","Q5, R1",10,4
"454","Topics in International Trade","F4",11,5
"455","Topics in Macro and Monetary History","N1, E0",3,3
"456","Topics in Risk and Insurance","D8, G2",13,4
"457","Topics in Transportation","R4, H0",10,5
"458","Topics in Transportation and Trade","R4, F0",11,5
"459","Topics in Water and Wastewater Management","H0, Q2",9,4
"460","Topics on the History of Radical Political Economics","B1, B5",6,5
"461","Trade and Innovation","O3, F1",14,4
"462","Trade and Technology Diffusion","A1",13,4
"463","Trade Flows, Capital Flows and Bank Credits","G0, G0",15,6
"464","Trade in an Environment of Increasing Economic Nationalism","F1",8,4
"465","Trade, Multinationals, and Firm Dynamics","A1",5,4
"466","Trade, Technology, and the Local Economy in China","O1",7,4
"467","Trajectories of Innovation: Evaluation and Direction in R&D Project Selection","O3, L2",11,4
"468","TransHistorical Restitutions: The Political Economy of Reparations","I3, F5",5,5
"469","Transmission of Shocks Across Countries","F4, E3",10,4
"470","Treatment Effects and Regression Discontinuity","C21, C14",7,4
"471","TrumpEconomics: a First Year Evaluation","E6, F4",5,5
"472","TrumpEconomics: A World View","F6, E6",5,4
"473","Urban Economics","R2, R3",5,3
"474","Urban Economics Theory and Policy","H2, R1",6,4
"475","Urban Growth and Immigration","O0, R0",6,4
"476","Venture Capital","G2",10,4
"477","Vertical Integration in the Health Care Market","I0, L2",6,3
"478","Volatility and Tail Risk","G1",12,4
"479","Water, Health and Development","Q5",7,4
"480","What Can We Learn From Financial Market Responses to the 2016 Election?","G1",9,3
"481","What Can We Learn from Private Sector Data About the Labor Market?","J0, J2",13,4
"482","What’s Special About the Dollar in Financial Markets?","F3, G2",8,3
"483","Whither the Future of Economic History?","N0, B0",5,4
"484","Why Do Firms Invest in Corporate Social Responsibility and Does it Matter?","G3",14,4
"485","Women's Retirement Security","J1, J2",7,4
