author,paper_title,author_affiliation,date,time,location,association,session_title,session_jel_code,session_chair,session_chair_affiliation,discussant_1,discussant_1_affiliation,discussant_2,discussant_2_affiliation,discussant_3,discussant_3_affiliation,discussant_4,discussant_4_affiliation,discussant_5,discussant_5_affiliation,author.y,gender,alternative_1,alternative_2,alternative_3,alternative_4,alternative_5,X,X.1,X.2,X.3,X.4
Pierre-Daniel Sarte,What Inventory Behavior Tells Us About How Business Cycles Have Changed,Federal Reserve Bank of Richmond,Jan 04 2015,2:30 PM,"Boston Marriott Copley, Yarmouth",International Society for Inventory Research,"Inventories and Business Cycles (E2, E3)",,Thomas A. Lubik,Federal Reserve Bank of Richmond,Thomas A. Lubik,Federal Reserve Bank of Richmond,Scott Schuh,Federal Reserve Bank of Boston,Andrea Tambalotti,Federal Reserve Bank of New York,Eric Sims,University of Notre Dame,,,PIERRE-DANIEL SARTE,Male,,,,,,NA,NA,NA,NA,NA
Pierre-Louis Lions,Wealth Distribution and the Business Cycle: The Role of Private Firms,College de France,Jan 04 2015,2:30 PM,"Boston Marriott Copley, Provincetown",Society for Economic Dynamics,"Firm Heterogeneity in the Macroeconomy (E3, O3)",,Benjamin Moll,Princeton University,,,,,,,,,,,Pierre-Louis Lions,Male,,,,,,NA,NA,NA,NA,NA
Piet Eichholtz,Environmental Performance and the Cost of Capital: Evidence from REIT Bonds and Commercial Mortgages,Maastricht University,Jan 05 2015,1:00 PM,"Westin Copley, Empire",American Real Estate & Urban Economic Association,"Green and Not-So-Green Real Estate (M1, D9)",,Anthony Yezer,George Washington University,Min Hwang,George Washington University,PingKang Yu,Renmin University and Huatai Securities,William Larson,U.S. Bureau of Economic Analysis,Stephen Malpezzi,University of Wisconsin-Madison,,,PIET EICHHOLTZ,Male,,,,,,NA,NA,NA,NA,NA
Pietro Tebaldi,The Impact of Market Size and Composition on Health Insurance Premiums: Evidence from The First Year of The ACA,Stanford University,Jan 04 2015,2:30 PM,"Sheraton Boston, Back Bay Ballroom C",American Economic Association,"Health Insurance Marketplaces: New Developments and Their Inplications (I1, L1)",,Leemore Dafny,Northwestern University,Joshua Schwartzstein,Dartmouth College,Katherine E. Ho,Columbia University,Cory Capps,Bates White,Robin S. Lee,Harvard University,,,Pietro Tebaldi,Male,,,,,,NA,NA,NA,NA,NA
Pietro Veronesi,The Price of Political Uncertainty: Theory and Evidence from the Option Market,University of Chicago,Jan 04 2015,10:15 AM,"Westin Copley, Essex North",American Finance Association,Finance and Politics,G3,Francesco Trebbi,University of British Columbia,Motohiro Yogo,Federal Reserve Bank of Minneapolis,Jeffry Frieden,Harvard University,Thomas Fujiwara,Princeton University,,,,,PIETRO VERONESI,Male,,,,,,NA,NA,NA,NA,NA
Qinghua Zhang,"Transport Infrastructure, Urban Growth and Market Access in China",Peking University,Jan 04 2015,2:30 PM,"Westin Copley, St. George A & B",American Real Estate & Urban Economic Association/American Economic Association,"Urbanization in Developing Countries (R1, O1)",,Stuart Rosenthal,Syracuse University,Jan Brueckner,University of California-Irvine,Edward Glaeser,Harvard University,Matthew Kahn,University of California-Los Angeles,Douglas Gollin,University of Oxford,,,Qinghua Zhang,Female,,,,,,NA,NA,NA,NA,NA
Rachel Soloveichik,Valuing ‘Free’ Entertainment in GDP,U.S. Bureau of Economic Analysis,Jan 04 2015,10:15 AM,"Boston Marriott Copley, Wellesley",Society of Government Economists,Exploring the Potential for Improvements in Economics Education,A2,Deirdre N. McCloskey,University of Illinois-Chicago and AIRLEAP,Seth Giertz,University of Nebraska-Lincoln,Reza Kheirandish,Clayton State University,Mark Costa,Sustain Software,Shabnam Mousavi,Johns Hopkins University,Amelie F. Constant,Institute for the Study of Labor and George Washington University,Rachel Soloveichik,Female,,,,,,NA,NA,NA,NA,NA
Rafael Dix Carneiro,Trade Liberalization and the Skill Premium: A Local Labor Markets Approach,Duke University,Jan 03 2015,2:30 PM,"Sheraton Boston, Back Bay Ballroom C",American Economic Association,"International Trade and Development (F1, O1)",,Nina Pavcnik,Dartmouth College,Treb Allen,Northwestern University,Ann Harrison,University of Pennsylvania,Samuel Bazzi,Boston University,,,,,Rafael Dix Carneiro,Male,Rafael Dix-Carneiro,,,,,NA,NA,NA,NA,NA
Rafael Lalive,Spatial search strategies of job seekers and the role of unemployment insurance,University of Lausanne,Jan 05 2015,8:00 AM,"Sheraton Boston, Back Bay Ballroom C",American Economic Association,"Housing, Unemployment and Monetary Policy (E2, E3)",,William Branch,University of California-Irvine,John C. Williams,Federal Reserve Bank of San Francisco,Robert E. Hall,Stanford University,Jan Brueckner,University of California-Irvine,,,,,Rafael Lalive,Male,,,,,,NA,NA,NA,NA,NA
Raffaella Sadun,Integration and Delegation: Theory and Evidence,Harvard Business School and NBER,Jan 04 2015,2:30 PM,"Hynes Convention Center, Room 208",American Economic Association,"Integration and Management: Theory and Evidence from Around the World (D2, L2)",,John Van Reenen,"London School of Economics, Centre for Economic Performance, NBER and CEPR",,,,,,,,,,,RAFFAELLA SADUN,Female,,,,,,NA,NA,NA,NA,NA
Raffaella Sadun,Management as a Technology,Harvard Business School,Jan 05 2015,10:15 AM,"Hynes Convention Center, Room 207",American Economic Association,"Macroeconomics with Rich Microdata: Implications for Policy (E2, O1)",,John Haltiwanger,University of Maryland,,,,,,,,,,,RAFFAELLA SADUN,Female,,,,,,NA,NA,NA,NA,NA
Raffaella Sadun,Never Waste a Good Crisis? Growth and Decentralization in the Great Recession,Harvard Business School,Jan 05 2015,1:00 PM,"Sheraton Boston, Constitution Ballroom B",American Economic Association,"Organization, Management and Economic Growth (J1, L1)",,Rebecca Henderson,Harvard Business School,,,,,,,,,,,RAFFAELLA SADUN,Female,,,,,,NA,NA,NA,NA,NA
Rainer Haselmann,The Political Economy of Bank Bailouts,University of Bonn,Jan 04 2015,10:15 AM,"Westin Copley, Essex North",American Finance Association,Finance and Politics,G3,Francesco Trebbi,University of British Columbia,Motohiro Yogo,Federal Reserve Bank of Minneapolis,Jeffry Frieden,Harvard University,Thomas Fujiwara,Princeton University,,,,,Rainer Haselmann,Male,,,,,,NA,NA,NA,NA,NA
Rainer Haselmann,Does Financial Structure Shape Industry Structure? Evidence from Timing of Bank Liberalization,University of Bonn,Jan 05 2015,1:00 PM,"Westin Copley, Essex Center",American Finance Association,"Banking, Regulation, and the Real Economy",G2,Tomasz Piskorski,Columbia University,Tobias Adrian,Federal Reserve Bank of New York,Heitor Almeida,University of Illinois-Urbana-Champaign,Philipp Schnabl,New York University,,,,,Rainer Haselmann,Male,,,,,,NA,NA,NA,NA,NA
Rajkamal Iyer,Ex Post (In) Efficient Negotiation and Breakdown of Trade,Massachusetts Institute of Technology,Jan 04 2015,10:15 AM,"Sheraton Boston, Constitution Ballroom A",American Economic Association,"Experiments with Firms in Developing Countries (L1, M1)",,Dean Karlan,Yale University,,,,,,,,,,,RAJKAMAL IYER,Male,,,,,,NA,NA,NA,NA,NA
Ralf Martin,The Causal Effects of the European Union Emissions Trading Scheme: Evidence from French Manufacturing Plants,Imperial College London,Jan 03 2015,8:00 AM,"Sheraton Boston, Hampton Room",Association of Environmental & Resource Economists,"Energy and Energy-Intensive Industry (Q4, L2)",,Meredith Fowlie,University of California-Berkeley,James Bushnell,University of California-Davis,Meredith Fowlie,University of California-Berkeley,Ralf Martin,Imperial College London,Kevin Novan,University of California-Davis,,,RALF MARTIN,Male,,,,,,NA,NA,NA,NA,NA
Ralph Koijen,Survey Expectations of Returns and Asset Pricing Puzzles,London Business School,Jan 03 2015,2:30 PM,"Westin Copley, America Center",American Finance Association,"Expectation, Sentiment, and Asset Prices",G1,Stefan Nagel,University of Michigan,Juhani Linnainmaa,University of Chicago,Kent Daniel,Columbia University,Francesco Franzoni,University of Lugano,Anna Cieslak,Northwestern University,,,RALPH KOIJEN,Male,,,,,,NA,NA,NA,NA,NA
Ralph Koijen,Shadow Insurance,London Business School,Jan 05 2015,1:00 PM,"Westin Copley, Essex Center",American Finance Association,"Banking, Regulation, and the Real Economy",G2,Tomasz Piskorski,Columbia University,Tobias Adrian,Federal Reserve Bank of New York,Heitor Almeida,University of Illinois-Urbana-Champaign,Philipp Schnabl,New York University,,,,,RALPH KOIJEN,Male,,,,,,NA,NA,NA,NA,NA
Ramana Nanda,"Housing Collateral, Credit Constraints and Entrepreneurship - Evidence from a Mortgage Reform",Harvard University,Jan 04 2015,2:30 PM,"Boston Marriott Copley, Vermont",International Society for New Institutional Economics,"Institutions, Organization, and Entrepreneurship",L2,Francine Lafontaine,University of Michigan,Suresh Naidu,Columbia University,Renata Kosova,Imperial College London,Peter G. Klein,University of Missouri,Danielle Li,Northwestern University,,,Ramana Nanda,Male,,,,,,NA,NA,NA,NA,NA
Ramesh Johari,Managing Congestion in Dynamic Matching Markets,Stanford University,Jan 05 2015,8:00 AM,"Sheraton Boston, Beacon G",Econometric Society,Theory of Matching Markets,C1,Ramesh Johari,Stanford University,Parag A. Pathak,Massachusetts Institute of Technology,Itai Ashlagi,Massachusetts Institute of Technology,John Joseph Horton,New York University,Jacob Leshno,Columbia University,,,Ramesh Johari,Male,,,,,,NA,NA,NA,NA,NA
Ramesh Johari,At What Quality and What Price? Inducing Separating Equilibria as a Market Design Problem,Stanford University,Jan 03 2015,8:00 AM,"Hynes Convention Center, Room 209",American Economic Association,Empirical Market Design,D4,Ramesh Johari,Stanford University,Ali Hortacsu,University of Chicago,Steven Tadelis,University of California-Berkeley,Eduardo Azevedo,University of Pennsylvania,Eric Budish,University of Chicago,,,Ramesh Johari,Male,,,,,,NA,NA,NA,NA,NA
Raoul Minetti,"Financial Markets, Industry Dynamics, and Growth",Michigan State University,Jan 03 2015,10:15 AM,"Hynes Convention Center, Room 201",American Economic Association,Financial Frictions and the Macroeconomy,E3,Ayse Sapci,Colgate University,,,,,,,,,,,Raoul Minetti,Male,,,,,,NA,NA,NA,NA,NA
Raphael Schoenle,Inflation Dynamics during the Financial Crisis,Brandeis University,Jan 03 2015,2:30 PM,"Boston Marriott Copley, Grand Ballroom—Salon D",Society for Economic Dynamics,Rigidities and Macroeconomic Dynamics,E3,Yuriy Gorodnichenko,University of California-Berkeley,Ben Malin,Federal Reserve Bank of Minneapolis,Ruediger Bachmann,University of Notre Dame,Justin Wolfers,University of Michigan,Ricardo Reis,Columbia University,,,Raphael Schoenle,Male,,,,,,NA,NA,NA,NA,NA
Raven Molloy,Large-Scale Buy-to-Rent Investor Activity in the United States Single-Family Housing Market,Federal Reserve Board,Jan 03 2015,2:30 PM,"Westin Copley, Defender",American Real Estate & Urban Economic Association,"The Rental Market (R2, G1)",,Abdullah Yavas,University of Wisconsin,Lynn Fisher,University of North Carolina,Paul Anglin,University of Guelph,Jim Clayton,Cornerstone Real Estate Advisers,Jiro Yoshida,Pennsylvania State University,,,Raven Molloy,Female,,,,,,NA,NA,NA,NA,NA
Ravi Bansal,Climate Change and Growth Risk,Duke University,Jan 04 2015,2:30 PM,"Hynes Convention Center, Room 206",American Economic Association,"Documenting the Costs of Climate Change (Q5, E3)",,Benjamin Jones,Northwestern University,Tony Smith,Yale University,Benjamin Jones,Northwestern University,Melissa Dell,Harvard University,Aaron Smith,University of California-Davis,,,RAVI BANSAL,Male,,,,,,NA,NA,NA,NA,NA
Raymond Guiteras,Impacts of Climate Change on Low-Lying and Flood-Prone Areas: The Case of Bangladesh,University of Maryland,Jan 03 2015,10:15 AM,"Sheraton Boston, Back Bay Ballroom C",American Economic Association,"High Stakes Energy and Environmental Problems in Developing Countries (Q4, Q5)",,Michael Greenstone,University of Chicago,,,,,,,,,,,RAYMOND GUITERAS,Male,,,,,,NA,NA,NA,NA,NA
Raymond Guiteras,No Shit: Demand Estimation with Strategic Complementarities -- The Case of Sanitation in Bangladesh,University of Maryland,Jan 05 2015,8:00 AM,"Hynes Convention Center, Room 204",American Economic Association,"Hygiene and Sanitation in Developing Countries (I1, O1)",,Paul Gertler,University of California-Berkeley,Daniel M. Bennett,University of Chicago,Ahmed Mushfiq Mobarak,Yale University,Raymond Guiteras,University of Maryland,Anjali Adukia,University of Chicago,,,RAYMOND GUITERAS,Male,,,,,,NA,NA,NA,NA,NA
Raymond Kluender,Beyond Statistics: The Economic Content of Risk Scores,Massachusetts Institute of Technology,Jan 05 2015,10:15 AM,"Sheraton Boston, Constitution Ballroom A",American Economic Association,"Adverse Selection and Risk Adjustment (I1, D8)",,Mark Duggan,Stanford University and NBER,Randall Ellis,Boston University,Amanda Kowalski,Yale University,Keith Marzilli Ericson,Boston University,,,,,Raymond Kluender,Male,,,,,,NA,NA,NA,NA,NA
Rebecca Henderson,The Real Effects of Relational Contracts,Harvard Business School,Jan 05 2015,1:00 PM,"Sheraton Boston, Constitution Ballroom B",American Economic Association,"Organization, Management and Economic Growth (J1, L1)",,Rebecca Henderson,Harvard Business School,,,,,,,,,,,REBECCA HENDERSON,Female,,,,,,NA,NA,NA,NA,NA
Rebecca Henderson,Firm Purpose and Performance,Harvard Business School,Jan 04 2015,2:30 PM,"Sheraton Boston, Commonwealth",American Economic Association,"Culture, Trust, and Productivity (D2, L2)",,Robert Gibbons,Massachusetts Institute of Technology,,,,,,,,,,,REBECCA HENDERSON,Female,,,,,,NA,NA,NA,NA,NA
Rebecca Zarutskie,Large-Scale Buy-to-Rent Investor Activity in the United States Single-Family Housing Market,Federal Reserve Board,Jan 03 2015,2:30 PM,"Westin Copley, Defender",American Real Estate & Urban Economic Association,"The Rental Market (R2, G1)",,Abdullah Yavas,University of Wisconsin,Lynn Fisher,University of North Carolina,Paul Anglin,University of Guelph,Jim Clayton,Cornerstone Real Estate Advisers,Jiro Yoshida,Pennsylvania State University,,,REBECCA ZARUTSKIE,Female,,,,,,NA,NA,NA,NA,NA
Reint Gropp,Financial Incentives and Loan Officer Behavior,Goethe University Frankfurt,Jan 05 2015,8:00 AM,"Westin Copley, America Center",American Finance Association,"Governance, Compensation and Bank Risk-Taking",G2,Steven Ongena,Tilburg University and University of Zurich,Renee Adams,University of New South Wales and ECGI,Fabio Braggion,Tilburg University,Rüdiger Fahlenbrach,Ecole Polytechnique Federale de Lausanne and Swiss Finance Institute,Jose Maria Liberti,Northwestern University and Tilburg University,,,Reint Gropp,Male,,,,,,NA,NA,NA,NA,NA
Rema Hanna,Moving up the Energy Ladder: The Effect of an Increase in Economic Well-Being on the Fuel Consumption Choices of the Poor in India,Harvard University,Jan 03 2015,10:15 AM,"Sheraton Boston, Back Bay Ballroom C",American Economic Association,"High Stakes Energy and Environmental Problems in Developing Countries (Q4, Q5)",,Michael Greenstone,University of Chicago,,,,,,,,,,,Rema Hanna,Female,,,,,,NA,NA,NA,NA,NA
Ricard Gil,Testing for the Interaction of Formal and Informal Contracts,Johns Hopkins University,Jan 05 2015,8:00 AM,"Sheraton Boston, The Fens",American Economic Association,Firms and Contracts,D2,Julie Mortimer,Boston College,,,,,,,,,,,RICARD GIL,Male,,,,,,NA,NA,NA,NA,NA
Ricardo Serrano-Padial,Modeling the Revolving Revolution: The Role of IT Reconsidered,University of Wisconsin-Madison,Jan 05 2015,1:00 PM,"Sheraton Boston, Beacon H",Econometric Society,"Household Risk, Credit, and Insurance",E2,Felicia Ionescu,Federal Reserve Board,,,,,,,,,,,Ricardo Serrano-Padial,Male,,,,,,NA,NA,NA,NA,NA
Riccardo Colacito,Temperatures and Growth: a Panel Analysis of the U.S,University of North Carolina,Jan 04 2015,2:30 PM,"Hynes Convention Center, Room 206",American Economic Association,"Documenting the Costs of Climate Change (Q5, E3)",,Benjamin Jones,Northwestern University,Tony Smith,Yale University,Benjamin Jones,Northwestern University,Melissa Dell,Harvard University,Aaron Smith,University of California-Davis,,,Riccardo Colacito,Male,,,,,,NA,NA,NA,NA,NA
Riccardo Colacito,BKK the EZ Way. International Long-Run Growth News and Capital Flows,University of North Carolina,Jan 05 2015,10:15 AM,"Westin Copley, Essex South",American Finance Association,International Finance,G1,Anna Pavlova,London Business School,Stavros Panageas,University of Chicago,Christian Heyerdahl-Larsen,London Business School,Robin Greenwood,Harvard Business School,,,,,Riccardo Colacito,Male,,,,,,NA,NA,NA,NA,NA
Riccardo Colacito,Currency Risk Factors in a Recursive Multi-Country Economy,University of North Carolina,Jan 04 2015,10:15 AM,"Sheraton Boston, Independence Ballroom East",American Economic Association,"Currency Risks: Empirical Facts and Theory Frontiers (F4, G1)",,Riccardo Colacito,University of North Carolina,Refet Gurkaynak,Bilkent University,Matteo Maggiori,Harvard University,Karen Lewis,University of Pennsylvania,Pierre-Olivier Gourinchas,University of California-Berkeley,,,Riccardo Colacito,Male,,,,,,NA,NA,NA,NA,NA
Richard Blundell,Prices versus Preferences: Taste Change and Revealed Preference,University College London,Jan 04 2015,2:30 PM,"Hynes Convention Center, Room 202",American Economic Association,"New Developments in the Estimation of Classical Consumer Demand (C5, D1)",,Richard Blundell,University College London,Jerry Hausman,Massachusetts Institute of Technology,Frederic Vermeulen,KU Leuven,Krishna Pendakur,Simon Fraser University,Dennis Kristensen,University College London,,,Richard Blundell,Male,,,,,,NA,NA,NA,NA,NA
Richard Carson,A Delphi Exercise as a Tool in Amazon Rainforest Valuation,University of California-San Diego,Jan 04 2015,8:00 AM,"Sheraton Boston, Hampton Room",Association of Environmental & Resource Economists,"Natural Resources: Economic Impacts and Valuation (Q5, Q2)",,Michael Hanemann,Arizona State University,Michael Hanemann,Arizona State University,Paul Rhode,University of Michigan,Katharine Sims,Amherst College,Marshall Burke,University of California-Berkeley,,,RICHARD CARSON,Male,,,,,,NA,NA,NA,NA,NA
Richard Carson,Comparing the Cost of a Carbon Tax in China and the United States,University of California-San Diego,Jan 04 2015,2:30 PM,"Sheraton Boston, Public Garden",Association of Environmental & Resource Economists/American Economic Association,"China and the Future of Climate Policy (Q5, O5)",,Maximillian Auffhammer,University of California-Berkeley,Maximillian Auffhammer,University of California-Berkeley,Nicholas Z. Muller,Middlebury College,Shanjun Li,Cornell University,Joseph Aldy,Harvard University,,,RICHARD CARSON,Male,,,,,,NA,NA,NA,NA,NA
Richard Newell,Deconstructing the Energy Efficiency Gap: Conceptual Frameworks and Evidence,Duke University,Jan 03 2015,2:30 PM,"Sheraton Boston, Public Garden",American Economic Association,"Explaining the Energy Paradox (D1, L2)",,Robert N. Stavins,Harvard University,Kenneth Gillingham,Yale University,Erich Muehlegger,Harvard University,,,,,,,RICHARD NEWELL,Male,,,,,,NA,NA,NA,NA,NA
Richard Newell,Individual Time Preferences and Energy Efficiency,Duke University,Jan 03 2015,2:30 PM,"Sheraton Boston, Public Garden",American Economic Association,"Explaining the Energy Paradox (D1, L2)",,Robert N. Stavins,Harvard University,Kenneth Gillingham,Yale University,Erich Muehlegger,Harvard University,,,,,,,RICHARD NEWELL,Male,,,,,,NA,NA,NA,NA,NA
Richard Stanton,Mortgage Underwriting Standards in the Wake of Quantitative Easing,University of California-Berkeley,Jan 05 2015,10:15 AM,"Westin Copley, Great Republic",American Real Estate & Urban Economic Association,"The Consequences of the GSEs (G2, G1)",,Richard Buttimer,University of North Carolina-Charlotte,Vincent W. Yao,Fannie Mae,Philip Seagraves,University of Wisconsin-Whitewater,Carlos Slawson,Louisiana State University,Craig Depken,University of North Carolina-Charlotte,,,Richard Stanton,Male,,,,,,NA,NA,NA,NA,NA
Robert Barro,The Great Influenza Pandemic as a Macroeconomic Shock,Harvard University,Jan 04 2015,10:15 AM,"Hynes Convention Center, Room 207",American Economic Association,"Shocks and Disasters (E2, G1)",,Steven J. Davis,University of Chicago,,,,,,,,,,,ROBERT BARRO,Male,,,,,,NA,NA,NA,NA,NA
Robert Barro,Environmental Protection and Rare Disasters,Harvard University,Jan 03 2015,8:00 AM,"Sheraton Boston, Beacon H",Econometric Society,"Discounting for Climate Change Economics (G1, Q5)",,Robert E. Hall,Stanford University,Robert E. Hall,Stanford University,Xavier Gabaix,New York University,Derek Lemoine,University of Arizona,Maureen Cropper,University of Maryland,,,ROBERT BARRO,Male,,,,,,NA,NA,NA,NA,NA
Robert C. Johnson,International Competitiveness: Demand for Value Added and Value-Added Exchange Rates,Dartmouth College,Jan 05 2015,1:00 PM,"Sheraton Boston, The Fens",American Economic Association,Economic Globalization,F1,Richard Pomfret,University of Adelaide,,,,,,,,,,,Robert C. Johnson,Male,,,,,,NA,NA,NA,NA,NA
Robert C. Johnson,International Competitiveness: Demand for Value Added and Value-Added Exchange Rates,Dartmouth College,Jan 05 2015,1:00 PM,"Sheraton Boston, The Fens",American Economic Association,Economic Globalization,F1,Richard Pomfret,University of Adelaide,,,,,,,,,,,Robert C. Johnson,Male,,,,,,NA,NA,NA,NA,NA
Robert C. Johnson,Global Supply Chains and Trade Policy,Dartmouth College,Jan 03 2015,8:00 AM,"Hynes Convention Center, Room 206",American Economic Association,"International Trade with Global Value Chains (F1, F2)",,Davin Chor,National University of Singapore,Stephen Redding,Princeton University,Peter Schott,Yale University,Lorenzo Caliendo,Yale University,Ralph Ossa,University of Chicago,,,Robert C. Johnson,Male,,,,,,NA,NA,NA,NA,NA
Robert C. Johnson,Global Supply Chains and Trade Policy,Dartmouth College,Jan 03 2015,8:00 AM,"Hynes Convention Center, Room 206",American Economic Association,"International Trade with Global Value Chains (F1, F2)",,Davin Chor,National University of Singapore,Stephen Redding,Princeton University,Peter Schott,Yale University,Lorenzo Caliendo,Yale University,Ralph Ossa,University of Chicago,,,Robert C. Johnson,Male,,,,,,NA,NA,NA,NA,NA
Robert Chirinko,The Declining Labor Income Share: The View from the States,University of Illinois-Chicago and CESifo,Jan 03 2015,10:15 AM,"Sheraton Boston, Beacon A",American Economic Association,Wage Rigidities and Equilibrium Unemployment,J6,David Garman,Tufts University,,,,,,,,,,,ROBERT CHIRINKO,Male,,,,,,NA,NA,NA,NA,NA
Robert Clark,Diversification of Geographic Risk in Retail Bank Networks: Evidence from Bank Expansion after the Riegle-Neal Act,HEC Montreal,Jan 03 2015,10:15 AM,"Hynes Convention Center, Room 202",American Economic Association,"Financial Architecture and Regulation (G2, L1)",,Robert Townsend,Massachusetts Institute of Technology,Ariel Zetlin-Jones,Carnegie Mellon University,Michael Gofman,University of Wisconsin-Madison,Borghan Narajabad,Federal Reserve Board,Saki Bigio,Columbia University,,,ROBERT CLARK,Male,,,,,,NA,NA,NA,NA,NA
Robert Clark,Search Frictions and Market Power in Price Negotiated Markets,HEC Montreal,Jan 03 2015,2:30 PM,"Boston Marriott Copley, Grand Ballroom—Salon H",Industrial Organization Society,The Industrial Organization of Financial Services,L1,Jean-Francois Houde,University of Pennsylvania,Marc Rysman,Boston University,Michael Grubb,Boston College,Victor Stango,University of California-Davis,Alessandro Gavazza,London School of Economics,,,ROBERT CLARK,Male,,,,,,NA,NA,NA,NA,NA
Robert Gibbons,Culture in Organizations,Massachusetts Institute of Technology,Jan 04 2015,2:30 PM,"Sheraton Boston, Commonwealth",American Economic Association,"Culture, Trust, and Productivity (D2, L2)",,Robert Gibbons,Massachusetts Institute of Technology,,,,,,,,,,,ROBERT GIBBONS,Male,,,,,,NA,NA,NA,NA,NA
Robert Gibbons,Formal Measures in Informal Management: Can a Balanced Scorecard Change a Culture?,Massachusetts Institute of Technology,Jan 05 2015,1:00 PM,"Sheraton Boston, Constitution Ballroom B",American Economic Association,"Organization, Management and Economic Growth (J1, L1)",,Rebecca Henderson,Harvard Business School,,,,,,,,,,,ROBERT GIBBONS,Male,,,,,,NA,NA,NA,NA,NA
Robert Gordon,Secular Stagnation: A Supply Side View,Northwestern University,Jan 03 2015,2:30 PM,"Sheraton Boston, Independence Ballroom",American Economic Association,The Economics of Secular Stagnation,A1,Robert E. Hall,Stanford University,Robert E. Hall,Stanford University,William Nordhaus,Yale University,N. Gregory Mankiw,Harvard University,,,,,ROBERT GORDON,Male,,,,,,NA,NA,NA,NA,NA
Robert Kaestner,Publicly-Provided Health Insurance and Ex Ante Moral Hazard: The Case of Medicaid Expansions for Pregnant Women,University of Illinois-Chicago and NBER,Jan 03 2015,2:30 PM,"Boston Marriott Copley, Provincetown",Health Economics Research Organization,"Behavioral Responses to Health Information (I1, H8)",,Michael Grossman,"City University of New York, NBER and IZA",Jason Hockenberry,Emory University and NBER,Joshua Graff Zivin,University of California-San Diego and NBER,Dhaval M. Dave,Bentley University and NBER,Paul Glewwe,University of Minnesota,,,Robert Kaestner,Male,,,,,,NA,NA,NA,NA,NA
Robert Kulick,High Growth Young Firms and United States Job and Productivity Growth,University of Maryland,Jan 05 2015,10:15 AM,"Hynes Convention Center, Room 207",American Economic Association,"Macroeconomics with Rich Microdata: Implications for Policy (E2, O1)",,John Haltiwanger,University of Maryland,,,,,,,,,,,Robert Kulick,Male,,,,,,NA,NA,NA,NA,NA
