author,paper_title,author_affiliation,date,time,location,association,session_title,session_jel_code,session_chair,session_chair_affiliation,discussant_1,discussant_1_affiliation,discussant_2,discussant_2_affiliation,discussant_3,discussant_3_affiliation,discussant_4,discussant_4_affiliation,discussant_5,discussant_5_affiliation,author.y,gender,alternative_1,alternative_2,alternative_3,alternative_4,alternative_5,X,X.1,X.2,X.3,X.4
Joseph B. Nichols,"Safe Collateral, Arm’s-length Credit: Evidence From the Commercial Real Estate Mortgage Market",Federal Reserve Board,Jan. 7 2018,8:00 AM - 10:00 AM,"Loews Philadelphia, PSFS","International Banking, Economics, and Finance Association",Determinants of Bank Lending,G2,NA,NA,Bent Vale,Norges Bank,Michael Koetter,Leibniz Institute for Economic Research and Otto-von-Guericke University,Hector Perez-Saiz,Bank of Canada,Ronel Elul,Federal Reserve Bank of Philadelphia,,,JOSEPH B. NICHOLS,Male,,,,,,NA,NA,NA,NA,NA
Joseph S. Shapiro,The Environmental Bias of Trade Policy,Yale University,Jan. 7 2018,8:00 AM - 10:00 AM,"Marriott Philadelphia Downtown, Grand Ballroom Salon C",American Economic Association,The Costs and Benefits of Environmental Regulation in the United States and China,"Q5, Q0",NA,NA,Steven L. Puller,Texas A&M University,Catherine Wolfram,University of California-Berkeley,Nancy Rose,Massachusetts Institute of Technology,Maureen Cropper,University of Maryland,,,Joseph S. Shapiro,Male,,,,,,NA,NA,NA,NA,NA
Joseph Shapiro,Regulating Mismeasured Pollution: Implications of Firm Heterogeneity for Environmental Policy,Yale University,Jan. 5 2018,8:00 AM - 10:00 AM,"Marriott Philadelphia Downtown, Grand Ballroom Salon E",American Economic Association,Climate Policy and Trade,F1,NA,NA,Matilde Bombardini,University of British Columbia,Teresa Fort,Dartmouth College,Thibault Fally,University of California-Berkeley,,,,,Joseph Shapiro,Male,,,,,,NA,NA,NA,NA,NA
Joshua Aizenman,The Interest Rate Effect on Private Saving: Alternative Perspectives,University of Southern California,Jan. 5 2018,8:00 AM - 10:00 AM,"Loews Philadelphia, Parlor 1",International Economics and Finance Society,International Finance and Macroeconomics,F3,NA,NA,,,,,,,,,,,JOSHUA AIZENMAN,Male,,,,,,NA,NA,NA,NA,NA
Joshua D. Gottlieb,Does Career Risk Deter Potential Entrepreneurs?,University of British Columbia and NBER,Jan. 5 2018,2:30 PM - 4:30 PM,"Marriott Philadelphia Downtown, Liberty Ballroom Salon B",American Economic Association,Entrepreneurship and the Labor Market,"L2, J6",NA,NA,Christopher Stanton,Harvard Business School,Mark Duggan,Stanford University and NBER,Francine Lafontaine,University of Michigan,Robert Gibbons,Massachusetts Institute of Technology and NBER,,,Joshua D. Gottlieb,Male,Joshua Gottlieb,,,,,NA,NA,NA,NA,NA
Joshua D. Gottlieb,The Spill-over Effects of Top Income Inequality,University of British Columbia,Jan. 7 2018,8:00 AM - 10:00 AM,"Marriott Philadelphia Downtown, Meeting Room 415",Econometric Society,Top Income Inequality,"D3, J2",NA,NA,Stefanie Stantcheva,Harvard University,Jeffrey Paul Clemens,University of California-San Diego,Johannes F. Schmieder,Boston University,David Cesarini,New York University,,,Joshua D. Gottlieb,Male,Joshua Gottlieb,,,,,NA,NA,NA,NA,NA
Joshua Gans,Human Judgment and A.I. Pricing,University of Toronto,Jan. 6 2018,2:30 PM - 4:30 PM,"Marriott Philadelphia Downtown, Grand Ballroom Salon E",American Economic Association,Economic Consequences of Artificial Intelligence and Robotics,"O4, O4",NA,NA,Benjamin Jones,Northwestern University,Shane Greenstein,Harvard Business School,Susan Helper,Case Western Reserve University,Miguel Villas-Boas,University of California-Berkeley,,,JOSHUA GANS,Male,,,,,,NA,NA,NA,NA,NA
Joshua Goodman,Nudging at a National Scale: Experimental Evidence From a FAFSA Completion Campaign,Harvard University,Jan. 5 2018,8:00 AM - 10:00 AM,"Pennsylvania Convention Center, 104-B",American Economic Association,Issues Relating to Higher Education Financing,"J0, I2",NA,NA,Seth Zimmerman,University of Chicago,Lesley Turner,University of Maryland,,,,,,,Joshua Goodman,Male,,,,,,NA,NA,NA,NA,NA
Joshua Lewis,The Effects of the Clean Air Act on Productivity in the Electricity Industry: Evidence From the United States 1938-1993,University of Toronto,Jan. 7 2018,8:00 AM - 10:00 AM,"Marriott Philadelphia Downtown, Grand Ballroom Salon C",American Economic Association,The Costs and Benefits of Environmental Regulation in the United States and China,"Q5, Q0",NA,NA,Steven L. Puller,Texas A&M University,Catherine Wolfram,University of California-Berkeley,Nancy Rose,Massachusetts Institute of Technology,Maureen Cropper,University of Maryland,,,Joshua Lewis,Male,,,,,,NA,NA,NA,NA,NA
Joshua Linn,Does an Energy Efficiency Gap Exist in the Light-duty Vehicle Market? Evidence From Fuel-saving Technology Adoption,Resources for the Future,Jan. 5 2018,10:15 AM - 12:15 PM,"Pennsylvania Convention Center, 111-A",American Economic Association,Fuel Efficiency,"Q5, R4",NA,NA,Mark Jacobsen,University of California-San Diego,Jing Li,Massachusetts Institute of Technology,Hendrik Wolff,Simon Fraser University,Shanjun Li,Cornell University,,,JOSHUA LINN,Male,,,,,,NA,NA,NA,NA,NA
Juan Carlos Hatchondo,Sovereign Cocos and the Reprofiling of Debt Payments,Indiana University,Jan. 7 2018,10:15 AM - 12:15 PM,"Marriott Philadelphia Downtown, Meeting Room 309",American Economic Association,Sovereign Default,"F4, H3",NA,NA,Sandra Lizarazo,International Monetary Fund,Leonardo Martinez,International Monetary Fund,Tamon Asonuma,International Monetary Fund,Pablo D'Erasmo,Federal Reserve Bank of Philadelphia,,,Juan Carlos Hatchondo,Male,Juan C. Hatchondo,Juan. Hatchondo,,,,NA,NA,NA,NA,NA
Juan Carlos Suarez Serrato,Tax Advantages and Imperfect Competition in Auctions for Municipal Bonds,Duke University,Jan. 6 2018,10:15 AM - 12:15 PM,"Pennsylvania Convention Center, 106-B",Econometric Society,Estimation and Interpretation of Tax Distortions,"H20, H21",NA,NA,Daniel Wilson,Federal Reserve Bank of San Francisco,Caroline Weber,University of Oregon,Joel Slemrod,University of Michigan,John N. Friedman,Brown University,,,Juan Carlos Suarez Serrato,Male,,,,,,NA,NA,NA,NA,NA
Juan Sanchez,Financing Ventures,Federal Reserve Bank of St. Louis,Jan. 6 2018,10:15 AM - 12:15 PM,"Pennsylvania Convention Center, 112-A",Chinese Economic Association in North America,Macroeconomics I,E0,NA,NA,Xuan Song Tam,City University of Hong Kong,Shane Hsuan-Li Su,National Taiwan University,Wan-Jung Cheng,Academia Sinica,Charles Ka Yui Leung,City University of Hong Kong,,,Juan Sanchez,Male,,,,,,NA,NA,NA,NA,NA
Juhani T. Linnainmaa,Financial Advisors and Risk-taking,University of Southern California,Jan. 5 2018,2:30 PM - 4:30 PM,"Loews Philadelphia, Lescaze",Association of Financial Economists,Behavioral Finance,"G2, Y9",NA,NA,Malcolm Baker,Harvard Business School,Kim Peijnenburg,HEC Paris,Eric So,Massachusetts Institute of Technology,Tobias J. Moskowitz,Yale University,,,Juhani T. Linnainmaa,Male,,,,,,NA,NA,NA,NA,NA
Juhani T. Linnainmaa,"Hedge Funds, Signaling, and Optimal Lockups",University of Southern California,Jan. 7 2018,1:00 PM - 3:00 PM,"Loews Philadelphia, Commonwealth Hall B",American Finance Association,Liquidity: Theoretical Models,G1,NA,NA,Pierre-Olivier Weill,University of California-Los Angeles,Ana Babus,Federal Reserve Bank of Chicago,Hong Liu,Washington University-St. Louis,Haoxiang Zhu,Massachusetts Institute of Technology,,,Juhani T. Linnainmaa,Male,,,,,,NA,NA,NA,NA,NA
Julian Di Giovanni,The Welfare Consequences of Income-Induced Expenditure Switching,ICREA-UPF,Jan. 6 2018,8:00 AM - 10:00 AM,"Pennsylvania Convention Center, 105-A",American Economic Association,Demand Non-homotheticities over the Business Cycle,"E3, F3",NA,NA,Jing Zhang,Federal Reserve Bank of Chicago,Alberto Cavallo,Massachusetts Institute of Technology,Jessie Handbury,University of Pennsylvania,Colin Hottman,Federal Reserve Board,,,JULIAN DI GIOVANNI,Male,,,,,,NA,NA,NA,NA,NA
Juliane Begenau,Firm Selection and Corporate Cash Holdings,Harvard Business School,Jan. 7 2018,10:15 AM - 12:15 PM,"Loews Philadelphia, Commonwealth Hall C",American Finance Association,Corporate Liquidity,G3,NA,NA,Joao Gomes,University of Pennsylvania,Sheridan Titman,University of Texas-Austin,Mitchell Petersen,Northwestern University,,,,,Juliane Begenau,Female,,,,,,NA,NA,NA,NA,NA
Julien Cujean,The Lost Capital Asset Pricing Model,University of Maryland,Jan. 7 2018,8:00 AM - 10:00 AM,"Loews Philadelphia, Commonwealth Hall C",American Finance Association,Taming and Explaining Anomalies,G1,NA,NA,Laura Veldkamp,New York University,Christopher Polk,London School of Economics,Victor Chernozhukov,Massachusetts Institute of Technology,Ralph Koijen,New York University,,,Julien Cujean,Male,,,,,,NA,NA,NA,NA,NA
Julien Martin,Volatility in the Small and in the Large: The Lack of Diversification in International Trade,University of Quebec-Montreal,Jan. 6 2018,10:15 AM - 12:15 PM,"Pennsylvania Convention Center, 104-B",American Economic Association,Transmission of Shocks Across Countries,"F4, E3",NA,NA,Yuriy Gorodnichenko,University of California-Berkeley,Ryan Monarch,Federal Reserve Board,Wataru Miyamoto,Bank of Canada,Kei-Mu Yi,University of Houston,,,Julien Martin,Male,,,,,,NA,NA,NA,NA,NA
Julien Sauvagnat,Import Competition and Household Debt,Bocconi University,Jan. 7 2018,1:00 PM - 3:00 PM,"Loews Philadelphia, Commonwealth Hall C",American Finance Association,The Causes and Consequences of Household Borrowing,G2,NA,NA,Benjamin J. Keys,University of Pennsylvania,Eric Zwick,University of Chicago,Will Dobbie,Princeton University,Andreas Fuster,Federal Reserve Bank of New York,,,Julien Sauvagnat,Male,,,,,,NA,NA,NA,NA,NA
Jun Li,The Collateralizability Premium,Goethe University Frankfurt,Jan. 5 2018,10:15 AM - 12:15 PM,"Loews Philadelphia, Commonwealth Hall D",American Finance Association,Production-Based Asset Pricing and the Cross-section of Returns,G1,NA,NA,Mindy Z. Xiaolan,University of Texas-Austin,Jules van Binsbergen,University of Pennsylvania,Juhani T. Linnainmaa,University of Southern California,Xiaoji Lin,Ohio State University,,,Jun Li,Unknown,,,,,,NA,NA,NA,NA,NA
Jure Leskovec,Human Decisions and Machine Predictions,Stanford University,Jan. 6 2018,2:30 PM - 4:30 PM,"Marriott Philadelphia Downtown, Liberty Ballroom Salon A",American Economic Association,Advances in Big Data Research in Economics,"J0, E2",NA,NA,,,,,,,,,,,Jure Leskovec,Male,,,,,,NA,NA,NA,NA,NA
Jushan Bai,Efficient Estimation of Panel Data Model with Interactive Effects Using High Dimensional Covariance Matrix,Columbia University,Jan. 6 2018,10:15 AM - 12:15 PM,"Marriott Philadelphia Downtown, Meeting Room 306",Korea-America Economic Association,Recent Developments in Factor Models and Time Series Analysis,"C2, C4",NA,NA,,,,,,,,,,,JUSHAN BAI,Male,,,,,,NA,NA,NA,NA,NA
Justin Murfin,Hidden in Plain Sight: Equity Price Discovery With Informed Private Debt,Yale University,Jan. 5 2018,8:00 AM - 10:00 AM,"Loews Philadelphia, Commonwealth Hall A2",American Finance Association,Market Mispricing,G1,NA,NA,Xing Huang,Michigan State University,Kent Daniel,Columbia University,Itzhak Ben-David,Ohio State University and NBER,Joseph Engelberg,University of California-San Diego,,,JUSTIN MURFIN,Male,,,,,,NA,NA,NA,NA,NA
Justin Wolfers,What Did Financial Markets Think of the 2016 Election,University of Michigan,Jan. 7 2018,1:00 PM - 3:00 PM,"Marriott Philadelphia Downtown, Grand Ballroom Salon C",American Economic Association,What Can We Learn From Financial Market Responses to the 2016 Election?,G1,NA,NA,,,,,,,,,,,JUSTIN WOLFERS,Male,,,,,,NA,NA,NA,NA,NA
Kai Carstensen,Firms’ Uncertainty and Ambiguity,University of Kiel,Jan. 6 2018,12:30 PM - 2:15 PM,"Loews Philadelphia, Washington C",Society for Economic Dynamics,New Approaches in Measuring Uncertainty,"D2, G1",NA,NA,,,,,,,,,,,Kai Carstensen,Male,,,,,,NA,NA,NA,NA,NA
Kai Li,The Collateralizability Premium,Hong Kong University of Science and Technology,Jan. 5 2018,10:15 AM - 12:15 PM,"Loews Philadelphia, Commonwealth Hall D",American Finance Association,Production-Based Asset Pricing and the Cross-section of Returns,G1,NA,NA,Mindy Z. Xiaolan,University of Texas-Austin,Jules van Binsbergen,University of Pennsylvania,Juhani T. Linnainmaa,University of Southern California,Xiaoji Lin,Ohio State University,,,Kai Li,Male,,,,,,NA,NA,NA,NA,NA
Kaiji Chen,Quantifying the Bank Lending Channel of China's Monetary Policy,Emory University,Jan. 5 2018,2:30 PM - 4:30 PM,"Pennsylvania Convention Center, 112-A",Chinese Economic Association in North America,The China Economy: Issues and Prospects,"P2, O1",NA,NA,Charles Ka Yui Leung,City University of Hong Kong,,,,,,,,,Kaiji Chen,Male,,,,,,NA,NA,NA,NA,NA
Kala Krishna,Trade and Minimum Wages in General Equilibrium: Theory and Evidence,Pennsylvania State University,Jan. 6 2018,8:00 AM - 10:00 AM,"Marriott Philadelphia Downtown, Meeting Room 414",Econometric Society,Advances in International Trade,A1,NA,NA,,,,,,,,,,,KALA KRISHNA,Female,,,,,,NA,NA,NA,NA,NA
Kalina Manova,The Origins of Firm Heterogeneity: A Production Network Approach,University of Oxford,Jan. 5 2018,10:15 AM - 12:15 PM,"Pennsylvania Convention Center, 107-A",American Economic Association,Global Production Networks,"F1, R3",NA,NA,Thibault Fally,University of California-Berkeley,Felix Tintelnot,University of Chicago,Robert Johnson,Dartmouth College,,,,,Kalina Manova,Female,,,,,,NA,NA,NA,NA,NA
Kamal Saggi,Preferential Trade Agreements and Rules of the Multilateral Trading System,Vanderbilt University,Jan. 5 2018,10:15 AM - 12:15 PM,"Loews Philadelphia, Lescaze",International Economics and Finance Society,The Economics of International Trade Agreements,F1,NA,NA,,,,,,,,,,,KAMAL SAGGI,Male,,,,,,NA,NA,NA,NA,NA
Karam Kang,Understanding Disparities in Punishment: Regulator Preferences and Expertise,Carnegie Mellon University,Jan. 6 2018,8:00 AM - 10:00 AM,"Marriott Philadelphia Downtown, Meeting Room 405",Econometric Society,Firm Responses to Incentives and Regulation,"L2, L5",NA,NA,Matthew Carl Weinberg,Drexel University,Brian McManus,University of North Carolina-Chapel Hill,Yao Luo,University of Toronto,Marc Rysman,Boston University,,,Karam Kang,Female,,,,,,NA,NA,NA,NA,NA
Karel Mertens,The Macroeconomic Effect of Government Asset Purchases: Evidence From Post-war United States Housing Credit Policy,Federal Reserve Bank of Dallas,Jan. 6 2018,10:15 AM - 12:15 PM,"Pennsylvania Convention Center, 107-B",American Economic Association,Empirical Analyses of Monetary and Credit Policies,E5,NA,NA,Annette Vissing-Jorgensen,University of California-Berkeley,Valerie Ramey,University of California-San Diego,Ricardo Reis,London School of Economics,Refet Gurkaynak,Bilkent University,,,Karel Mertens,Male,,,,,,NA,NA,NA,NA,NA
Karen Clay,The Effects of the Clean Air Act on Productivity in the Electricity Industry: Evidence From the United States 1938-1993,Carnegie Mellon University,Jan. 7 2018,8:00 AM - 10:00 AM,"Marriott Philadelphia Downtown, Grand Ballroom Salon C",American Economic Association,The Costs and Benefits of Environmental Regulation in the United States and China,"Q5, Q0",NA,NA,Steven L. Puller,Texas A&M University,Catherine Wolfram,University of California-Berkeley,Nancy Rose,Massachusetts Institute of Technology,Maureen Cropper,University of Maryland,,,KAREN CLAY,Female,,,,,,NA,NA,NA,NA,NA
Karen K. Lewis,The International Listing Gap and the Macroeconomy,University of Pennsylvania,Jan. 5 2018,8:00 AM - 10:00 AM,"Loews Philadelphia, Parlor 1",International Economics and Finance Society,International Finance and Macroeconomics,F3,NA,NA,,,,,,,,,,,Karen K. Lewis,Female,,,,,,NA,NA,NA,NA,NA
Karen Kopecky,"Old, Frail, and Uninsured: Accounting for Puzzles in the United States Long-term Care Insurance Market",Federal Reserve Bank of Atlanta,Jan. 7 2018,10:15 AM - 12:15 PM,"Pennsylvania Convention Center, 107-A",American Economic Association,Long-term Care Insurance,"D1, I1",NA,NA,Lee M. Lockwood,Northwestern University,Daniel Barczyk,McGill University,Corina Mommaerts,University of Wisconsin-Madison,Kim Peijnenburg,HEC Paris,,,KAREN KOPECKY,Female,,,,,,NA,NA,NA,NA,NA
Karen Palmer,Emissions Containment in Response to Carbon Market Prices,Resources for the Future,Jan. 5 2018,10:15 AM - 12:15 PM,"Marriott Philadelphia Downtown, Meeting Room 308",Transportation and Public Utilities Group,Topics in Energy Issues,"H0, Q4",NA,NA,Richard Melstrom,Loyola University Chicago,Lori Bennear,Duke University,Jonathan Lee,East Carolina University,Matthew Winden,University of Wisconsin-Whitewater,,,KAREN PALMER,Female,,,,,,NA,NA,NA,NA,NA
Karthik Muralidharan,Valuing School Choice: Using a Randomized Experiment to Validate Welfare Evaluation of Private School Vouchers,University of California-San Diego,Jan. 7 2018,8:00 AM - 10:00 AM,"Marriott Philadelphia Downtown, Meeting Room 414",Econometric Society,Theoretical and Empirical Innovations in I.O. Models,L0,NA,NA,Rodrigo Adao,Princeton University,Michael H. Riordan,Columbia University,Dirk Bergemann,Yale University,Adam Kapor,Columbia University,,,KARTHIK MURALIDHARAN,Male,,,,,,NA,NA,NA,NA,NA
Kelly Bedard,Leave-taking and Labor Market Attachment Under California's Paid Family Leave Program: New Evidence From Administrative Data,University of California-Santa Barbara,Jan. 6 2018,10:15 AM - 12:15 PM,"Marriott Philadelphia Downtown, Grand Ballroom Salon J",American Economic Association,Gender in the Workplace,"J1, Z1",NA,NA,Francine Blau,Cornell University,Kevin Lang,Boston University,,,,,,,Kelly Bedard,Female,,,,,,NA,NA,NA,NA,NA
Kenneth Froot,Media Reinforcement in International Financial Markets,Harvard Business School,Jan. 5 2018,8:00 AM - 10:00 AM,"Loews Philadelphia, Regency Ballroom C1",American Finance Association,"Analysts, News, Media and Market Sentiment",G1,NA,NA,Zhi Da,University of Notre Dame,Elisabeth Kempf,University of Chicago,Kenneth Ahern,University of Southern California,,,,,KENNETH FROOT,Male,,,,,,NA,NA,NA,NA,NA
Kenneth Gillingham,Attribute Substitution in Household Vehicle Portfolios,Yale University,Jan. 5 2018,10:15 AM - 12:15 PM,"Pennsylvania Convention Center, 111-A",American Economic Association,Fuel Efficiency,"Q5, R4",NA,NA,Mark Jacobsen,University of California-San Diego,Jing Li,Massachusetts Institute of Technology,Hendrik Wolff,Simon Fraser University,Shanjun Li,Cornell University,,,Kenneth Gillingham,Male,,,,,,NA,NA,NA,NA,NA
Kenneth Gillingham,"A Dynamic Model of Vehicle Ownership, Type Choice, and Usage",Yale University,Jan. 6 2018,8:00 AM - 10:00 AM,"Marriott Philadelphia Downtown, Meeting Room 405",Econometric Society,Firm Responses to Incentives and Regulation,"L2, L5",NA,NA,Matthew Carl Weinberg,Drexel University,Brian McManus,University of North Carolina-Chapel Hill,Yao Luo,University of Toronto,Marc Rysman,Boston University,,,Kenneth Gillingham,Male,,,,,,NA,NA,NA,NA,NA
Kenneth Hendricks,Testing Competition in United States Offshore Oil and Gas Lease Auctions,University of Wisconsin-Madison,Jan. 5 2018,12:30 PM - 2:15 PM,"Pennsylvania Convention Center, 203-A",Industrial Organization Society,Empirical Studies of Contracting: The Case of United States Oil and Gas Leases,"L1, L7",NA,NA,Matt Gentry,London School of Economics,Kenneth Hendricks,University of Wisconsin-Madison,Daniel A. Ackerberg,University of Texas-Austin,Kosuke Uetake,Yale University,,,Kenneth Hendricks,Male,,,,,,NA,NA,NA,NA,NA
Kent Daniel,One Brief Shining Moment(um): Past Momentum Performance and Momentum Reversals,Columbia University,Jan. 5 2018,2:30 PM - 4:30 PM,"Loews Philadelphia, Lescaze",Association of Financial Economists,Behavioral Finance,"G2, Y9",NA,NA,Malcolm Baker,Harvard Business School,Kim Peijnenburg,HEC Paris,Eric So,Massachusetts Institute of Technology,Tobias J. Moskowitz,Yale University,,,KENT DANIEL,Male,,,,,,NA,NA,NA,NA,NA
Kent Daniel,Short and Long Horizon Behavioral Factors,Columbia University,Jan. 6 2018,8:00 AM - 10:00 AM,"Loews Philadelphia, Regency AB",American Finance Association,Behavioral Finance:  Financial Market Anomalies and a Nobel Prize,G1,NA,NA,Robert Stambaugh,University of Pennsylvania,Marina Niessner,Yale University,Andrea Frazzini,"AQR Capital Management, LLC",Tobias Moskowitz,Yale University,Kent Daniel,Columbia University,KENT DANIEL,Male,,,,,,NA,NA,NA,NA,NA
Kent Daniel,"A Hidden Markov Model of Leverage Dynamics, Tail Risk, and Value-momentum Correlation",Columbia University,Jan. 7 2018,8:00 AM - 10:00 AM,"Loews Philadelphia, Regency Ballroom C2",American Finance Association,Volatility and Tail Risk,G1,NA,NA,Asaf Manela,Washington University-St. Louis,Tyler Muir,University of California-Los Angeles,Kris Jacobs,University of Houston,Jaroslav Borovicka,New York University,,,KENT DANIEL,Male,,,,,,NA,NA,NA,NA,NA
Kent Daniel,The Cross-section of Risk and Return,Columbia University,Jan. 5 2018,2:30 PM - 4:30 PM,"Loews Philadelphia, Commonwealth Hall B",American Finance Association,Big Data and the Cross-section of Stock Returns,G1,NA,NA,Yan Liu,Texas A&M University,Domenico Giannone,Federal Reserve Bank of New York,Michael Brandt,Duke University,Stefano Giglio,University of Chicago,,,KENT DANIEL,Male,,,,,,NA,NA,NA,NA,NA
Kerwin Kofi Charles,Price Shocks and Worker Safety: Evidence from Mining,University of Chicago,Jan. 5 2018,2:30 PM - 4:30 PM,"Pennsylvania Convention Center, 104-A",American Economic Association,The Provision and Valuation of Non-wage Job Attributes,J3,NA,NA,Brent Richard Hickman,University of Chicago,Kevin Lang,Boston University,Kurt Lavetti,Ohio State University,Danielle Li,Harvard Business School,,,Kerwin Kofi Charles,Male,KERWIN CHARLES,,,,,NA,NA,NA,NA,NA
Kevin Donovan,Eliminating Uncertainty in Market Access: The Impact of New Bridges in Rural Nicaragua,University of Notre Dame,Jan. 5 2018,2:30 PM - 4:30 PM,"Pennsylvania Convention Center, 105-A",American Economic Association,"Agricultural Productivity, With an International Perspective",O1,NA,NA,Dietrich Vollrath,University of Houston,Pamela Medina,University of Toronto,Tavneet Suri,Massachusetts Institute of Technology,Paul Scott,New York University,,,Kevin Donovan,Male,,,,,,NA,NA,NA,NA,NA
Kevin J. Fox,"The Digital Economy, New Products and Consumer Welfare",University of New South Wales-Sydney,Jan. 6 2018,2:30 PM - 4:30 PM,"Pennsylvania Convention Center, 106-A",Society of Government Economists,Innovation and Welfare Issues,"O3, E0",NA,NA,David G. Wiczer,Federal Reserve Bank of St. Louis and State University of New York-Stony Brook,Ed Steinmueller,University of Sussex,Mun Ho,Harvard University and Resources for the Future,David Byrne,Federal Reserve Board,,,KEVIN J. FOX,Male,Kevin Fox,,,,,NA,NA,NA,NA,NA
Kieu-Trang Nguyen,Do Tax Incentives for Research Increase Firm Innovation? An RD Design for R&D,London School of Economics and CEP,Jan. 7 2018,10:15 AM - 12:15 PM,"Marriott Philadelphia Downtown, Grand Ballroom Salon C",American Economic Association,Domestic and International Dimensions of Innovation Spillovers,"O3, F2",NA,NA,Felipe Saffie,University of Maryland,Philippe Aghion,Harvard University,Ann Harrison,University of Pennsylvania,Sina T. Ates,Federal Reserve Board,,,Kieu-Trang Nguyen,Female,,,,,,NA,NA,NA,NA,NA
Kjetil Storesletten,The Distributions of Income and Consumption Risk: Evidence From Norwegian Registry Data,University of Oslo,Jan. 5 2018,2:30 PM - 4:30 PM,"Marriott Philadelphia Downtown, Meeting Room 410",Econometric Society,Heterogeneity in Macroeconomics: Households and Firms,A1,NA,NA,,,,,,,,,,,KJETIL STORESLETTEN,Male,,,,,,NA,NA,NA,NA,NA
Kjetil Storesletten,TBD,University of Oslo,Jan. 6 2018,10:15 AM - 12:15 PM,"Pennsylvania Convention Center, 112-A",Chinese Economic Association in North America,Macroeconomics I,E0,NA,NA,Xuan Song Tam,City University of Hong Kong,Shane Hsuan-Li Su,National Taiwan University,Wan-Jung Cheng,Academia Sinica,Charles Ka Yui Leung,City University of Hong Kong,,,KJETIL STORESLETTEN,Male,,,,,,NA,NA,NA,NA,NA
Kosali Simon,Health Insurance and Mortality,Indiana University,Jan. 7 2018,8:00 AM - 10:00 AM,"Marriott Philadelphia Downtown, Grand Ballroom Salon J",Health Economics Research Organization,Contributed Papers in Health Economics,I1,NA,NA,Edward Norton,University of Michigan,Christopher (Kitt) Carpenter,Vanderbilt University,Robert Kaestner,University of California-Riverside,,,,,KOSALI SIMON,Female,,,,,,NA,NA,NA,NA,NA
Kosali Simon,The Effect of Minimum Wage Laws on Employer Health Insurance: Do Outside Options Matter?,Indiana University,Jan. 5 2018,2:30 PM - 4:30 PM,"Marriott Philadelphia Downtown, Meeting Room 307",American Society of Health Economists,Topics in Health Economics,I1,NA,NA,Jonathan Gruber,Massachusetts Institute of Technology,Mark Pauly,University of Pennsylvania,Laurence C. Baker,Stanford University,Anthony Lo Sasso,University of Illinois-Chicago,,,KOSALI SIMON,Female,,,,,,NA,NA,NA,NA,NA
Kose John,Do Trade Creditors Increase Employee Layoffs in Firms With a Works Council?,New York University,Jan. 7 2018,8:00 AM - 10:00 AM,"Loews Philadelphia, Lescaze",Association of Financial Economists,"Talent, Human Capital and Finance","G3, J5",NA,NA,Thomas Philippon,New York University,Edward D. Vanwesep,University of Colorado,Darren Filson,Claremont McKenna College,Abraham S. Ravid,Yeshiva University,,,KOSE JOHN,Male,,,,,,NA,NA,NA,NA,NA
Kosuke Aoki,Monetary and Financial Policies in Emerging Markets,Tokyo University,Jan. 7 2018,1:00 PM - 3:00 PM,"Marriott Philadelphia Downtown, Liberty Ballroom Salon B",American Economic Association,"Monetary Policy, Asset Price Spillovers and the Macroeconomy","E5, F4",NA,NA,Giancarlo Corsetti,University of Cambridge,Lawrence Christiano,Northwestern University,Giorgio E. Primiceri,Northwestern University,Frank Smets,European Central Bank,,,KOSUKE AOKI,Male,,,,,,NA,NA,NA,NA,NA
