author,paper_title,author_affiliation,date,time,location,association,session_title,session_jel_code,session_chair,session_chair_affiliation,discussant_1,discussant_1_affiliation,discussant_2,discussant_2_affiliation,discussant_3,discussant_3_affiliation,discussant_4,discussant_4_affiliation,discussant_5,discussant_5_affiliation,author.y,gender,alternative_1,alternative_2,alternative_3,alternative_4,alternative_5,X,X.1,X.2,X.3,X.4
Dean Karlan,"Social Networks, Financial Literacy and Index-Insurance",Yale University,Jan 05 2015,10:15 AM,"Hynes Convention Center, Room 201",American Economic Association,"Index Insurance in Developing Economies (O1, O3)",,Friederike Lenel,DIW Berlin,Ahmed Mushfiq Mobarak,Yale University,Karlijn Morsink,University of Oxford,Muthoni Ngatia,Tufts University,Mario J. Miranda,Ohio State University,,,DEAN KARLAN,Male,,,,,,NA,NA,NA,NA,NA
Dean Karlan,To Charge or Not to Charge: Evidence from a Health Produces Experiment in Uganda,Yale University and IPA,Jan 05 2015,8:00 AM,"Sheraton Boston, Back Bay Ballroom B",American Economic Association,"Consumer Choice and Welfare Through a Behavioral Lens: Empirical Evidence from Low-Income Populations (D1, D8)",,Ted O'Donoghue,Cornell University,Jonathan Robinson,University of California-Santa Cruz,Diane Schanzenbach,Northwestern University,Koichiro Ito,Boston University,Alex Rees-Jones,University of Pennsylvania,,,DEAN KARLAN,Male,,,,,,NA,NA,NA,NA,NA
Dean Yang,Combating Vote-Selling: A Field Experiment in the Philippines,University of Michigan,Jan 04 2015,10:15 AM,"Sheraton Boston, Commonwealth",American Economic Association,"Moral Values and Economic Behavior (A1, Z1)",,Alvin E. Roth,Stanford University,Andrei Shleifer,Harvard University,Judd Kessler,University of Pennsylvania,Theodore Bergstrom,University of California-Santa Barbara,Rodney Garratt,Federal Reserve Bank of New York,,,Dean Yang,Male,,,,,,NA,NA,NA,NA,NA
Dennis Kristensen,CCP and the Estimation of Nonseparable Dynamic Models,University College London,Jan 05 2015,1:00 PM,"Sheraton Boston, Beacon D",Econometric Society,Discrete Choice,C1,Jack Porter,University of Wisconsin,,,,,,,,,,,DENNIS KRISTENSEN,Male,,,,,,NA,NA,NA,NA,NA
Dennis Novy,Internal Trade Costs,University of Warwick,Jan 04 2015,2:30 PM,"Hynes Convention Center, Room 209",American Economic Association,"Domestic Trade Costs (F1, F6)",,Dennis Novy,University of Warwick,Yoto Yotov,Drexel University,Mario Larch,University of Bayreuth,Trevor Tombe,University of Calgary,Natalia Ramondo,University of California-San Diego,,,DENNIS NOVY,Male,,,,,,NA,NA,NA,NA,NA
Dennis Novy,Market Potential and Global Growth over the Long Twentieth Century,University of Warwick and CEPR,Jan 03 2015,10:15 AM,"Sheraton Boston, Exeter Room",Transportation & Public Utilities Group/American Economic Association,"International Trade and Transportation (L9, F6)",,Wayne Kenneth Talley,Old Dominion University,Benjamin Bridgman,U.S. Bureau of Economic Analysis,Wesley Wilson,University of Oregon,Wayne Kenneth Talley,Old Dominion University,Georg Schaur,University of Tennessee,,,DENNIS NOVY,Male,,,,,,NA,NA,NA,NA,NA
Derek Neal,Allocations of Effort and Talent in Professional Labor Markets,University of Chicago,Jan 04 2015,8:00 AM,"Hynes Convention Center, Room 202",American Economic Association,"The Economics of Organizations (M5, L2)",,Michael Waldman,Cornell University,Yanhui Wu,University of Southern California,Catherine Barrera,Cornell University,Jin Li,Northwestern University,Charles Bellemare,Laval University,,,DEREK NEAL,Male,,,,,,NA,NA,NA,NA,NA
Devesh Raval,Industrial Reorganization: Learning about Substitution Patterns from Natural Experiments,Federal Trade Commission,Jan 05 2015,10:15 AM,"Hynes Convention Center, Room 203",American Economic Association,"Industrial Organization of Health Care (L1, I1)",,Martin Gaynor,Federal Trade Commission,Tim Bresnahan,Stanford University,Gautam Gowrisankaran,University of Arizona,Aviv Nevo,U.S. Department of Justice,Nathan Miller,Georgetown University,,,Devesh Raval,Male,,,,,,NA,NA,NA,NA,NA
Devin Pope,Reference-Dependent Preferences: Evidence from Marathon Runners,University of Chicago,Jan 05 2015,10:15 AM,"Sheraton Boston, The Fens",American Economic Association,"Non-Financial, Extrinsic Motivation and Employee Job Performance (D2, J2)",,Susanne Neckermann,Erasmus University Rotterdam,Iwan Barankay,University of Pennsylvania,Robert Gibbons,Massachusetts Institute of Technology,Nicola Lacetera,University of Toronto,Roberto Weber,University of Zurich,,,DEVIN POPE,Male,,,,,,NA,NA,NA,NA,NA
Diego Restuccia,"Misallocation, Establishment Size, and Productivity",University of Toronto,Jan 03 2015,10:15 AM,"Sheraton Boston, Beacon B",American Economic Association,Productivity,O1,Shawn Sprague,Bureau of Labor Statistics,,,,,,,,,,,DIEGO RESTUCCIA,Male,,,,,,NA,NA,NA,NA,NA
Dimitri Vayanos,Liquidity Risk and the Dynamics of Arbitrage Capital,London School of Economics,Jan 03 2015,2:30 PM,"Westin Copley, Essex Center",American Finance Association,Liquidity Risk,G1,Jennifer Huang,Cheung Kong Graduate School of Business,Albert S. Kyle,University of Maryland,Mathijs van Dijk,Erasmus University Rotterdam,Joel Hasbrouck,New York University,,,,,DIMITRI VAYANOS,Male,,,,,,NA,NA,NA,NA,NA
Dirk Krueger,Optimal Capital and Progressive Labor Income Taxation with Endogenous Schooling Decisions and Intergenerational Transfers,University of Pennsylvania,Jan 03 2015,10:15 AM,"Sheraton Boston, Beacon E",Econometric Society,"Policies to Foster Human Capital (I2, J2)",,Dirk Krueger,University of Pennsylvania,,,,,,,,,,,DIRK KRUEGER,Male,,,,,,NA,NA,NA,NA,NA
Dmitriy Sergeyev,Growth-Rate and Uncertainty Shocks in Consumption: Cross-Country Evidence,Bocconi University,Jan 04 2015,10:15 AM,"Hynes Convention Center, Room 207",American Economic Association,"Shocks and Disasters (E2, G1)",,Steven J. Davis,University of Chicago,,,,,,,,,,,Dmitriy Sergeyev,Male,,,,,,NA,NA,NA,NA,NA
Dmytro Hryshko,"Moving to a Job: The Role of Home Equity, Debt, and Access to Credit",University of Alberta,Jan 03 2015,2:30 PM,"Westin Copley, Great Republic",American Real Estate & Urban Economic Association,"The Interaction between Housing and Labor Markets: Structural Approaches (J6, R2)",,Edward Coulson,University of Nevada-Las Vegas,Kamila Sommer,Federal Reserve Board,Satyajit Chatterjee,Federal Reserve Bank of Philadelphia,Christopher Palmer,University of California-Berkeley,Serena Rhee,University of Hawaii,,,DMYTRO HRYSHKO,Male,,,,,,NA,NA,NA,NA,NA
Don Fullerton,A Model of the Model: Unpacking CGE Results on Leakage from Climate Policy,University of Illinois-Urbana‑Champaign,Jan 05 2015,8:00 AM,"Sheraton Boston, Hampton Room",Association of Environmental & Resource Economists,"Regulation and Governance (Q5, H2)",,Erin Mansur,Dartmouth College,Erin Mansur,Dartmouth College,Karen Fisher-Vanden,Pennsylvania State University,Anna Alberini,University of Maryland,Roberton Williams,University of Maryland,,,DON FULLERTON,Male,,,,,,NA,NA,NA,NA,NA
Don Fullerton,What Drives Forest Leakage?,University of Illinois-Urbana‑Champaign,Jan 04 2015,8:00 AM,"Sheraton Boston, Hampton Room",Association of Environmental & Resource Economists,"Natural Resources: Economic Impacts and Valuation (Q5, Q2)",,Michael Hanemann,Arizona State University,Michael Hanemann,Arizona State University,Paul Rhode,University of Michigan,Katharine Sims,Amherst College,Marshall Burke,University of California-Berkeley,,,DON FULLERTON,Male,,,,,,NA,NA,NA,NA,NA
Dong Lou,The Booms and Busts of Beta Arbitrage,London School of Economics,Jan 03 2015,10:15 AM,"Westin Copley, America North",American Finance Association,Macro Asset Pricing,G2,Lorenzo Garlappi,University of British Columbia,Ravi Jagannathan,Northwestern University,Sheridan Titman,University of Texas-Austin,Tobias Moskowitz,University of Chicago,Jessica Wachter,University of Pennsylvania,,,Dong Lou,Male,,,,,,NA,NA,NA,NA,NA
Douglas L. Miller,Robust Inference with Dyadic Data,University of California-Davis,Jan 05 2015,10:15 AM,"Sheraton Boston, Berkeley Room",Econometric Society,Estimating Sampling Variances and Robust Inference,C1,Whitney Newey,Massachusetts Institute of Technology,,,,,,,,,,,Douglas L. Miller,Male,,,,,,NA,NA,NA,NA,NA
Duncan Simester,Informational Rigidities and the Stickiness of Temporary Sales,Massachusetts Institute of Technology,Jan 03 2015,2:30 PM,"Boston Marriott Copley, Grand Ballroom—Salon D",Society for Economic Dynamics,Rigidities and Macroeconomic Dynamics,E3,Yuriy Gorodnichenko,University of California-Berkeley,Ben Malin,Federal Reserve Bank of Minneapolis,Ruediger Bachmann,University of Notre Dame,Justin Wolfers,University of Michigan,Ricardo Reis,Columbia University,,,Duncan Simester,Male,,,,,,NA,NA,NA,NA,NA
E. Glen Weyl,Quadratic Voting,Microsoft Research New England,Jan 04 2015,10:15 AM,"Boston Marriott Copley, Vermont",Economic Science Association,"Political Engineering (D7, D6)",,T. Nicolaus Tideman,Virginia Tech,Eric S. Maskin,Harvard University,Richard J. Zeckhauser,Harvard University,John Morgan,University of California-Berkeley,Erik Snowberg,California Institute of Technology,,,E. Glen Weyl,Male,Glen Weyl,,,,,NA,NA,NA,NA,NA
Edmund Malesky,Does Economic Growth Reduce Corruption? Theory and Evidence from Vietnam,Duke University,Jan 03 2015,2:30 PM,"Boston Marriott Copley, Tremont",Association for Comparative Economic Studies/American Economic Association,"Politics, Ownership, and Economic Outcomes (O1, P5)",,Dennis Tao Yang,University of Virginia,Werner Troesken,University of Pittsburgh,Rebecca Diamond,Stanford University,Xiaodong Zhu,University of Toronto,Yasheng Huang,Massachusetts Institute of Technology,,,Edmund Malesky,Male,,,,,,NA,NA,NA,NA,NA
Eduardo Morales,"State Taxes, Internal Trade and Spatial Misallocation in the United States Economy",Princeton University,Jan 04 2015,10:15 AM,"Hynes Convention Center, Room 202",American Economic Association,"Spatial Misallocation (H7, R1)",,Chang-Tai Hsieh,University of Chicago,Klaus Desmet,Universidad Carlos III Madrid,Jonathan I. Dingel,University of Chicago,Gilles Duranton,University of Pennsylvania,Lorenzo Caliendo,Yale University,,,Eduardo Morales,Male,,,,,,NA,NA,NA,NA,NA
Edward Kung,The Effect of Credit Availability on House Prices: Evidence from the Economic Stimulus Act of 2008,University of California-Los Angeles,Jan 05 2015,10:15 AM,"Westin Copley, Great Republic",American Real Estate & Urban Economic Association,"The Consequences of the GSEs (G2, G1)",,Richard Buttimer,University of North Carolina-Charlotte,Vincent W. Yao,Fannie Mae,Philip Seagraves,University of Wisconsin-Whitewater,Carlos Slawson,Louisiana State University,Craig Depken,University of North Carolina-Charlotte,,,Edward Kung,Male,,,,,,NA,NA,NA,NA,NA
Edward Kung,What's Behind the Food Truck Phenomenon? Information Frictions and Taste-for-Variety,University of California-Los Angeles,Jan 05 2015,1:00 PM,"Sheraton Boston, Independence Ballroom East",American Economic Association,New Data Sources from the Internet in Microeconomic Research,D8,Edward Kung,University of California-Los Angeles,,,,,,,,,,,Edward Kung,Male,,,,,,NA,NA,NA,NA,NA
Efraim Benmelech,Financial Contracts and the Macro Economy,Northwestern University,Jan 03 2015,8:00 AM,"Sheraton Boston, Beacon E",Econometric Society,Financial Contracts and the Macro Economy,G3,Efraim Benmelech,Northwestern University,Michael Weisbach,Ohio State University,Samuel Hanson,Harvard Business School,Adi Sunderam,Harvard Business School,Jennifer Dlugosz,Washington University-St. Louis,,,EFRAIM BENMELECH,Male,,,,,,NA,NA,NA,NA,NA
Efraim Benmelech,"Liquidity, Non-Bank Credit and the Financial Crisis: Evidence from Automobiles",Northwestern University,Jan 05 2015,8:00 AM,"Sheraton Boston, Independence Ballroom East",American Economic Association,Autos and the Business Cycle,E2,Karen Pence,Federal Reserve Board,Daniel Sichel,Wellesley College,Robert Barsky,Federal Reserve Bank of Chicago,Meghan Busse,Northwestern University,Gabriel Chodorow-Reich,Harvard University,,,EFRAIM BENMELECH,Male,,,,,,NA,NA,NA,NA,NA
Elena Carletti,Deposits and Bank Capital Structure,Bocconi University,Jan 05 2015,10:15 AM,"Boston Marriott Copley, Grand Ballroom—Salon C",Association of Financial Economists,"Optimal Bank Capital (G2, G3)",,Lemma W. Senbet,AERC and University of Maryland,Gary Gorton,Yale University,Florian Heider,European Central Bank,George Pennacchi,University of Illinois,Lubomir Litov,University of Arizona,,,ELENA CARLETTI,Female,,,,,,NA,NA,NA,NA,NA
Elena Pastorino,Debt Constraints and Employment,University of Minnesota,Jan 04 2015,2:30 PM,"Sheraton Boston, Beacon G",Econometric Society,"Labor Markets in the Great Recession (E3, J2)",,Patrick Kehoe,University of Minnesota,,,,,,,,,,,Elena Pastorino,Female,,,,,,NA,NA,NA,NA,NA
Elhanan Helpman,Globalization and Growth,Harvard University,Jan 03 2015,10:15 AM,"Sheraton Boston, Constitution Ballroom A",American Economic Association,Reflections on New Growth Theory,O4,Charles I. Jones,Stanford University,,,,,,,,,,,ELHANAN HELPMAN,Male,,,,,,NA,NA,NA,NA,NA
Eli Berman,Expanding Governance as Development: Evidence on Child Nutrition in the Philippines,University of California-San Diego,Jan 04 2015,2:30 PM,"Boston Marriott Copley, Harvard",Peace Science Society International/American Economic Association,"Empirical Analyses of the Impact of Conflict (H5, F5)",,Carlos Seiglie,Rutgers University,Luis Locay,University of Miami,Solomon W. Polachek,State University of New York-Binghamton,,,,,,,ELI BERMAN,Male,,,,,,NA,NA,NA,NA,NA
Eli Liebman,U.S. Drug Shortages in Retail and Hospital Channels,Duke University,Jan 04 2015,2:30 PM,"Sheraton Boston, Berkeley Room",International Health Economics Association,Competition and Regulation in Pharmaceutical Markets,I1,Ernst R. Berndt,Massachusetts Institute of Technology,,,,,,,,,,,Eli Liebman,Male,,,,,,NA,NA,NA,NA,NA
Elisabeth Honka,"Advertising, Consumer Awareness and Choice: Evidence from the United States Banking Industry",University of Texas,Jan 03 2015,2:30 PM,"Boston Marriott Copley, Grand Ballroom—Salon H",Industrial Organization Society,The Industrial Organization of Financial Services,L1,Jean-Francois Houde,University of Pennsylvania,Marc Rysman,Boston University,Michael Grubb,Boston College,Victor Stango,University of California-Davis,Alessandro Gavazza,London School of Economics,,,Elisabeth Honka,Female,,,,,,NA,NA,NA,NA,NA
Elizabeth Brainerd,Religion and Health in Early Childhood: Evidence from the Indian Subcontinent,Brandeis University,Jan 05 2015,1:00 PM,"Sheraton Boston, Back Bay Ballroom B",American Economic Association,Women's Health Economics,I1,Lisa Schulkind,University of North Carolina-Charlotte,,,,,,,,,,,ELIZABETH BRAINERD,Female,,,,,,NA,NA,NA,NA,NA
Elizabeth Brainerd,Missing Women in the Former Soviet Union? Son Preference and Children’s Health in the Transition from Communism,Brandeis University,Jan 04 2015,2:30 PM,"Boston Marriott Copley, St. Botolph",Association for Comparative Economic Studies,"Gender Issues in Russia: Past and Present (J1, P3)",,John S. Earle,George Mason University,Richard Pomfret,University of Adelaide,Klara Sabirianova Peter,University of North Carolina,Donna Ginther,University of Kansas,Melanie Khamis,Wesleyan University,,,ELIZABETH BRAINERD,Female,,,,,,NA,NA,NA,NA,NA
Elizabeth King,Demystifying the East Asian Education Tigers,World Bank,Jan 05 2015,1:00 PM,"Boston Marriott Copley, Tufts",Society of Government Economists,"Returns to Child and Education Interventions (I2, D1)",,Quentin Wodon,World Bank,Elizabeth King,World Bank,Quentin Wodon,World Bank,Paul Glewwe,University of Minnesota,Harry Anthony Patrinos,World Bank,,,ELIZABETH KING,Female,,,,,,NA,NA,NA,NA,NA
Elliot Anenberg,What's Behind the Food Truck Phenomenon? Information Frictions and Taste-for-Variety,Federal Reserve Board,Jan 05 2015,1:00 PM,"Sheraton Boston, Independence Ballroom East",American Economic Association,New Data Sources from the Internet in Microeconomic Research,D8,Edward Kung,University of California-Los Angeles,,,,,,,,,,,Elliot Anenberg,Male,,,,,,NA,NA,NA,NA,NA
Elliot Anenberg,A More Timely House Price Index,Federal Reserve Board,Jan 03 2015,8:00 AM,"Westin Copley, Great Republic",American Real Estate & Urban Economic Association,"House Price Dynamics (R3, G1)",,Richard Green,University of Southern California,Lu Han,University of Toronto,Kerry Vandell,University of California-Irvine,Stephen Malpezzi,University of Wisconsin-Madison,Christian Redfearn,University of Southern California,,,Elliot Anenberg,Male,,,,,,NA,NA,NA,NA,NA
Emi Nakamura,Informational Rigidities and the Stickiness of Temporary Sales,Columbia University,Jan 03 2015,2:30 PM,"Boston Marriott Copley, Grand Ballroom—Salon D",Society for Economic Dynamics,Rigidities and Macroeconomic Dynamics,E3,Yuriy Gorodnichenko,University of California-Berkeley,Ben Malin,Federal Reserve Bank of Minneapolis,Ruediger Bachmann,University of Notre Dame,Justin Wolfers,University of Michigan,Ricardo Reis,Columbia University,,,EMI NAKAMURA,Female,,,,,,NA,NA,NA,NA,NA
Emi Nakamura,Growth-Rate and Uncertainty Shocks in Consumption: Cross-Country Evidence,Columbia University,Jan 04 2015,10:15 AM,"Hynes Convention Center, Room 207",American Economic Association,"Shocks and Disasters (E2, G1)",,Steven J. Davis,University of Chicago,,,,,,,,,,,EMI NAKAMURA,Female,,,,,,NA,NA,NA,NA,NA
Emi Nakamura,High Frequency Identification of Monetary Non-Neutrality,Columbia University,Jan 03 2015,10:15 AM,"Westin Copley, Essex South",American Finance Association,Monetary Policy and Financial Markets,G2,Arvind Krishnamurthy,Stanford University,Eric Swanson,Federal Reserve Bank of San Francisco and University of California-Irvine,Stefan Nagel,University of Michigan,Yuriy Gorodnichenko,University of California-Berkeley,Anh Le,University of North Carolina,,,EMI NAKAMURA,Female,,,,,,NA,NA,NA,NA,NA
Emily Blanchard,Global Supply Chains and Trade Policy,Dartmouth College,Jan 03 2015,8:00 AM,"Hynes Convention Center, Room 206",American Economic Association,"International Trade with Global Value Chains (F1, F2)",,Davin Chor,National University of Singapore,Stephen Redding,Princeton University,Peter Schott,Yale University,Lorenzo Caliendo,Yale University,Ralph Ossa,University of Chicago,,,EMILY BLANCHARD,Female,,,,,,NA,NA,NA,NA,NA
Emily Owens,The Criminal Justice Response to Policy Interventions: Evidence from Immigration Reform,University of Pennsylvania,Jan 04 2015,2:30 PM,"Sheraton Boston, Independence Ballroom West",American Economic Association,Immigration Policy and Crime,H8,Paolo Pinotti,Bocconi University,,,,,,,,,,,Emily Owens,Female,,,,,,NA,NA,NA,NA,NA
Emily Owens,Alcohol Consumption and Violence against Women,University of Pennsylvania and Cornell University,Jan 05 2015,1:00 PM,"Sheraton Boston, Back Bay Ballroom D",American Economic Association,"What We Can Learn About Gender Differences from International Data and Immigrant Groups (J1, J2)",,Kevin Lang,Boston University,Robert Pollak,Washington University-St. Louis,Angela Dills,Providence College,Aimee Chin,University of Houston,Kevin Lang,Boston University,,,Emily Owens,Female,,,,,,NA,NA,NA,NA,NA
Emir Kamenica,Disclosure of Endogenous Information,University of Chicago,Jan 04 2015,10:15 AM,"Hynes Convention Center, Room 206",American Economic Association,Optimal Persuasion,D8,Tymofiy Mylovanov,University of Pittsburgh,Anton Kolotilin,University of New South Wales,Tymofiy Mylovanov,University of Pittsburgh,Emir Kamenica,University of Chicago,,,,,Emir Kamenica,Male,,,,,,NA,NA,NA,NA,NA
Emmanuel Farhi,Rare Disasters and Exchange Rates,Harvard University,Jan 04 2015,10:15 AM,"Hynes Convention Center, Room 207",American Economic Association,"Shocks and Disasters (E2, G1)",,Steven J. Davis,University of Chicago,,,,,,,,,,,EMMANUEL FARHI,Male,,,,,,NA,NA,NA,NA,NA
Emmanuel Farhi,Dilemma not Trilemma? Capital Controls and Exchange Rates with Volatile Capital Flows,Harvard University,Jan 04 2015,2:30 PM,"Hynes Convention Center, Room 207",American Economic Association,"Advances in Open Macroeconomics (F3, E4)",,Gita Gopinath,Harvard University,Adrien Verdelhan,Massachusetts Institute of Technology,Martin Schneider,Stanford University,Brent Neiman,University of Chicago,Helene Rey,London Business School,,,EMMANUEL FARHI,Male,,,,,,NA,NA,NA,NA,NA
Emmanuel Farhi,A Theory of Macroprudential Policies in the Presence of Nominal Rigidities,Harvard University,Jan 05 2015,10:15 AM,"Sheraton Boston, Back Bay Ballroom C",American Economic Association,"Aggregate Demand Externalities (E6, E2)",,Olivier Blanchard,International Monetary Fund,John Geanakoplos,Yale University,Gauti Eggertsson,Brown University,Guido Lorenzoni,Northwestern University,,,,,EMMANUEL FARHI,Male,,,,,,NA,NA,NA,NA,NA
Emmanuel Farhi,Deadly Embrace: Sovereign and Financial Balance Sheets Doom Loops,Harvard University,Jan 05 2015,1:00 PM,"Sheraton Boston, Constitution Ballroom A",American Economic Association,"Financial Constraints and Macroeconomic Risk (E3, F3)",,Jean Tirole,Toulouse School of Economics,Ricardo Caballero,Massachusetts Institute of Technology,Zhiguo He,University of Chicago,Thomas Philippon,New York University,Pierre-Olivier Gourinchas,University of California-Berkeley,,,EMMANUEL FARHI,Male,,,,,,NA,NA,NA,NA,NA
Emmanuel Farhi,The Safety Trap,Harvard University,Jan 04 2015,8:00 AM,"Hynes Convention Center, Room 207",American Economic Association,"Safe Assets (E2, G1)",,Valentin Haddad,Princeton University,Valentin Haddad,Princeton University,Gary Gorton,Yale University,Adi Sunderam,Harvard Business School,Vania Stavrakeva,London Business School,,,EMMANUEL FARHI,Male,,,,,,NA,NA,NA,NA,NA
Enrichetta Ravina,"Automatic Enrollment, Escalation, and Retirement Savings",Columbia University,Jan 05 2015,10:15 AM,"Hynes Convention Center, Room 209",American Economic Association,Incentives to Work,J3,Isaac Swensen,Montana State University,,,,,,,,,,,ENRICHETTA RAVINA,Female,,,,,,NA,NA,NA,NA,NA
Enrico Moretti,City Growth and Aggregate Growth,University of California-Berkeley,Jan 04 2015,10:15 AM,"Hynes Convention Center, Room 202",American Economic Association,"Spatial Misallocation (H7, R1)",,Chang-Tai Hsieh,University of Chicago,Klaus Desmet,Universidad Carlos III Madrid,Jonathan I. Dingel,University of Chicago,Gilles Duranton,University of Pennsylvania,Lorenzo Caliendo,Yale University,,,ENRICO MORETTI,Male,,,,,,NA,NA,NA,NA,NA
Enrique Seira,Assortative Matching of Exporters and Importers,Instituto Tecnológico Autónomo de México (ITAM),Jan 03 2015,10:15 AM,"Hynes Convention Center, Room 206",American Economic Association,"Buyer-Supplier Relationships in International Trade (F1, F6)",,James Tybout,Pennsylvania State University,Costas Arkolakis,Yale University,Bernardo Blum,University of Toronto,Amit Khandelwal,Columbia University,James Rauch,University of California-San Diego,,,ENRIQUE SEIRA,Male,,,,,,NA,NA,NA,NA,NA
Eric Anderson,Informational Rigidities and the Stickiness of Temporary Sales,Northwestern University,Jan 03 2015,2:30 PM,"Boston Marriott Copley, Grand Ballroom—Salon D",Society for Economic Dynamics,Rigidities and Macroeconomic Dynamics,E3,Yuriy Gorodnichenko,University of California-Berkeley,Ben Malin,Federal Reserve Bank of Minneapolis,Ruediger Bachmann,University of Notre Dame,Justin Wolfers,University of Michigan,Ricardo Reis,Columbia University,,,Eric Anderson,Male,,,,,,NA,NA,NA,NA,NA
Eric Bettinger,Virtually Large: The Effects of Class Size in Online College Courses,Stanford University,Jan 03 2015,8:00 AM,"Sheraton Boston, Public Garden",American Economic Association,"Experimental Evidence of the Impact of Online Education on Student Outcomes (I2, A2)",,Rebecca Maynard,University of Pennsylvania,David Deming,Harvard University,,,,,,,,,ERIC BETTINGER,Male,,,,,,NA,NA,NA,NA,NA
Eric Budish,Do Firms Underinvest in Long-Term Research? Evidence from Cancer Clinical Trials,University of Chicago,Jan 05 2015,8:00 AM,"Sheraton Boston, Constitution Ballroom B",American Economic Association,"Patent Economics (K2, O3)",,Joshua Lerner,Harvard University,Ufuk Akcigit,University of Pennsylvania,Petra Moser,Stanford University,Pierre Azoulay,Massachusetts Institute of Technology,Louis Kaplow,Harvard University,,,Eric Budish,Male,,,,,,NA,NA,NA,NA,NA
Eric Budish,Changing the Course Allocation Mechanism at Wharton,University of Chicago,Jan 03 2015,8:00 AM,"Hynes Convention Center, Room 209",American Economic Association,Empirical Market Design,D4,Ramesh Johari,Stanford University,Ali Hortacsu,University of Chicago,Steven Tadelis,University of California-Berkeley,Eduardo Azevedo,University of Pennsylvania,Eric Budish,University of Chicago,,,Eric Budish,Male,,,,,,NA,NA,NA,NA,NA
Eric Budish,"Primary-Market Auctions for Event Tickets: Eliminating the Rents of \Bob the Broker\""""",University of Chicago,Jan 03 2015,2:30 PM,"Sheraton Boston, Beacon E",Econometric Society,Empirical Analyses of Selling Mechanisms in Dynamic Environments,D4,Glenn Ellison,Massachusetts Institute of Technology,Jakub Kastl,Stanford University,Bradley Larsen,Stanford University,Glenn Ellison,Massachusetts Institute of Technology,,,,,Eric Budish,Male,,,,,,NA,NA,NA,NA,NA
Eric Chaney,Pirates of the Mediterranean: An Empirical Investigation of Bargaining with Transaction Costs,Harvard University,Jan 05 2015,10:15 AM,"Hynes Convention Center, Room 202",American Economic Association,"Empirical Studies of Bargaining with Incomplete Information (C5, C7)",,Bradley Larsen,Stanford University,Yasutora Watanabe,Northwestern University,Matthew Gentry,London School of Economics,Daniel Keniston,Yale University,Robin S. Lee,Harvard University,,,ERIC CHANEY,Male,,,,,,NA,NA,NA,NA,NA
