author,paper_title,author_affiliation,date,time,location,association,session_title,session_jel_code,session_chair,session_chair_affiliation,discussant_1,discussant_1_affiliation,discussant_2,discussant_2_affiliation,discussant_3,discussant_3_affiliation,discussant_4,discussant_4_affiliation,discussant_5,discussant_5_affiliation,author.y,gender,alternative_1,alternative_2,alternative_3,alternative_4,alternative_5,X,X.1,X.2,X.3,X.4
Elaine Liu,Does in Utero Exposure to Illness Matter? The 1918 Influenza Epidemic in Taiwan as a Natural Experiment,University of Houston,Jan 05 2014,8:00 AM,"Philadelphia Marriott, Grand Ballroom - Salon I",Association for Comparative Economic Studies,"Education, Health and Labor Market Outcomes: Comparative Evidence from Natural Experiments",I2,Melanie Khamis,Wesleyan University,Ira N. Gang,Rutgers University,Klara Sabirianova Peter,University of North Carolina-Chapel Hill,John P. Bonin,Wesleyan University,Nuria Rodriguez-Planas,IZA,,,Elaine Liu,Female,,,,,,NA,NA,NA,NA,NA
Elena Loukoianova,Global Liquidity through the Lens of Monetary Aggregates,International Monetary Fund,Jan 04 2014,8:00 AM,"Philadelphia Marriott, Meeting Rooms 408 & 409",Korea-America Economic Association/American Economic Association,Money in an Era of Financial Crisis and Recovery,E4,Michael Bordo,Rutgers University,Richard Porter,Federal Reserve Bank of Chicago,Benjamin Keen,University of Oklahoma,Bang Nam Jeon,Drexel University,Franceso Drudi,European Central Bank,,,ELENA LOUKOIANOVA,Female,,,,,,NA,NA,NA,NA,NA
Eleonora Patacchini,Peer Effects in the Demand for Housing Quality,Syracuse University,Jan 03 2014,2:30 PM,"Loews Philadelphia Hotel, Washington A",American Real Estate & Urban Economic Association,Housing Markets and Consumer Preferences,R2,Ed Olsen,University of Virginia,Judy Geyer,Abt Associates,Michael Eriksen,University of Georgia,Christopher Parmeter,University of Miami,Jaren Pope,Brigham Young University,,,ELEONORA PATACCHINI,Female,,,,,,NA,NA,NA,NA,NA
Eleonora Patacchini,Strong versus Weak Ties in Education,Syracuse University,Jan 05 2014,10:15 AM,"Loews Philadelphia Hotel, Washington A",American Real Estate & Urban Economic Association,"Neighborhoods, Amenities, and Education",R2,Stephen Ross,University of Connecticut,Gabrielle Fack,Universitat Pompeu Fabra,Rebecca Diamond,Stanford University,Adi Mayer,Washington College,Susane Leguizamon,Western Kentucky University,,,ELEONORA PATACCHINI,Female,,,,,,NA,NA,NA,NA,NA
Elhanan Helpman,Matching and Sorting in the Global Economy,Harvard University,Jan 03 2014,2:30 PM,"Pennsylvania Convention Center, 103-B",American Economic Association,Trade and Inequality,F1,Gene Grossman,Princeton University,Ann Harrison,University of Pennsylvania,Thomas Sampson,London School of Economics,Rafael Dix-Carneiro,University of Maryland,Justin Pierce,Federal Reserve Board,,,ELHANAN HELPMAN,Male,,,,,,NA,NA,NA,NA,NA
Eliana La Ferrara,Learning about the Enforcement of Conditional Welfare Programs: Evidence from the Bolsa Familia Program in Brazil,Bocconi University,Jan 05 2014,1:00 PM,"Philadelphia Marriott, Grand Ballroom - Salon A",American Economic Association,Welfare Policies in Latin American,I3,Flavio Cunha,University of Pennsylvania,Renata Narita,World Bank,Alex Solis,Uppsala University,Rita Ginja,Uppsala University,Pedro Carneiro,University College London,,,ELIANA LA FERRARA,Female,ELIANA LAFERRARA,,,,,NA,NA,NA,NA,NA
Elias Papaioannou,National Institutions and Subnational Development in Africa,London Business School,Jan 05 2014,8:00 AM,"Philadelphia Marriott, Grand Ballroom - Salon J",American Economic Association,History and Long-Term Development in Africa,O1,Leonard Wantchekon,Princeton University,Melissa Dell,Harvard University,David Albouy,University of Michigan,James Fenske,Oxford University,Hoyt Bleakley,University of Chicago,,,ELIAS PAPAIOANNOU,Male,,,,,,NA,NA,NA,NA,NA
Elira Kuka,Do In-Work Tax Credits Serve as a Safety Net?,University of California-Davis,Jan 03 2014,2:30 PM,"Philadelphia Marriott, Grand Ballroom - Salon L",American Economic Association,Behavioral Responses to Taxation,H2,Nathaniel Hendren,Harvard University,Hilary W. Hoynes,University of California-Davis,Dayanand S. Manoli,University of Texas-Austin,Wojciech Kopczuk,Columbia University,Nathaniel Hendren,Harvard University,,,Elira Kuka,Female,,,,,,NA,NA,NA,NA,NA
Elisabeth Sadoulet,Social Networks and the Decision to Insure,University of California-Berkeley,Jan 03 2014,8:00 AM,"Pennsylvania Convention Center, 203-A",American Economic Association,Sources of Peer Effects,D8,Bruce Sacerdote,Dartmouth University,Achyuta Adhvaryu,Yale University,Kenneth Ahern,University of Southern California,Scott Carrell,University of California-Davis,John Beshears,Harvard University,,,Elisabeth Sadoulet,Female,,,,,,NA,NA,NA,NA,NA
Elizabeth Walker,"Uncertainty, Self-Selection and the Design of Subsidies: Evidence from Zambia",Harvard University,Jan 05 2014,1:00 PM,"Pennsylvania Convention Center, 103-A",American Economic Association,"Deforestation, Land-Use Change and Contracts",Q5,Paul Scott,Tolouse School of Economics,,,,,,,,,,,Elizabeth Walker,Female,,,,,,NA,NA,NA,NA,NA
Elliot Anenberg,Endogenous Sources of Volatility in Housing Markets: The Joint Buyer-Seller Problem,Federal Reserve Board,Jan 03 2014,2:30 PM,"Pennsylvania Convention Center, 107-B",American Economic Association,Housing,R2,Lynn Fisher,University of North Carolina-Chapel Hill,,,,,,,,,,,Elliot Anenberg,Male,,,,,,NA,NA,NA,NA,NA
Emanuel Moench,Five Facts (and Some Theory) about Expectations,Federal Reserve Bank of New York,Jan 03 2014,2:30 PM,"Pennsylvania Convention Center, 106-B",Society of Government Economists,Information Rigidity in Survey Expectations,D8,Olivier Coibion,University of Texas-Austin,Paul Hubert,OFCE-Sciences PO,Benjamin K. Johannsen,Federal Reserve Board,Tara Sinclair,George Washington University,MIn Wei,Federal Reserve Board,,,EMANUEL MOENCH,Male,,,,,,NA,NA,NA,NA,NA
Emanuel Moench,Forecasting through the Rear-View Mirror: Data Revisions and Bond Return Predictability,Federal Reserve Bank of New York,Jan 03 2014,8:00 AM,"Loews Philadelphia Hotel, Commonwealth Hall D",American Finance Association,Macro Finance,G1,Ralph Koijen,University of Chicago,Jules van Binsbergen,Stanford University,Lars A. Lochstoer,Columbia University,Leonid Kogan,Massachusetts Institute of Technology,,,,,EMANUEL MOENCH,Male,,,,,,NA,NA,NA,NA,NA
Emanuele Massetti,Do Temperature Thresholds Threaten American Farmland?,Yale University,Jan 04 2014,2:30 PM,"Philadelphia Marriott, Grand Ballroom - Salon K",Association of Environmental & Resource Economists,"Agriculture, Land Use and Climate",Q1,Maximilian Auffhammer,University of California-Berkeley,Michael Roberts,University of Hawaii,Cathy Kling,Iowa State University,Ram Fishman,George Washington University,Eduardo A. Souza-Rodrigues,University of Toronto,,,Emanuele Massetti,Male,,,,,,NA,NA,NA,NA,NA
Emek Basker,Taken by Storm: Business Survival in the Aftermath of Hurricane Katrina,University of Missouri,Jan 05 2014,10:15 AM,"Pennsylvania Convention Center, 103-A",American Economic Association,Economic Impacts of Natural Disasters,Q5,Michael Greenstone,Massachusetts Institute of Technology,Jesse Gregory,University of Wisconsin-Madison,Till von Wachter,University of California-Los Angeles,Chad Syverson,University of Chicago,Emilia Simeonova,Johns Hopkins University,,,Emek Basker,Female,,,,,,NA,NA,NA,NA,NA
Emi Nakamura,Growth-Rate and Uncertainty Shocks in Consumption: Cross-Country Evidence,Columbia University,Jan 04 2014,2:30 PM,"Pennsylvania Convention Center, 108-B",American Economic Association,Global Risks and Currencies: Theory and Evidence,F3,Lars Hansen,University of Chicago,Viktor Todorov,Northwestern University,Jose Ursua,Goldman Sachs,Jessica Wachter,University of Pennsylvania,Lars Hansen,University of Chicago,,,EMI NAKAMURA,Female,,,,,,NA,NA,NA,NA,NA
Emilia Simeonova,"Health, Education and Cognition: Evidence from a Social Experiment",Tufts University,Jan 05 2014,8:00 AM,"Philadelphia Marriott, Grand Ballroom - Salon I",Association for Comparative Economic Studies,"Education, Health and Labor Market Outcomes: Comparative Evidence from Natural Experiments",I2,Melanie Khamis,Wesleyan University,Ira N. Gang,Rutgers University,Klara Sabirianova Peter,University of North Carolina-Chapel Hill,John P. Bonin,Wesleyan University,Nuria Rodriguez-Planas,IZA,,,EMILIA SIMEONOVA,Female,,,,,,NA,NA,NA,NA,NA
Emiliano Pagnotta,"Speed, Fragmentation, and Asset Prices",New York University,Jan 03 2014,2:30 PM,"Loews Philadelphia Hotel, Millennium Hall",American Finance Association,Market Microstructure Theory,G1,Dimitri Vayanos,London School of Economics,Pierre-Olivier Weill,University of California-Los Angeles,Jennifer Huang,University of Texas-Austin,Albert S. Kyle,University of Maryland,Marzena Joanna Rostek,University of Wisconsin-Madison,,,Emiliano Pagnotta,Male,,,,,,NA,NA,NA,NA,NA
Emily Oster,Why is Infant Mortality Higher in the United States Than in Europe?,University of Chicago,Jan 04 2014,2:30 PM,"Pennsylvania Convention Center, 204-A",American Economic Association,Investigating the Determinants of Infant Mortality,I1,Emily Oster,University of Chicago,,,,,,,,,,,Emily Oster,Female,,,,,,NA,NA,NA,NA,NA
Emily Owens,"Immigration, Employment Opportunities, and Criminal Behavior",Cornell University,Jan 05 2014,8:00 AM,"Philadelphia Marriott, Grand Ballroom - Salon K",American Economic Association,Economics of Crime,K4,Matthew Lindquist,"SOFI, Stockholm University",Erdal Tekin,Georgia State University,Matthew J. Lindquist,"SOFI, Stockholm University",Patrick Bayer,NBER and Duke University,Jacob L. Vigdor,Duke University,,,Emily Owens,Female,,,,,,NA,NA,NA,NA,NA
Emily Owens,The Birth of the Organized Crime? The American Temperance Movement and Market-Based Violence,Cornell University,Jan 05 2014,10:15 AM,"Loews Philadelphia Hotel, Regency Ballroom C2",Latin American and Caribbean Economic Association,Illegal Markets and Violence,K4,Jens Ludwig,University of Chicago,Jeffrey Clemens,University of California-San Diego,Sebastian Galiani,University of Maryland,,,,,,,Emily Owens,Female,,,,,,NA,NA,NA,NA,NA
Emine Boz,Sovereign Risk and Bank Balance Sheets: The Role of Macroprudential Policies,International Monetary Fund,Jan 03 2014,2:30 PM,"Philadelphia Marriott, Meeting Room 401",Econometric Society,"Banks, Sovereign Risk and Currency Wars",F5,Satyajit Chatterjee,Federal Reserve Bank of Philadelphia,Vivian Yue,Federal Reserve Board,Anton Korinek,Johns Hopkins University and International Monetary Fund,Javier Bianchi,University of Wisconsin,,,,,EMINE BOZ,Female,,,,,,NA,NA,NA,NA,NA
Emir Kamenica,Costly Persuasion,University of Chicago,Jan 04 2014,2:30 PM,"Pennsylvania Convention Center, 103-C",American Economic Association,Theory of Persuasion,D8,Matthew Gentzkow,University of Chicago,Paul Milgrom,Stanford Univeristy,Ilya Segal,Stanford University,Navin Kartik,Columbia University,,,,,Emir Kamenica,Male,,,,,,NA,NA,NA,NA,NA
Emir Kamenica,Gender Identity and Relative Income within Households,University of Chicago,Jan 03 2014,10:15 AM,"Pennsylvania Convention Center, 204-B",American Economic Association,Gender Gaps in Labor Market Outcomes,J7,Lise Vesterlund,University of Pittsburgh,Matthew Wiswall,Arizona State University,Francine D. Blau,Cornell University,Catherine Eckel,Texas A&M University,Lesley Turner,University of Maryland,,,Emir Kamenica,Male,,,,,,NA,NA,NA,NA,NA
Emmanuel Farhi,Sovereign Debt Crises in a Currency Union,Harvard University,Jan 05 2014,8:00 AM,"Philadelphia Marriott, Grand Ballroom - Salon E",American Economic Association,Sovereign Debt Crisis,F4,Gita Gopinath,Harvard University,Vincenzo Quadrini,University of Southern California,Javier Bianchi,University of Wisconsin,Andrew Atkeson,University of California-Los Angeles,,,,,EMMANUEL FARHI,Male,,,,,,NA,NA,NA,NA,NA
Emmanuel Farhi,A Theory of Macroprudential Policies in the Presence of Nominal Rigidities,Harvard University,Jan 05 2014,1:00 PM,"Pennsylvania Convention Center, 105-B",American Economic Association,Households and Allocation Decisions,E2,Wenli Li,Federal Reserve Bank of Philadelphia,,,,,,,,,,,EMMANUEL FARHI,Male,,,,,,NA,NA,NA,NA,NA
Emmanuel Farhi,Crash Risk in Currency Markets,Harvard University,Jan 04 2014,2:30 PM,"Pennsylvania Convention Center, 108-B",American Economic Association,Global Risks and Currencies: Theory and Evidence,F3,Lars Hansen,University of Chicago,Viktor Todorov,Northwestern University,Jose Ursua,Goldman Sachs,Jessica Wachter,University of Pennsylvania,Lars Hansen,University of Chicago,,,EMMANUEL FARHI,Male,,,,,,NA,NA,NA,NA,NA
Emmanuel Farhi,A Theory of Macroprundential Policies in the Presence of Nominal Rigidities,Harvard University,Jan 05 2014,10:15 AM,"Pennsylvania Convention Center, 204-C",American Economic Association,Advances in Open Macroeconomics,F3,Jaume Ventura,"CREI, UPF, and Barcelona GSE",Kenneth Rogoff,Harvard University,Philipp Schnabl,New York University,Oleg Itskhoki,Princeton University,Jaume Ventura,"CREI, UPF, and Barcelona GSE",,,EMMANUEL FARHI,Male,,,,,,NA,NA,NA,NA,NA
Enrichetta Ravina,Who is Internationally Diversified?,Columbia University,Jan 05 2014,8:00 AM,"Philadelphia Marriott, Grand Ballroom - Salon B",American Economic Association,Financial Decision-Making and the Household Balance Sheet,G2,David Laibson,Harvard University,Kory Kroft,University of Toronto,Frank Warnock,University of Virginia,Raven Molloy,Federal Reserve Board,Brian Bucks,Consumer Financial Protection Bureau,,,ENRICHETTA RAVINA,Female,,,,,,NA,NA,NA,NA,NA
Enrique G. Mendoza,A Financial Frictions Approach to Crises: Theory and Macroprudential Policy Implications,University of Pennsylvania and NBER,Jan 05 2014,8:00 AM,"Pennsylvania Convention Center, 203-B",American Economic Association,Macroprudential Policies,E5,Jaume Ventura,"CREI, UPF, and Barcelona GSE",,,,,,,,,,,Enrique G. Mendoza,Male,ENRIQUE MENDOZA,,,,,NA,NA,NA,NA,NA
Enrique G. Mendoza,Saving Europe?: The Unpleasant Arithmetic of Fiscal Austerity in Integrated Economies,University of Pennylvania,Jan 04 2014,2:30 PM,"Pennsylvania Convention Center, 201-A",Econometric Society,Macroeconomics with Debt Markets in Turmoil,E5,Enrique Mendoza,University of Pennsylvania,,,,,,,,,,,Enrique G. Mendoza,Male,ENRIQUE MENDOZA,,,,,NA,NA,NA,NA,NA
Enrique G. Mendoza,Optimal Domestic Sovereign Default,University of Pennsylvania,Jan 03 2014,10:15 AM,"Philadelphia Marriott, Meeting Room 405",Econometric Society,Sovereign Debt Crises,F3,Harald Uhlig,University of Chicago,Guido Lorenzoni,Northwestern University,Henning Bohn,University of California-Santa Barbara,Vincenzo Quadrini,University of Southern California,,,,,Enrique G. Mendoza,Male,ENRIQUE MENDOZA,,,,,NA,NA,NA,NA,NA
Eric Budish,"Primary-Market Auctions for Event Tickets: Eliminating the Rents of \Bob the Broker\""""",University of Chicago,Jan 03 2014,8:00 AM,"Philadelphia Marriott, Grand Ballroom - Salon J",American Economic Association,Effects on Preferences Regarding Risk & Ambiguity,D8,Luca Rigotti,University of Pittsburgh,,,,,,,,,,,Eric Budish,Male,,,,,,NA,NA,NA,NA,NA
Eric Budish,Do Fixed Patent Terms Distort Innovation? Evidence from Cancer Clinical Trials,University of Chicago,Jan 03 2014,2:30 PM,"Pennsylvania Convention Center, 204-B",American Economic Association,Intellectual Property Rights and Innovation,O3,Heidi Williams,Massachusetts Institute of Technology,,,,,,,,,,,Eric Budish,Male,,,,,,NA,NA,NA,NA,NA
Eric Budish,The High-Frequency Trading Arms Race: Frequent Batch Auctions as a Market Design Response,University of Chicago,Jan 05 2014,8:00 AM,"Pennsylvania Convention Center, 204-C",American Economic Association,Frontiers of Market Design,D4,Alvin Roth,Stanford University,Michael Ostrovsky,Stanford University,James Andreoni,University of California-San Diego,Ilya Segal,Stanford University,Larry Samuelson,Yale University,,,Eric Budish,Male,,,,,,NA,NA,NA,NA,NA
Eric Ghysels,Risk and Return Trade-Off in the United States Treasury Markets,University of North Carolina-Chapel Hill,Jan 05 2014,10:15 AM,"Pennsylvania Convention Center, 202-A",American Economic Association,Topics in Treasury Markets,G1,Monika Piazzesi,Stanford University,Pierluigi Balduzzi,Boston College,Tobias Adrian,Federal Reserve Bank of New York,Torben Andersen,Northwestern University,Gregory Duffee,Johns Hopkins University,,,ERIC GHYSELS,Male,,,,,,NA,NA,NA,NA,NA
Eric Ghysels,Central Bank Macroeconomic Forecasting during the Financial Crisis: The European Central Bank and Federal Reserve Bank of New York Experiences,University of North Carolina,Jan 03 2014,2:30 PM,"Pennsylvania Convention Center, 204-C",Econometric Society,JBES Invited Session,C1,Shakeeb Khan,Duke University,Jonathan Wright,Johns Hopkins University,Lutz Kilian,University of Michigan,Allan Timmermann,University of California-San Diego,Simone Manganelli,European Central Bank,Andrew Patton,Duke University,ERIC GHYSELS,Male,,,,,,NA,NA,NA,NA,NA
Eric Ghysels,Forecasting through the Rear-View Mirror: Data Revisions and Bond Return Predictability,University of North Carolina,Jan 03 2014,8:00 AM,"Loews Philadelphia Hotel, Commonwealth Hall D",American Finance Association,Macro Finance,G1,Ralph Koijen,University of Chicago,Jules van Binsbergen,Stanford University,Lars A. Lochstoer,Columbia University,Leonid Kogan,Massachusetts Institute of Technology,,,,,ERIC GHYSELS,Male,,,,,,NA,NA,NA,NA,NA
Eric Hanushek,The Importance of State Human Capital,Stanford University,Jan 03 2014,2:30 PM,"Pennsylvania Convention Center, 203-B",American Economic Association,"Cognitive Human Capital, Growth and Wealth – Perspectives of Economics and Psychology",J2,Heiner Rindermann,Chemnitz University of Technology and Southern Illinois University,Susan M. Collins,University of Michigan,,,,,,,,,ERIC HANUSHEK,Male,,,,,,NA,NA,NA,NA,NA
Eric Hanushek,Effects of Charter School Entry on Local School Markets,Stanford University,Jan 04 2014,10:15 AM,"Pennsylvania Convention Center, 112-B",American Economic Association,Policy Interventions and Educational Outcomes,J6,Rodney Andrews,University of Texas-Dallas,Juan Carlos Suárez Serrato,Stanford University,Monica Deza,University of Texas-Dallas,Damon Jones,University of Chicago,Omari Swinton,Howard University,,,ERIC HANUSHEK,Male,,,,,,NA,NA,NA,NA,NA
Eric M. Leeper,No News is Good News,Indiana University,Jan 03 2014,10:15 AM,"Pennsylvania Convention Center, 202-B",American Economic Association,Finance and Asset Markets,G1,Caleb Stroup,Grinnell College,,,,,,,,,,,Eric M. Leeper,Male,ERIC LEEPER,,,,,NA,NA,NA,NA,NA
Eric Swanson,"Risk Aversion, Risk Premia, and the Labor Margin with Generalized Recursive Preferences",Federal Reserve Bank at San Francisco,Jan 04 2014,10:15 AM,"Philadelphia Marriott, Meeting Rooms 408 & 409",Korea-America Economic Association,Measurement Issues in Dynamic Macro Models,E2,Yongsung Chang,University of Rochester and Yonsei University,Karel Mertens,Cornell University,Jesus Fernandez-Villaverde,University of Pennsylvania,Rebecca Hellerstein,Federal Reserve Bank of New York,Thomas Lubik,Federal Reserve Bank of Richmond,,,ERIC SWANSON,Male,,,,,,NA,NA,NA,NA,NA
Eric Swanson,"Risk Aversion, Risk Premia, and the Labor Margin with Generalized Recursive Preferences",Federal Reserve Bank at San Francisco,Jan 04 2014,10:15 AM,"Philadelphia Marriott, Meeting Rooms 408 & 409",Korea-America Economic Association,Measurement Issues in Dynamic Macro Models,E2,Yongsung Chang,University of Rochester and Yonsei University,Karel Mertens,Cornell University,Jesus Fernandez-Villaverde,University of Pennsylvania,Rebecca Hellerstein,Federal Reserve Bank of New York,Thomas Lubik,Federal Reserve Bank of Richmond,,,ERIC SWANSON,Male,,,,,,NA,NA,NA,NA,NA
Erica Field,Does the Arrival of a Formal Financial Institution Alter Informal Sharing Arrangements? Experimental Evidence from Village India,Duke University,Jan 05 2014,8:00 AM,"Pennsylvania Convention Center, 203-A",American Economic Association,Transfers and Networks in Developing Countries,O1,Susan Steiner,Leibniz Universität Hannover,Marcel Fafchamps,Oxford University,Silvia Prina,Case Western Reserve University,Alexander Yuskavage,US Treasury Department,Nathan Fiala,DIW Berlin,,,Erica Field,Female,,,,,,NA,NA,NA,NA,NA
Erik Brynjolfsson,The Second Machine Age,Massachusetts Institute of Technology,Jan 04 2014,2:30 PM,"Pennsylvania Convention Center, 204-C",Society for Policy Modeling/American Economic Association,Has Innovation Stopped Driving Growth?,D2,Dominick Salvatore,Fordham University,Dominick Salvatore,Fordham University,,,,,,,,,ERIK BRYNJOLFSSON,Male,,,,,,NA,NA,NA,NA,NA
Erik Brynjolfsson,Management and IT in America,Massachusetts Institute of Technology and NBER,Jan 03 2014,10:15 AM,"Pennsylvania Convention Center, 103-A",American Economic Association,"Entrepreneurship, Innovation, and Management",L2,Nicholas Bloom,Stanford University and NBER,,,,,,,,,,,ERIK BRYNJOLFSSON,Male,,,,,,NA,NA,NA,NA,NA
Erik Brynjolfsson,Moneyball for Academics: Network Analysis for Predicting Research Impact,Massachusetts Institute of Technology,Jan 04 2014,8:00 AM,"Pennsylvania Convention Center, 109-B",American Economic Association,Academic and Market Power in Scholarly Publishing,O3,Erik Brynjolfsson,Massachusetts Institute of Technology,Ted Bergstrom,University of California-Santa Barbara,Stefano DellaVigna,University of California- Berkeley,Scott Stern,Massachusetts Institute of Technology,David Card,University of California-Berkeley,,,ERIK BRYNJOLFSSON,Male,,,,,,NA,NA,NA,NA,NA
Erik Hurst,Men Not At Work: Explaining Trends in Male Hours over Five Decades,University of Chicago,Jan 04 2014,8:00 AM,"Loews Philadelphia Hotel, Washington A",Society for Economic Dynamics,Understanding Trends in Labor Market Outcomes,J3,Erik Hurst,University of Chicago,,,,,,,,,,,ERIK HURST,Male,,,,,,NA,NA,NA,NA,NA
Erik Lindqvist,Heterogeneous Investment Behavior in a Mandatory Pension Plan: The Role of Cognitive and Non-cognitive Skills,Stockholm School of Economics and IFN,Jan 05 2014,10:15 AM,"Philadelphia Marriott, Grand Ballroom - Salon B",American Economic Association,Household Finance,G1,John Campbell,Harvard University,Tyler Shumway,University of Michigan,Antoinette Shoar,Massachusetts Institute of Technology,Stefan Nagel,Stanford University,Shawn A. Cole,Harvard Business School,,,ERIK LINDQVIST,Male,,,,,,NA,NA,NA,NA,NA
Erik Lindqvist,The Effect of Wealth on Household Labor Supply: Evidence from Swedish Lotteries,Stockholm School of Economics,Jan 05 2014,1:00 PM,"Pennsylvania Convention Center, 202-A",American Economic Association,Labor Supply,J2,Matthew Notowidigdo,University of Chicago,Che-Yuan Liang,Uppsala University,Håkan Selin,Uppsala University,Johanna Wallenius,Stockholm School of Economics,Erik Lindqvist,Stockholm School of Economics,,,ERIK LINDQVIST,Male,,,,,,NA,NA,NA,NA,NA
Erik Loualiche,Asset Pricing with Entry and Imperfect Competition,Northwestern University,Jan 05 2014,1:00 PM,"Loews Philadelphia Hotel, Commonwealth Hall D",American Finance Association,Asset Pricing Theory,G1,Leonid Kogan,Massachusetts Institute of Technology,Dimitri Vayanos,London School of Economics,Frederico Belo,University of Minnesota,Nicolae Garleanu,University of California-Berkeley,,,,,Erik Loualiche,Male,,,,,,NA,NA,NA,NA,NA
Erik Meyersson,"'For the Love of the Republic': Education, Secularism and Empowerment",Stockholm Institute of Transition Economics,Jan 05 2014,8:00 AM,"Philadelphia Marriott, Grand Ballroom - Salon I",Association for Comparative Economic Studies,"Education, Health and Labor Market Outcomes: Comparative Evidence from Natural Experiments",I2,Melanie Khamis,Wesleyan University,Ira N. Gang,Rutgers University,Klara Sabirianova Peter,University of North Carolina-Chapel Hill,John P. Bonin,Wesleyan University,Nuria Rodriguez-Planas,IZA,,,Erik Meyersson,Male,,,,,,NA,NA,NA,NA,NA
Ernst Fehr,Benefits of Neuroeconomic Modeling: New Policy Interventions and Predictors of Choice,University of Zurich,Jan 03 2014,2:30 PM,"Pennsylvania Convention Center, 103-A",American Economic Association,Neuroeconomics of Stochastic Choice,D8,David Laibson,Harvard University,Stephen Morris,Princeton University,Andrew Caplin,New York University,Paul Glimcher,New York University,,,,,Ernst Fehr,Male,,,,,,NA,NA,NA,NA,NA
Erwan Quintin,Housing Defaults When House Prices are Uncertain,University of Wisconsin,Jan 03 2014,2:30 PM,"Loews Philadelphia Hotel, Washington B",American Real Estate & Urban Economic Association,Mortgages 2,G2,Stuart Gabriel,University of California-Los Angeles,Steve Oliner,University of California-Los Angeles,Danny Ben Shahar,Technion - Israel Institute of Technology,Peter Zorn,Freddie Mac,Edward Kung,University of California-Los Angeles,,,ERWAN QUINTIN,Male,,,,,,NA,NA,NA,NA,NA
Erwann Michel-Kerjan,Does Federal Disaster Assistance Crowd Out Private Demand for Insurance?,University of Pennsylvania,Jan 03 2014,10:15 AM,"Pennsylvania Convention Center, 203-B",American Economic Association,Effects of Public Policy Changes,H4,Allen Sanderson,University of Chicago,,,,,,,,,,,ERWANN MICHEL-KERJAN,Male,ERWANN O. MICHEL-KERJAN,,,,,NA,NA,NA,NA,NA
Esther Duflo,Adverse Selection in the Market for Catastrophic Health Insurance: Some Evidence from India,Massachusetts Institute of Technology,Jan 03 2014,8:00 AM,"Pennsylvania Convention Center, 201-C",American Economic Association,The Demand for Insurance in Developing Countries,O1,Benjamin Olken,Massachusetts Institute of Technology,Seema Jayachandran,Northwestern University,Tavneet Suri,Massachusetts Institute of Technology,Jishnu Das,World Bank,,,,,ESTHER DUFLO,Female,,,,,,NA,NA,NA,NA,NA
