author,paper_title,author_affiliation,date,time,location,association,session_title,session_jel_code,session_chair,session_chair_affiliation,discussant_1,discussant_1_affiliation,discussant_2,discussant_2_affiliation,discussant_3,discussant_3_affiliation,discussant_4,discussant_4_affiliation,discussant_5,discussant_5_affiliation,author.y,gender,alternative_1,alternative_2,alternative_3,alternative_4,alternative_5,X,X.1,X.2,X.3,X.4
Aaron Chatterji,Eponymous Entrepreneurs,Duke University,Jan 03 2014,2:30 PM,"Philadelphia Marriott, Meeting Room 306",National Economic Association,Innovations in Innovation and Entrepreneurship,O3,Keoka Grayson,Hobart and William Smith Colleges,Bruce A. Weinberg,Ohio State University,Pai-Ling Yin,Massachusetts Institute of Technology,Michael Roach,Duke University,,,,,Aaron Chatterji,Male,,,,,,NA,NA,NA,NA,NA
Abhijit Banerjee,Come Play with Me: Experimental Evidence of Information Diffusion About Rival Goods,Massachusetts Institute of Technology,Jan 05 2014,8:00 AM,"Pennsylvania Convention Center, 201-A",American Economic Association,Strategic Learning: Theory and Evidence,D8,Abhijit Banerjee,Massachusetts Institute of Technology,Matthew Elliott,California Institute of Technology,Arun Chandrasekhar,Stanford University,Juan Pablo Xandri,Princeton University,Petra Persson,Stanford University,,,ABHIJIT BANERJEE,Male,,,,,,NA,NA,NA,NA,NA
Abhijit Banerjee,Adverse Selection in the Market for Catastrophic Health Insurance: Some Evidence from India,Massachusetts Institute of Technology,Jan 03 2014,8:00 AM,"Pennsylvania Convention Center, 201-C",American Economic Association,The Demand for Insurance in Developing Countries,O1,Benjamin Olken,Massachusetts Institute of Technology,Seema Jayachandran,Northwestern University,Tavneet Suri,Massachusetts Institute of Technology,Jishnu Das,World Bank,,,,,ABHIJIT BANERJEE,Male,,,,,,NA,NA,NA,NA,NA
Abhijit Banerjee,"Windfall or Downfall: Capital, Credit and Micro-Entrepreneurs' Returns",Massachusetts Institute of Technology,Jan 05 2014,1:00 PM,"Pennsylvania Convention Center, 103-C",American Economic Association,Experiments with Small Enterprises,O1,Nathan Fiala,DIW Berlin,,,,,,,,,,,ABHIJIT BANERJEE,Male,,,,,,NA,NA,NA,NA,NA
Abhijit Banerjee,Teaching Economics Online: Experience With a MOOC on Development Economics,Massachusetts Institute of Technology,Jan 04 2014,10:15 AM,"Pennsylvania Convention Center, 201-B",American Economic Association,Economics Education in the Digital Age: The Implications of Online Technologies and MOOCs,A1,Nancy Rose,Massachusetts Institute of Technology,Gail Hoyt,University of Kentucky,John Siegfried,Vanderbilt University,,,,,,,ABHIJIT BANERJEE,Male,,,,,,NA,NA,NA,NA,NA
Abhiroop Mukherjee,Performance-Chasing Behavior and Mutual Funds: New Evidence from Multi-Fund Managers,Hong Kong University of Science and Technology,Jan 04 2014,10:15 AM,"Loews Philadelphia Hotel, Commonwealth Hall C",American Finance Association,Mutual Funds and Investment Choice,G1,William Goetzmann,Yale University,Roy Zuckerman,Rutgers University,Philipp Illeditsch,University of Pennsylvania,Masahiro Watanabe,University of Alberta,Hong Zhang,INSEAD,,,Abhiroop Mukherjee,Male,,,,,,NA,NA,NA,NA,NA
Abhiroop Mukherjee,"First Impressions: \System 1\"" Thinking and the Cross-Section of Stock Returns""",Hong Kong University of Science and Technology,Jan 03 2014,8:00 AM,"Loews Philadelphia Hotel, Regency Ballroom B",American Finance Association,Behavioral Asset Pricing,G1,Nicholas Barberis,Yale University,Dong Lou,London School of Economics,Byoung-Hyoun Hwang,Purdue University,Kent Daniel,Columbia University,,,,,Abhiroop Mukherjee,Male,,,,,,NA,NA,NA,NA,NA
Adair Morse,How Pervasive is Corporate Fraud?,University of California-Berkeley,Jan 04 2014,10:15 AM,"Pennsylvania Convention Center, 107-B",American Economic Association,New Perspectives on Corporate Governance,G3,Luigi Zingales,University of Chicago,Franklin Allen,University of Pennsylvania,Amit Seru,University of Chicago,Frank Partnoy,University of California-San Diego,,,,,ADAIR MORSE,Female,,,,,,NA,NA,NA,NA,NA
Adam Leive,Sticker Shock for Individual Insurance From Health Reform,University of Pennsylvania,Jan 04 2014,10:15 AM,"Pennsylvania Convention Center, 112-A",Health Economics Research Organization,Implementation of the Affordable Care Act,I1,Michael Chernew,Harvard University,Martin S. Gaynor,Carnegie-Mellon University,Joseph P. Newhouse,Harvard University,Cory S. Capps,"Bates White-Washington, DC",,,,,Adam Leive,Male,,,,,,NA,NA,NA,NA,NA
Adam Sacarny,Healthcare Exceptionalism? Productivity and Allocation in the United States Healthcare Sector,Massachusetts Institute of Technology,Jan 04 2014,10:15 AM,"Pennsylvania Convention Center, 201-C",American Economic Association,Healthcare Performance and Competition,I1,John Van Reenen,London School of Economics,,,,,,,,,,,Adam Sacarny,Male,,,,,,NA,NA,NA,NA,NA
Adam Szeidl,Trust and Social Collateral: Empirical Evidence,Central European University,Jan 03 2014,2:30 PM,"Philadelphia Marriott, Meeting Room 307",Economic Science Association,Experiments in Economic Development,C9,Pauline Grosjean,University of New South Wales,,,,,,,,,,,ADAM SZEIDL,Male,,,,,,NA,NA,NA,NA,NA
Adam Szeidl,Noise Bidders in Auctions,Central European University,Jan 05 2014,10:15 AM,"Pennsylvania Convention Center, 204-B",American Economic Association,Understanding the Auction Process: New Theories and Empirical Evidence,L2,Ulrike Malmendier,University of California-Berkeley,David Reiley,Google Inc,Jennifer Brown,Northwestern University,Mallesh Pai,University of Pennsylvania,Steven Tadelis,University of California-Berkeley and eBay Research Labs,,,ADAM SZEIDL,Male,,,,,,NA,NA,NA,NA,NA
Adi Sunderam,"Concentration in Mortgage Lending, Refinancing Activity, and Mortgage Rates",Harvard Business School,Jan 04 2014,8:00 AM,"Loews Philadelphia Hotel, Millennium Hall",American Finance Association,Real Estate and Mortgages,G2,Karen Pence,Federal Reserve Board,Karen M. Pence,Federal Reserve Board,Ben Keys,University of Chicago,Margarita Tsoutsoura,University of Chicago,Sumit Agarwal,National University of Singapore,,,Adi Sunderam,Male,,,,,,NA,NA,NA,NA,NA
Adriaan Soetevent,Price Competition on Graphs,University of Groningen,Jan 04 2014,12:30 PM,"Pennsylvania Convention Center, 106-A",Industrial Organization Society,Spatial Competition,L1,Stephen Martin,Purdue University,A. H. van der Weijde,Free University of Amsterdam,Darlene Chisholm,Suffolk University,Adriaan Soetevent,University of Amsterdam,Stephen Martin,Purdue University,,,ADRIAAN SOETEVENT,Male,,,,,,NA,NA,NA,NA,NA
Adrian Buss,Capital Controls and International Financial Stability,INSEAD,Jan 04 2014,2:30 PM,"Loews Philadelphia Hotel, Commonwealth Hall A",American Finance Association,"Networks, International Finance",G1,Tarek Hassan,University of Chicago,Thomas Chaney,University of Chicago,Bruce I. Sacerdote,Dartmouth College,Anna Pavlova,London Business School,,,,,Adrian Buss,Male,,,,,,NA,NA,NA,NA,NA
Adriana Lleras-Muney,The Long Run Impact of Welfare,University of California-Los Angeles,Jan 04 2014,12:30 PM,"Philadelphia Marriott, Meeting Room 307",Economic History Association,Poverty from a Historical Viewpoint,N3,Robert Margo,Boston University,Tom S. Vogl,Princeton University,Robert A. Margo,Boston University,Hoyt Bleakley,University of Chicago,Rob Gillezeau,New Democratic Party,,,ADRIANA LLERAS-MUNEY,Female,,,,,,NA,NA,NA,NA,NA
Adriana Lleras-Muney,Breaking the Glass Ceiling: The Effect of Board Quotas on Female Labor Market Outcomes in Norway,University of California-Los Angeles,Jan 05 2014,10:15 AM,"Loews Philadelphia Hotel, Regency Ballroom A",American Finance Association,A Woman's Touch: Women in Senior Leadership Positions,G3,Paola Sapienza,Northwestern University,Lori Beaman,Northwestern University,Geoffrey Tate,University of North Carolina,David A. Matsa,Northwestern University,David Cesarini,New York University,,,ADRIANA LLERAS-MUNEY,Female,,,,,,NA,NA,NA,NA,NA
Adrien Verdelhan,Crash Risk in Currency Markets,Massachusetts Institute of Technology,Jan 04 2014,2:30 PM,"Pennsylvania Convention Center, 108-B",American Economic Association,Global Risks and Currencies: Theory and Evidence,F3,Lars Hansen,University of Chicago,Viktor Todorov,Northwestern University,Jose Ursua,Goldman Sachs,Jessica Wachter,University of Pennsylvania,Lars Hansen,University of Chicago,,,ADRIEN VERDELHAN,Male,,,,,,NA,NA,NA,NA,NA
Ahmed Tahoun,Patronage Networks and the Balance of Power in Egypt's Arab Spring,London Business School,Jan 04 2014,8:00 AM,"Pennsylvania Convention Center, 204-C",American Economic Association,Economics of Revolutions,D7,Daron Acemoglu,Massachusetts Institute of Technology,Remi Jedwab,George Washington University,Carlo Prato,Georgetown University and Princeton University,Filipe Campante,Harvard University,Erik Meyersson,Stockholm School of Economics,,,Ahmed Tahoun,Male,,,,,,NA,NA,NA,NA,NA
Aitor Erce,Sovereign Debt Markets in Turbulent Times: Creditor Discrimination and Crowding-Out Effects,European Stability Mechanism,Jan 05 2014,10:15 AM,"Pennsylvania Convention Center, 204-C",American Economic Association,Advances in Open Macroeconomics,F3,Jaume Ventura,"CREI, UPF, and Barcelona GSE",Kenneth Rogoff,Harvard University,Philipp Schnabl,New York University,Oleg Itskhoki,Princeton University,Jaume Ventura,"CREI, UPF, and Barcelona GSE",,,Aitor Erce,Male,,,,,,NA,NA,NA,NA,NA
Ajay Subramanian,Product Variety and Asset Pricing,Georgia State University,Jan 03 2014,2:30 PM,"Philadelphia Marriott, Meeting Room 402",Econometric Society,Cross Sectional Asset Pricing,G1,Zhanhui Chen,Nanyang Technological University,,,,,,,,,,,AJAY SUBRAMANIAN,Male,,,,,,NA,NA,NA,NA,NA
Akshaya Jha,The Superintendent's Dilemma: Managing School District Capacity as Parents Vote with Their Feet,Stanford University,Jan 05 2014,8:00 AM,"Philadelphia Marriott, Meeting Room 401",Econometric Society,Empirical Models for Policy Evaluation,H3,John Rust,Georgetown University,,,,,,,,,,,Akshaya Jha,Male,,,,,,NA,NA,NA,NA,NA
Alan Barreca,Can Payments for Environmental Services Save the Forest? The Effects of an Avoided Deforestation Initiative in the Brazilian Amazon,Tulane University,Jan 05 2014,1:00 PM,"Pennsylvania Convention Center, 103-A",American Economic Association,"Deforestation, Land-Use Change and Contracts",Q5,Paul Scott,Tolouse School of Economics,,,,,,,,,,,Alan Barreca,Male,,,,,,NA,NA,NA,NA,NA
Alan Moreira,News Implied Volatility and Disaster Concerns,Yale University,Jan 04 2014,8:00 AM,"Loews Philadelphia Hotel, Commonwealth Hall A",American Finance Association,Media & Disclosure,G1,Joseph Engelberg,University of California-San Diego,Diego Garcia,University of North Carolina,Eriz Zitzewitz,Dartmouth College,Tim Loughran,University of Notre Dame,,,,,Alan Moreira,Male,,,,,,NA,NA,NA,NA,NA
Alberto Abadie,Inside the War on Drugs: Effectiveness and Unintended Consequences of a Large Illicit Crop Eradication Program In Colombia,Harvard University,Jan 04 2014,8:00 AM,"Pennsylvania Convention Center, 108-B",American Economic Association,Crime & Corruption,K4,Dale Cloninger,University of Houston-Clear Lake,,,,,,,,,,,ALBERTO ABADIE,Male,,,,,,NA,NA,NA,NA,NA
Alberto Chong,Letter Grading Government Efficiency,University of Ottawa,Jan 05 2014,8:00 AM,"Pennsylvania Convention Center, 201-B",American Economic Association,The Role of Management and Technology for Reallocation and Growth: Micro and Macro Evidence,L1,John Van Reenen,London School of Economics,,,,,,,,,,,Alberto Chong,Male,,,,,,NA,NA,NA,NA,NA
Alberto Chong,Effectiveness and Spillovers of Online Sex Education: Evidence from a Randomized Evaluation in Colombian Public Schools,University of Ottawa,Jan 05 2014,10:15 AM,"Philadelphia Marriott, Meeting Room 406",Econometric Society,Using Information Technology to Improve Health in Developing Countries,O1,Wesley Yin,Boston University,Yi Qian,Northwestern University,Leigh Linden,University of Texas-Austin,Simone Gabrielle Schaner,Dartmouth College,,,,,Alberto Chong,Male,,,,,,NA,NA,NA,NA,NA
Alberto Galasso,Patents and Cumulative Innovation: Causal Evidence from the Courts,University of Toronto,Jan 05 2014,1:00 PM,"Pennsylvania Convention Center, 204-C",American Economic Association,"Patents, Innovation and Growth",O3,Mark Schankerman,London School of Economics,Heidi L. Williams,Massachusetts Institute of Technology,Samuel Kortum,Yale University,John Van Reenen,London School of Economics,Benjamin Jones,Northwestern University,,,ALBERTO GALASSO,Male,,,,,,NA,NA,NA,NA,NA
Alberto Martin,Sovereign Debt Markets in Turbulent Times: Creditor Discrimination and Crowding-Out Effects,"CREI, UPF, and Barcelona GSE",Jan 05 2014,10:15 AM,"Pennsylvania Convention Center, 204-C",American Economic Association,Advances in Open Macroeconomics,F3,Jaume Ventura,"CREI, UPF, and Barcelona GSE",Kenneth Rogoff,Harvard University,Philipp Schnabl,New York University,Oleg Itskhoki,Princeton University,Jaume Ventura,"CREI, UPF, and Barcelona GSE",,,ALBERTO MARTIN,Male,,,,,,NA,NA,NA,NA,NA
Alberto Salvo,Fuel Mix and Air Quality during a Natural Experiment in the Sao Paulo Metropolitan Area between 2009 and 2011,National University of Singapore,Jan 04 2014,8:00 AM,"Philadelphia Marriott, Grand Ballroom - Salon K",Association of Environmental & Resource Economists,Air Pollution in Developing Countries,Q5,Matthew Neidell,Columbia University,Rema Hanna,Harvard University,Reed Walker,University of California-Berkeley,Prashant Bharadwaj,University of California-San Diego,Erin Mansur,Dartmouth College,,,ALBERTO SALVO,Male,,,,,,NA,NA,NA,NA,NA
Aldo Rustichini,A Neuronal Theory of the Decision Process,University of Minnesota,Jan 03 2014,2:30 PM,"Pennsylvania Convention Center, 103-A",American Economic Association,Neuroeconomics of Stochastic Choice,D8,David Laibson,Harvard University,Stephen Morris,Princeton University,Andrew Caplin,New York University,Paul Glimcher,New York University,,,,,Aldo Rustichini,Male,,,,,,NA,NA,NA,NA,NA
Aldo Rustichini,What Drives Women Out of Entrepreneurship? The Joint Role of Testosterone and Culture,University of Minnesota,Jan 05 2014,10:15 AM,"Loews Philadelphia Hotel, Regency Ballroom A",American Finance Association,A Woman's Touch: Women in Senior Leadership Positions,G3,Paola Sapienza,Northwestern University,Lori Beaman,Northwestern University,Geoffrey Tate,University of North Carolina,David A. Matsa,Northwestern University,David Cesarini,New York University,,,Aldo Rustichini,Male,,,,,,NA,NA,NA,NA,NA
Alejandro Justiniano,Household Leveraging and Deleveraging,Federal Reserve Bank of Chicago,Jan 04 2014,8:00 AM,"Philadelphia Marriott, Meeting Room 402",Econometric Society,Financial Frictions and the Macroeconomy,E5,Andrea Tambalotti,Federal Reserve Bank of New York,,,,,,,,,,,ALEJANDRO JUSTINIANO,Male,,,,,,NA,NA,NA,NA,NA
Alejandro Justiniano,The Natural Rate of Interest and Its Usefulness for Monetary Policy Making,Federal Reserve Bank of Chicago,Jan 03 2014,8:00 AM,"Philadelphia Marriott, Grand Ballroom - Salon E",American Economic Association,What's Natural? Key Macroeconomic Parameters after the Great Recession,E1,Matthew Shapiro,University of Michigan,Michael Woodford,Columbia University,Robert E. Hall,Stanford University,Susanto Basu,Boston College,,,,,ALEJANDRO JUSTINIANO,Male,,,,,,NA,NA,NA,NA,NA
Alessandra Cassar,"Institutional Quality, Culture, and Norms of Cooperation: Evidence from a Behavioral Field Experiment",University of San Francisco,Jan 03 2014,2:30 PM,"Philadelphia Marriott, Meeting Room 307",Economic Science Association,Experiments in Economic Development,C9,Pauline Grosjean,University of New South Wales,,,,,,,,,,,Alessandra Cassar,Female,,,,,,NA,NA,NA,NA,NA
Alessandra Voena,German-Jewish Emigres and United States Invention,Harvard University,Jan 05 2014,8:00 AM,"Pennsylvania Convention Center, 105-B",American Economic Association,High Skill Immigration in the Global Economy,J2,William Kerr,Harvard Business School,Gordon H. Hanson,University of California-San Diego,,,,,,,,,ALESSANDRA VOENA,Female,,,,,,NA,NA,NA,NA,NA
Alessandra Voena,Prenuptial Agreements and Household Wellbeing: Theory and Evidence from Italy,University of Chicago,Jan 04 2014,2:30 PM,"Pennsylvania Convention Center, 203-B",American Economic Association,"Cognitive, Non-Cognitive Skills, and Contracts on Marital Outcomes",J1,Aloysius Siow,University of Toronto,Rachel Fernandez,New York University,Aloysius Siow,University of Toronto,Gabriella Conti,University of Chicago,Laura Turner,University of Toronto,,,ALESSANDRA VOENA,Female,,,,,,NA,NA,NA,NA,NA
Alessandro Dovis,Rethinking Optimal Currency Areas,Pennsylvania State University and Princeton University,Jan 05 2014,10:15 AM,"Pennsylvania Convention Center, 204-C",American Economic Association,Advances in Open Macroeconomics,F3,Jaume Ventura,"CREI, UPF, and Barcelona GSE",Kenneth Rogoff,Harvard University,Philipp Schnabl,New York University,Oleg Itskhoki,Princeton University,Jaume Ventura,"CREI, UPF, and Barcelona GSE",,,Alessandro Dovis,Male,,,,,,NA,NA,NA,NA,NA
Alessandro Gavazza,What Shifts the Beveridge Curve? Recruitment Effort and Financial Shocks,New York University,Jan 03 2014,10:15 AM,"Philadelphia Marriott, Meeting Room 411",Econometric Society,New Perspectives on Jobless Recoveries,E1,Gianluca Violante,New York University,,,,,,,,,,,Alessandro Gavazza,Male,,,,,,NA,NA,NA,NA,NA
Alessandro Previtero,The Costs and Benefits of Financial Advice,University of Western Ontario,Jan 05 2014,10:15 AM,"Philadelphia Marriott, Grand Ballroom - Salon B",American Economic Association,Household Finance,G1,John Campbell,Harvard University,Tyler Shumway,University of Michigan,Antoinette Shoar,Massachusetts Institute of Technology,Stefan Nagel,Stanford University,Shawn A. Cole,Harvard Business School,,,Alessandro Previtero,Male,,,,,,NA,NA,NA,NA,NA
Alessandro Rebucci,Optimal Policy for Macro-Financial Stability,John Hopkins University and Inter-American Development Bank,Jan 05 2014,8:00 AM,"Pennsylvania Convention Center, 203-B",American Economic Association,Macroprudential Policies,E5,Jaume Ventura,"CREI, UPF, and Barcelona GSE",,,,,,,,,,,ALESSANDRO REBUCCI,Male,,,,,,NA,NA,NA,NA,NA
Alessio Saretto,Firm Policies and the Cross-Section of CDS spreads,University of Texas-Dallas,Jan 05 2014,1:00 PM,"Loews Philadelphia Hotel, Regency Ballroom A",American Finance Association,Structural Estimation in Finance,G3,Christopher Hennessy,London Business School,Michael Roberts,University of Pennsylvania,Joao Gomes,University of Pennsylvania,Sergey Tsyplakov,University of South Carolina,Erwan Morellec,Ecole Polytechnique Federale de Lausanne,,,Alessio Saretto,Male,,,,,,NA,NA,NA,NA,NA
Alex Solis,Does Higher Education Cause Political Participation? Evidence from a Regression Discontinuity Design,University of California-Berkeley,Jan 05 2014,1:00 PM,"Philadelphia Marriott, Grand Ballroom - Salon A",American Economic Association,Welfare Policies in Latin American,I3,Flavio Cunha,University of Pennsylvania,Renata Narita,World Bank,Alex Solis,Uppsala University,Rita Ginja,Uppsala University,Pedro Carneiro,University College London,,,Alex Solis,Male,,,,,,NA,NA,NA,NA,NA
Alex Solis,Returns to Elite Higher Education in the Marriage Market: Evidence from Chile,Uppsala University,Jan 03 2014,10:15 AM,"Pennsylvania Convention Center, 204-B",American Economic Association,Gender Gaps in Labor Market Outcomes,J7,Lise Vesterlund,University of Pittsburgh,Matthew Wiswall,Arizona State University,Francine D. Blau,Cornell University,Catherine Eckel,Texas A&M University,Lesley Turner,University of Maryland,,,Alex Solis,Male,,,,,,NA,NA,NA,NA,NA
Alexander Dyck,How Pervasive is Corporate Fraud?,University of Toronto,Jan 04 2014,10:15 AM,"Pennsylvania Convention Center, 107-B",American Economic Association,New Perspectives on Corporate Governance,G3,Luigi Zingales,University of Chicago,Franklin Allen,University of Pennsylvania,Amit Seru,University of Chicago,Frank Partnoy,University of California-San Diego,,,,,ALEXANDER DYCK,Male,,,,,,NA,NA,NA,NA,NA
Alexander Galetovic,Is there a PPP Interest Rate Premium?,Universidad de los Andes,Jan 04 2014,12:30 PM,"Philadelphia Marriott, Meeting Room 406",Transportation & Public Utilities Group,Transportation Public-Private Partnerships,L9,Wayne Talley,Old Dominion University,Patrick McCarthy,Georgia Institute of Technology,Thierry Vanelslander,University of Antwerp,Roger Vickerman,University of Kent,,,,,ALEXANDER GALETOVIC,Male,,,,,,NA,NA,NA,NA,NA
Alexander Ljungqvist,Corporate Investment and Stock Market Listing: A Puzzle?,New York University,Jan 04 2014,2:30 PM,"Loews Philadelphia Hotel, Commonwealth Hall C",American Finance Association,Corporate Governance,G3,Bo Becker,Harvard Business School,Denis Gromb,INSEAD,Xavier Giroud,Massachusetts Institute of Technology,Francisco Perez-Gonzalez,Stanford University,Gustavo Manso,University of California-Berkely,,,ALEXANDER LJUNGQVIST,Male,,,,,,NA,NA,NA,NA,NA
Alexander Ljungqvist,Managerial Labor Market Frictions and Corporate Investment,New York University,Jan 05 2014,10:15 AM,"Loews Philadelphia Hotel, Congress C",Association of Financial Economists,Corporate Investment,G3,Anthony Saunders,New York University,Daniel Wolfenzon,Columbia University,Paige Ouimet,University of North Carolina-Chapel Hill,Lalitha Naveen,Temple University,,,,,ALEXANDER LJUNGQVIST,Male,,,,,,NA,NA,NA,NA,NA
Alexander Rothenberg,Collective Action in Diverse Sierra Leone Communities,University of California-Berkeley,Jan 05 2014,1:00 PM,"Philadelphia Marriott, Grand Ballroom - Salon B",American Economic Association,"Accountability, Collective Action, and Information in Economic Development",O1,Karla Hoff,World Bank,Karla Hoff,World Bank,Andrew Zeitlin,Georgetown University,,,,,,,Alexander Rothenberg,Male,,,,,,NA,NA,NA,NA,NA
Alexander Strand,Disability Insurance and Healthcare Reform: Evidence from Massachusetts,Social Security Administration,Jan 04 2014,8:00 AM,"Pennsylvania Convention Center, 201-C",American Economic Association,The Impact of Health Insurance Expansions on Other Social Safety Net Programs,H5,Amy Finkelstein,Massachusetts Institute of Technology,David H. Autor,Massachusetts Institute of Technology,,,,,,,,,Alexander Strand,Male,,,,,,NA,NA,NA,NA,NA
Alexandra Roulet,Creative Destruction and Subjective Well-Being,Harvard University,Jan 05 2014,10:15 AM,"Pennsylvania Convention Center, 201-B",American Economic Association,"Growth, Innovation and Trade",O4,Paul Romer,New York University,,,,,,,,,,,Alexandra Roulet,Female,,,,,,NA,NA,NA,NA,NA
Alexei Onatski,Asymptotic Analysis of the Squared Estimation Error in Misspecified Factor Models,University of Cambridge,Jan 03 2014,8:00 AM,"Philadelphia Marriott, Meeting Room 401",Econometric Society,Big Data and High-Dimensional Problems,C3,Jushan Bai,Columbia University,,,,,,,,,,,ALEXEI ONATSKI,Male,,,,,,NA,NA,NA,NA,NA
Alice Chen,Why is Infant Mortality Higher in the United States Than in Europe?,University of Chicago,Jan 04 2014,2:30 PM,"Pennsylvania Convention Center, 204-A",American Economic Association,Investigating the Determinants of Infant Mortality,I1,Emily Oster,University of Chicago,,,,,,,,,,,Alice Chen,Female,,,,,,NA,NA,NA,NA,NA
Alireza Tahbaz-Salehi,Systemic Risk and Stability in Financial Networks,Columbia University,Jan 05 2014,10:15 AM,"Loews Philadelphia Hotel, Congress B",Society for Economic Dynamics,Networks in Macroeconomics and Finance,G1,Jennifer La'O,Columbia University,,,,,,,,,,,Alireza Tahbaz-Salehi,Male,,,,,,NA,NA,NA,NA,NA
Allan Timmermann,Forecasting Stock Returns Under Economic Constraints,University of California-San Diego,Jan 03 2014,10:15 AM,"Philadelphia Marriott, Meeting Room 401",Econometric Society,Advances in Macroeconometrics,C3,Barbara Rossi,Universitat Pompeu Fabra,,,,,,,,,,,ALLAN TIMMERMANN,Male,,,,,,NA,NA,NA,NA,NA
Allison Shertzer,Melted in the Pot or Consigned to the Ghetto? The Dynamics of Segregation and Assimilation in Urbanizing America,University of Pittsburgh,Jan 03 2014,10:15 AM,"Pennsylvania Convention Center, 201-A",American Economic Association,Looking Back at the United States during the Late Nineteenth Century: Lessons from the American Economy during the Time of the Great Migration Era,J6,Ethan Lewis,Dartmouth College,Richard Hornbeck,Harvard University,Darren Lubotsky,University of Illinois-Urbana-Champaign,David H. Autor,Massachusetts Institute of Technology,Elizabeth U. Cascio,Dartmouth College,,,Allison Shertzer,Female,,,,,,NA,NA,NA,NA,NA
Alp Simsek,Liquidity Trap and Excessive Leverage,Massachusetts Institute of Technology,Jan 04 2014,8:00 AM,"Philadelphia Marriott, Meeting Room 402",Econometric Society,Financial Frictions and the Macroeconomy,E5,Andrea Tambalotti,Federal Reserve Bank of New York,,,,,,,,,,,Alp Simsek,Male,,,,,,NA,NA,NA,NA,NA
Amalia R. Miller,Women Helping Women? Evidence from Private Sector Data on Plant Hierarchies,University of Virginia,Jan 05 2014,1:00 PM,"Philadelphia Marriott, Grand Ballroom - Salon J",American Economic Association,Gender in Organizational Hierarchies,J7,Amalia Miller,University of Virginia,Manuel Bagues,Universidad Carlos III,Mario Macis,"Johns Hopkins University, IZA",Francine D. Blau,Cornell University,Fidan Ana Kurtulus,University of Massachusetts-Amherst,,,Amalia R. Miller,Female,AMALIA MILLER,,,,,NA,NA,NA,NA,NA
Amanda E. Kowalski,Adverse Selection and an Individual Mandate: When Theory Meets Practice,Yale University,Jan 03 2014,10:15 AM,"Philadelphia Marriott, Meeting Room 305",International Health Economics Association,Health Insurance Markets and Coverage,I1,Laurence Baker,Stanford University,,,,,,,,,,,Amanda E. Kowalski,Female,AMANDA KOWALSKI,,,,,NA,NA,NA,NA,NA
