author,paper_title,author_affiliation,date,time,location,association,session_title,session_jel_code,session_chair,session_chair_affiliation,discussant_1,discussant_1_affiliation,discussant_2,discussant_2_affiliation,discussant_3,discussant_3_affiliation,discussant_4,discussant_4_affiliation,discussant_5,discussant_5_affiliation,author.y,gender,alternative_1,alternative_2,alternative_3,alternative_4,alternative_5,X,X.1,X.2,X.3,X.4
Ponpoje Porapakkarm,Cross-Subsidization in Employer-Based Health Insurance and the Effect of Tax Subsidy Reform,University of Macau,Jan 03 2014,2:30 PM,"Philadelphia Marriott, Meeting Room 404",Econometric Society,Evaluating Health Insurance Reform,H5,Hanming Fang,University of Pennsylvania,,,,,,,,,,,Ponpoje Porapakkarm,Male,,,,,,NA,NA,NA,NA,NA
Prakash Loungani,Information Rigidities in Economic Growth Forecasts: Evidence from a Large International Panel,International Monetary Fund,Jan 03 2014,2:30 PM,"Pennsylvania Convention Center, 106-B",Society of Government Economists,Information Rigidity in Survey Expectations,D8,Olivier Coibion,University of Texas-Austin,Paul Hubert,OFCE-Sciences PO,Benjamin K. Johannsen,Federal Reserve Board,Tara Sinclair,George Washington University,MIn Wei,Federal Reserve Board,,,Prakash Loungani,Male,,,,,,NA,NA,NA,NA,NA
Prashant Bharadwaj,"Smoking Bans, Maternal Smoking and Birth Outcomes",University of California-San Diego,Jan 04 2014,2:30 PM,"Pennsylvania Convention Center, 204-A",American Economic Association,Investigating the Determinants of Infant Mortality,I1,Emily Oster,University of Chicago,,,,,,,,,,,Prashant Bharadwaj,Male,,,,,,NA,NA,NA,NA,NA
Rachel Glennerster,Reshaping Institutions: Evidence on Aid Impacts Using a Preanalysis Plan,Massachusetts Institute of Technology,Jan 05 2014,8:00 AM,"Pennsylvania Convention Center, 204-B",American Economic Association,Research Transparency: Pre-Analysis Plans and Other Approaches for Economics,C9,Edward Miguel,University of California-Berkeley,Uri Simonsohn,"University of Pennsylvania, Wharton School of Business",,,,,,,,,Rachel Glennerster,Female,,,,,,NA,NA,NA,NA,NA
Rachel Glennerster,Collective Action in Diverse Sierra Leone Communities,Massachusetts Institute of Technology,Jan 05 2014,1:00 PM,"Philadelphia Marriott, Grand Ballroom - Salon B",American Economic Association,"Accountability, Collective Action, and Information in Economic Development",O1,Karla Hoff,World Bank,Karla Hoff,World Bank,Andrew Zeitlin,Georgetown University,,,,,,,Rachel Glennerster,Female,,,,,,NA,NA,NA,NA,NA
Rafael La Porta,Letter Grading Government Efficiency,Dartmouth College,Jan 05 2014,8:00 AM,"Pennsylvania Convention Center, 201-B",American Economic Association,The Role of Management and Technology for Reallocation and Growth: Micro and Macro Evidence,L1,John Van Reenen,London School of Economics,,,,,,,,,,,RAFAEL LA PORTA,Male,RAFAEL LAPORTA,George Washington University Rafael La Porta,,,,NA,NA,NA,NA,NA
Raffaella Sadun,Managing the Family Firm: Evidence from CEOs at Work,Harvard University,Jan 04 2014,8:00 AM,"Pennsylvania Convention Center, 106-A",Industrial Organization Society,The Organization of Organizations,L2,Peter Cappelli,University of Pennsylvania,Alan Benson,University of Minnesota,Jennifer Brown,Northwestern University,Orie Shelef,Stanford University,Christopher Stanton,University of Utah,,,RAFFAELLA SADUN,Female,,,,,,NA,NA,NA,NA,NA
Raffaella Sadun,Management as a Technology,Harvard University,Jan 05 2014,8:00 AM,"Pennsylvania Convention Center, 201-B",American Economic Association,The Role of Management and Technology for Reallocation and Growth: Micro and Macro Evidence,L1,John Van Reenen,London School of Economics,,,,,,,,,,,RAFFAELLA SADUN,Female,,,,,,NA,NA,NA,NA,NA
Ralph Koijen,Health and Mortality Delta: Assessing the Welfare Cost of Household Insurance Choice,University of Chicago,Jan 04 2014,2:30 PM,"Loews Philadelphia Hotel, Regency Ballroom A",American Finance Association,Household Finance: Retirement-Labor Choices,G1,Adair Morse,University of California-Berkeley,Deborah Lucas,Massachusetts Institute of Technology,Jonathan A. Parker,Northwestern University,Olivia S. Mitchell,University of Pennsylvania,Jonathan Morduch,New York University,,,RALPH KOIJEN,Male,,,,,,NA,NA,NA,NA,NA
Ralph Koijen,The Cost of Financial Frictions for Life Insurers,University of Chicago,Jan 05 2014,8:00 AM,"Loews Philadelphia Hotel, Regency Ballroom B",American Finance Association,Capital Constraints in the Crisis: Empirical Evidence,G2,Arvind Krishnamurthy,Northwestern University,Anna Paulson,Federal Reserve Bank of Chicago,Richard Rosen,Federal Reserve Bank of Chicago,Manuel Adelino,Duke University,,,,,RALPH KOIJEN,Male,,,,,,NA,NA,NA,NA,NA
Ran Abramitzky,A Nation of Immigrants: Assimilation and Economic Outcomes in the Age of Mass Migration,Stanford University,Jan 03 2014,10:15 AM,"Pennsylvania Convention Center, 201-A",American Economic Association,Looking Back at the United States during the Late Nineteenth Century: Lessons from the American Economy during the Time of the Great Migration Era,J6,Ethan Lewis,Dartmouth College,Richard Hornbeck,Harvard University,Darren Lubotsky,University of Illinois-Urbana-Champaign,David H. Autor,Massachusetts Institute of Technology,Elizabeth U. Cascio,Dartmouth College,,,RAN ABRAMITZKY,Male,,,,,,NA,NA,NA,NA,NA
Randall A. Lewis,On the Near Impossibility of Measuring the Returns to Advertising,"Google, Inc",Jan 04 2014,8:00 AM,"Pennsylvania Convention Center, 103-A",American Economic Association,Economics of Digital Advertising,M3,Justin Rao,Microsoft Research,Michael Grubb,Boston College,Garrett Johnson,Rochester University,David Reiley,"Google, Inc",Tyler Williams,Amazon,,,Randall A. Lewis,Male,Randall Lewis,,,,,NA,NA,NA,NA,NA
Randall Walsh,W.U.I. On Fire: Risk Salience in the Colorado Front Range,University of Pittsburgh,Jan 03 2014,2:30 PM,"Philadelphia Marriott, Grand Ballroom - Salon K",Association of Environmental & Resource Economists,"Uncertainty, Risk, and Discounting in Climate Policy",Q4,Thomas Sterner,University of Gothenburg,Geoffrey Heal,Columbia University,Howard Kunreuther,University of Pennsylvania,Nicholas Flores,University of Colorado,Thomas Sterner,University of Gothenburg,,,RANDALL WALSH,Male,,,,,,NA,NA,NA,NA,NA
Randall Walsh,Melted in the Pot or Consigned to the Ghetto? The Dynamics of Segregation and Assimilation in Urbanizing America,University of Pittsburgh,Jan 03 2014,10:15 AM,"Pennsylvania Convention Center, 201-A",American Economic Association,Looking Back at the United States during the Late Nineteenth Century: Lessons from the American Economy during the Time of the Great Migration Era,J6,Ethan Lewis,Dartmouth College,Richard Hornbeck,Harvard University,Darren Lubotsky,University of Illinois-Urbana-Champaign,David H. Autor,Massachusetts Institute of Technology,Elizabeth U. Cascio,Dartmouth College,,,RANDALL WALSH,Male,,,,,,NA,NA,NA,NA,NA
Randi Hjalmarsson,The Importance of Family Background and Neighbourhood Effects as Determinants of Crime,"Queen Mary, University of London, and University of Gothenburg",Jan 05 2014,8:00 AM,"Philadelphia Marriott, Grand Ballroom - Salon K",American Economic Association,Economics of Crime,K4,Matthew Lindquist,"SOFI, Stockholm University",Erdal Tekin,Georgia State University,Matthew J. Lindquist,"SOFI, Stockholm University",Patrick Bayer,NBER and Duke University,Jacob L. Vigdor,Duke University,,,Randi Hjalmarsson,Female,,,,,,NA,NA,NA,NA,NA
Raphael Schoenle,"Rational Inattention, Multi-Product Firms and the Neutrality of Money",Brandeis University,Jan 05 2014,10:15 AM,"Pennsylvania Convention Center, 202-B",American Economic Association,Price Stickiness: Causes and Consequences,E3,Peter Klenow,Stanford University,Benjamin Malin,Federal Reserve Bank of Minneapolis,Eric Anderson,Northwestern University,Oleksiy Kryvtsov,Bank of Canada,Etienne Gagnon,Federal Reserve Board,,,Raphael Schoenle,Male,,,,,,NA,NA,NA,NA,NA
Rasmus Landerso,School Starting Age and Crime,Rockwool Foundation Research Unit and Aarhus University,Jan 05 2014,8:00 AM,"Philadelphia Marriott, Grand Ballroom - Salon K",American Economic Association,Economics of Crime,K4,Matthew Lindquist,"SOFI, Stockholm University",Erdal Tekin,Georgia State University,Matthew J. Lindquist,"SOFI, Stockholm University",Patrick Bayer,NBER and Duke University,Jacob L. Vigdor,Duke University,,,Rasmus Landerso,Male,,,,,,NA,NA,NA,NA,NA
Raymond Fisman,The Mortality Cost of Political Connections,Columbia University,Jan 05 2014,1:00 PM,"Pennsylvania Convention Center, 202-B",American Economic Association,Politics and Finance,G3,Raymond Fisman,Columbia University,Lauren H. Cohen,Harvard University,Ran Duchin,University of Washington,Jun Qian,Boston College,Oguzhan Karakas,Boston College,,,RAYMOND FISMAN,Male,,,,,,NA,NA,NA,NA,NA
Raymond Fisman,The Impact of Cultural Aversion on Economic Exchange: Evidence from Shocks to Sino-Japanese Relations,Columbia University,Jan 03 2014,8:00 AM,"Loews Philadelphia Hotel, Congress B",Association of Financial Economists/American Economic Association,Moral Attitudes and Financial Decision-Making,G3,Michael Jensen,Harvard University,Harrison Hong,Princeton University,Paola Sapienza,Northwestern University,Alexander Dyck,University of Toronto,Adair Morse,University of California-Berkeley,Michael Jensen,Harvard University,RAYMOND FISMAN,Male,,,,,,NA,NA,NA,NA,NA
Raymond Guiteras,Does Development Aid Undermine Political Accountability? Voter and Politician Responses to a Large-Scale Randomized Intervention,University of Maryland,Jan 04 2014,2:30 PM,"Philadelphia Marriott, Grand Ballroom - Salon B",American Economic Association,Toilet Papers: The Economics of Sanitation in Developing Countries,O1,Anne Case,Princeton University,Seema Jayachandran,Northwestern University,Pascaline Dupas,Stanford University,Alix Zwane,Bill and Melinda Gates Foundation,,,,,RAYMOND GUITERAS,Male,,,,,,NA,NA,NA,NA,NA
Raymond Guiteras,"Credit Constraints, Present Bias and Investment in Health: Evidence from Micropayments for Clean Water in Dhaka",University of Maryland,Jan 03 2014,2:30 PM,"Philadelphia Marriott, Meeting Room 407",Association for Economic & Development Studies in Bangladesh,"Food Price Shocks, Health and Minority Groups",O1,Mahmudul Anam,York University,Takashi Kurosaki,Hitotsubashi University,Yasuyuki Sawada,University of Tokyo,Christopher Udry,Yale University,Arif Mamun,Mathematica Policy Research,,,RAYMOND GUITERAS,Male,,,,,,NA,NA,NA,NA,NA
Rema Hanna,The Effect of Monitoring on Health Care Providers in India,Harvard University,Jan 05 2014,10:15 AM,"Philadelphia Marriott, Meeting Room 406",Econometric Society,Using Information Technology to Improve Health in Developing Countries,O1,Wesley Yin,Boston University,Yi Qian,Northwestern University,Leigh Linden,University of Texas-Austin,Simone Gabrielle Schaner,Dartmouth College,,,,,Rema Hanna,Female,,,,,,NA,NA,NA,NA,NA
Rene M. Stulz,Why Did Financial Institutions Sell RMBS at Fire Sale Prices during the Financial Crisis?,Ohio State University,Jan 05 2014,8:00 AM,"Loews Philadelphia Hotel, Regency Ballroom B",American Finance Association,Capital Constraints in the Crisis: Empirical Evidence,G2,Arvind Krishnamurthy,Northwestern University,Anna Paulson,Federal Reserve Bank of Chicago,Richard Rosen,Federal Reserve Bank of Chicago,Manuel Adelino,Duke University,,,,,RENE M. STULZ,Male,René Stulz,René M. Stulz,RENE STULZ,,,NA,NA,NA,NA,NA
Ricard Gil,Reel Authority: Relational Renegotiation in the Movie Industry,Johns Hopkins University,Jan 04 2014,10:15 AM,"Pennsylvania Convention Center, 106-A",Industrial Organization Society,Empirical Studies of Contracts,D8,Bernard Salanie,Columbia University,Pierre Dubois,Toulouse School of Economics,Julie Mortimer,Boston College,Steven Tadelis,University of California-Berkeley,Jaap Abbring,Tilburg University,,,RICARD GIL,Male,,,,,,NA,NA,NA,NA,NA
Ricardo Reis,The Euro Crisis: A Crash Course,Columbia University,Jan 03 2014,2:30 PM,"Pennsylvania Convention Center, 201-A",American Economic Association,Teaching the Euro Crisis,F3,Maurice Obstfeld,University of California-Berkeley,Ricardo Reis,Columbia University,Tano Santos,Columbia University,Markus K. Brunnermeier,Princeton University,,,,,RICARDO REIS,Male,,,,,,NA,NA,NA,NA,NA
Ricardo Reis,Can the United States inflate away its fiscal problems?,Columbia University,Jan 04 2014,8:00 AM,"Philadelphia Marriott, Grand Ballroom - Salon F",American Economic Association,Understanding Economic and Financial Crises,E6,Henning Bohn,University of California-Santa Barbara,John B. Taylor,Stanford University,John Leahy,New York University,Olivier Blanchard,International Monetary Fund,Andrew Berg,International Monetary Fund,,,RICARDO REIS,Male,,,,,,NA,NA,NA,NA,NA
Riccardo Colacito,Robust Exchange Rates with Rare Events,University of North Carolina-Chapel Hill,Jan 04 2014,2:30 PM,"Pennsylvania Convention Center, 108-B",American Economic Association,Global Risks and Currencies: Theory and Evidence,F3,Lars Hansen,University of Chicago,Viktor Todorov,Northwestern University,Jose Ursua,Goldman Sachs,Jessica Wachter,University of Pennsylvania,Lars Hansen,University of Chicago,,,Riccardo Colacito,Male,,,,,,NA,NA,NA,NA,NA
Richard Blundell,Prices versus Preferences: Taste Change and Tobacco Consumption,University College London,Jan 03 2014,10:15 AM,"Pennsylvania Convention Center, 107-B",American Economic Association,Revealed Preference Theory and Applications: Recent Developments,D1,Bram De Rock,Université libre de Bruxelles,Arthur Lewbel,Boston College,Abi Adams,Oxford University,Thomas Demuynck,University of Leuven,Laurens Cherchye,University of Leuven,,,Richard Blundell,Male,,,,,,NA,NA,NA,NA,NA
Richard Blundell,"Labor Income Dynamics and the Insurance from Taxes, Transfers, and the Family",University College London and Institute for Fiscal Studies,Jan 04 2014,10:15 AM,"Pennsylvania Convention Center, 103-C",American Economic Association,Nature of Labor Income Dynamics,J3,Fatih Karahan,Federal Reserve Bank of New York,,,,,,,,,,,Richard Blundell,Male,,,,,,NA,NA,NA,NA,NA
Richard Burkhauser,Accounting for Income Changes over the Great Recession (2007-2010) Relative to Previous Recessions: The Importance of Taxes and Transfers,Cornell University,Jan 04 2014,2:30 PM,"Loews Philadelphia Hotel, Washington A",National Tax Association,"Taxes, Top Incomes, and Executive Compensation",H2,Seth Giertz,University of Nebraska,Jeffrey Thompson,Federal Reserve Board,Dhammika Dharmapala,University of Illinois,,,,,,,RICHARD BURKHAUSER,Male,,,,,,NA,NA,NA,NA,NA
Richard Green,Measuring the Benefits of Homeowning: Effects on Children Redux,University of Southern California,Jan 04 2014,8:00 AM,"Loews Philadelphia Hotel, Washington B",American Real Estate & Urban Economic Association,Homeownership,R3,Donald Haurin,Ohio State University,Thomas Davidoff,University of British Columbia,Michael Collins,University of Wisconsin,Steven Bourassa,University of Louisville,Anthony Yezer,George Washington University,,,RICHARD GREEN,Male,,,,,,NA,NA,NA,NA,NA
Richard Hornbeck,Adverse Selection in the Market for Catastrophic Health Insurance: Some Evidence from India,Harvard University,Jan 03 2014,8:00 AM,"Pennsylvania Convention Center, 201-C",American Economic Association,The Demand for Insurance in Developing Countries,O1,Benjamin Olken,Massachusetts Institute of Technology,Seema Jayachandran,Northwestern University,Tavneet Suri,Massachusetts Institute of Technology,Jishnu Das,World Bank,,,,,RICHARD HORNBECK,Male,,,,,,NA,NA,NA,NA,NA
Richard Hornbeck,Railroads and American Economic Growth: A Market Access Approach,Harvard University,Jan 04 2014,10:15 AM,"Pennsylvania Convention Center, 105-B",American Economic Association,Trade and Development,F1,Stephen Redding,Princeton University,Gilles Duranton,University of Pennsylvania,Brian Kovak,Carnegie Mellon University,David Lagakos,University of California-San Diego,David E. Weinstein,Columbia University,,,RICHARD HORNBECK,Male,,,,,,NA,NA,NA,NA,NA
Richard Kneller,Demand Shocks and Productivity: Technology Adoption During the U.S. Ethanol Boom,University of Nottingham,Jan 03 2014,8:00 AM,"Pennsylvania Convention Center, 202-A",American Economic Association,Productivity,O4,Wayne Gray,Clark University,,,,,,,,,,,Richard Kneller,Male,,,,,,NA,NA,NA,NA,NA
Richard Stanton,"The Myth of the Constant-Quality Home: A New, Unbiased House-Price Index",University of California-Berkeley,Jan 04 2014,2:30 PM,"Loews Philadelphia Hotel, Washington B",American Real Estate & Urban Economic Association,Real Estate Values,R3,Anthony Yezer,George Washington University,William Larson,Bureau of Economic Analysis,Amanda Ross,West Virginia University,Brent Smith,Virginia Commonwealth University,Chao Yue Tian,University of North Carolina,,,Richard Stanton,Male,,,,,,NA,NA,NA,NA,NA
Richard Townsend,Swinging for the Fences: Executive Reactions to Quasi-Random Option Grants,Dartmouth College,Jan 05 2014,10:15 AM,"Loews Philadelphia Hotel, Commonwealth Hall C",American Finance Association,Managerial Incentives II,G3,Bilge Yilmaz,University of Pennsylvania,Mark Jenkins,University of Pennsylvania,Nadya Malenko,Boston College,Robert Marquez,University of California-Davis,,,,,Richard Townsend,Male,,,,,,NA,NA,NA,NA,NA
Richard Zeckhauser,Expecting a Black Swan and Getting a Dragon: Rational Responses to Ignorance,Harvard University,Jan 03 2014,2:30 PM,"Philadelphia Marriott, Grand Ballroom - Salon K",Association of Environmental & Resource Economists,"Uncertainty, Risk, and Discounting in Climate Policy",Q4,Thomas Sterner,University of Gothenburg,Geoffrey Heal,Columbia University,Howard Kunreuther,University of Pennsylvania,Nicholas Flores,University of Colorado,Thomas Sterner,University of Gothenburg,,,RICHARD ZECKHAUSER,Male,,,,,,NA,NA,NA,NA,NA
Rita Ginja,Tackling Social Exclusion: Evidence from Chile,Uppsala University,Jan 05 2014,1:00 PM,"Philadelphia Marriott, Grand Ballroom - Salon A",American Economic Association,Welfare Policies in Latin American,I3,Flavio Cunha,University of Pennsylvania,Renata Narita,World Bank,Alex Solis,Uppsala University,Rita Ginja,Uppsala University,Pedro Carneiro,University College London,,,Rita Ginja,Female,,,,,,NA,NA,NA,NA,NA
Rita Ginja,Evaluating a Universal Health Insurance Program: Lessons from Mexico,Uppsala University,Jan 05 2014,1:00 PM,"Philadelphia Marriott, Grand Ballroom - Salon A",American Economic Association,Welfare Policies in Latin American,I3,Flavio Cunha,University of Pennsylvania,Renata Narita,World Bank,Alex Solis,Uppsala University,Rita Ginja,Uppsala University,Pedro Carneiro,University College London,,,Rita Ginja,Female,,,,,,NA,NA,NA,NA,NA
Robert A. Margo,Economies of Scale in Nineteenth Century American Manufacturing Revisited: A Resolution of the Entrepreneurial Labor Input Problem,Boston University and NBER,Jan 03 2014,2:30 PM,"Philadelphia Marriott, Meeting Room 406",Cliometrics Society,"Enterprising America: Businesses, Banks, and Credit Markets in Historical Perspective",N2,William Collins,Vanderbilt University and NBER,Carola Frydman,Boston University and NBER,William Collins,Vanderbilt University and NBER,Matthew Jaremski,Colgate University and NBER,,,,,Robert A. Margo,Male,ROBERT MARGO,,,,,NA,NA,NA,NA,NA
Robert A. Margo,Mandolin Solo,Boston University,Jan 03 2014,8:00 PM,"Philadelphia Marriott, Liberty Ballroom",American Economic Association,Music Festival,Y9,Stephen Wu,Hamilton College,,,,,,,,,,,Robert A. Margo,Male,ROBERT MARGO,,,,,NA,NA,NA,NA,NA
Robert A. Margo,Technical Change and the Relative Demand for Skilled Labor: The United States in Historical Perspective,Boston University,Jan 03 2014,10:15 AM,"Pennsylvania Convention Center, 201-A",American Economic Association,Looking Back at the United States during the Late Nineteenth Century: Lessons from the American Economy during the Time of the Great Migration Era,J6,Ethan Lewis,Dartmouth College,Richard Hornbeck,Harvard University,Darren Lubotsky,University of Illinois-Urbana-Champaign,David H. Autor,Massachusetts Institute of Technology,Elizabeth U. Cascio,Dartmouth College,,,Robert A. Margo,Male,ROBERT MARGO,,,,,NA,NA,NA,NA,NA
Robert Barro,Economic Growth and Convergence,Harvard University,Jan 04 2014,10:15 AM,"Pennsylvania Convention Center, 204-B",American Economic Association,Rapid Growth or Stagnation for the United States Economy?,F4,Dominick Salvatore,Fordham University,Dale Jorgenson,Harvard University,,,,,,,,,ROBERT BARRO,Male,,,,,,NA,NA,NA,NA,NA
Robert Barsky,The Natural Rate of Interest and Its Usefulness for Monetary Policy Making,Federal Reserve Bank of Chicago and University of Michigan,Jan 03 2014,8:00 AM,"Philadelphia Marriott, Grand Ballroom - Salon E",American Economic Association,What's Natural? Key Macroeconomic Parameters after the Great Recession,E1,Matthew Shapiro,University of Michigan,Michael Woodford,Columbia University,Robert E. Hall,Stanford University,Susanto Basu,Boston College,,,,,ROBERT BARSKY,Male,,,,,,NA,NA,NA,NA,NA
Robert Collinson,Incidence and Price Discrimination: Evidence from Housing Vouchers,Department of Housing and Urban Development,Jan 03 2014,2:30 PM,"Loews Philadelphia Hotel, Washington A",American Real Estate & Urban Economic Association,Housing Markets and Consumer Preferences,R2,Ed Olsen,University of Virginia,Judy Geyer,Abt Associates,Michael Eriksen,University of Georgia,Christopher Parmeter,University of Miami,Jaren Pope,Brigham Young University,,,Robert Collinson,Male,,,,,,NA,NA,NA,NA,NA
Robert Goldstein,On Bounding Credit Event Risk Premia,University of Minnesota,Jan 04 2014,8:00 AM,"Loews Philadelphia Hotel, Regency Ballroom A",American Finance Association,Credit Risk II,G2,Monika Piazzesi,Stanford University,Wei Xiong,Princeton University,David Lando,Copenhagen Business School,Pierre Collin-Dufresne,Columbia University,Tim McQuade,Harvard University,,,ROBERT GOLDSTEIN,Male,,,,,,NA,NA,NA,NA,NA
Robert J. Gordon,Evaporating Growth: Can Anything Be Done?,Northwestern University,Jan 04 2014,2:30 PM,"Pennsylvania Convention Center, 204-C",Society for Policy Modeling/American Economic Association,Has Innovation Stopped Driving Growth?,D2,Dominick Salvatore,Fordham University,Dominick Salvatore,Fordham University,,,,,,,,,ROBERT J. GORDON,Male,,,,,,NA,NA,NA,NA,NA
Robert Kaestner,Medicaid Expansions and the Labor Supply of Pregnant Women: Explaining the Crowd-out of Private Insurance,University of Illinois,Jan 03 2014,10:15 AM,"Pennsylvania Convention Center, 106-B",Society of Government Economists,Government and Health,H2,Susan Averett,Lafayette College,David Simon,University of California-Davis,Laura M. Argys,University of Colorado-Denver,Muzhe Yang,Lehigh University,Carly Urban,Montana State University,,,Robert Kaestner,Male,,,,,,NA,NA,NA,NA,NA
Robert Mendelsohn,Do Temperature Thresholds Threaten American Farmland?,Yale University,Jan 04 2014,2:30 PM,"Philadelphia Marriott, Grand Ballroom - Salon K",Association of Environmental & Resource Economists,"Agriculture, Land Use and Climate",Q1,Maximilian Auffhammer,University of California-Berkeley,Michael Roberts,University of Hawaii,Cathy Kling,Iowa State University,Ram Fishman,George Washington University,Eduardo A. Souza-Rodrigues,University of Toronto,,,ROBERT MENDELSOHN,Male,,,,,,NA,NA,NA,NA,NA
Robert Metcalfe,The Behavioralist Goes to the Tax Office: Evidence from Two Nationwide Field Experiments,University of Chicago,Jan 05 2014,8:00 AM,"Philadelphia Marriott, Grand Ballroom - Salon A",American Economic Association,Field Experiments in Tax Compliance,H2,John List,University of Chicago,Michael K. Price,Georgia State University,Mark Phillips,Internal Revenue Service,Mark Rider,Georgia State University,Anya C. Samak,University of Wisconsin-Madison,,,Robert Metcalfe,Male,,,,,,NA,NA,NA,NA,NA
Robert Metcalfe,Using Omission Bias to Increase Payments to the Government,University of Chicago,Jan 05 2014,8:00 AM,"Philadelphia Marriott, Grand Ballroom - Salon A",American Economic Association,Field Experiments in Tax Compliance,H2,John List,University of Chicago,Michael K. Price,Georgia State University,Mark Phillips,Internal Revenue Service,Mark Rider,Georgia State University,Anya C. Samak,University of Wisconsin-Madison,,,Robert Metcalfe,Male,,,,,,NA,NA,NA,NA,NA
Robert Ready,Commodity Trade and the Carry Trade: A Tale of Two Countries,University of Rochester,Jan 04 2014,10:15 AM,"Loews Philadelphia Hotel, Regency Ballroom C2",International Economic & Finance Society,Exchange Rates and Fundamentals,F4,Karen Lewis,University of Pennsylvania,Adrien Verdelhan,Massachusetts Institute of Technology,Riccardo Colacito,University of North Carolina,Chris Telmer,Carnegie Mellon University,Lucasz Drozd,University of Pennsylvania,,,Robert Ready,Male,,,,,,NA,NA,NA,NA,NA
Robert Ready,Commodity Trade and the Carry Trade: A Tale of Two Countries,University of Rochester,Jan 04 2014,10:15 AM,"Loews Philadelphia Hotel, Regency Ballroom C2",International Economic & Finance Society,Exchange Rates and Fundamentals,F4,Karen Lewis,University of Pennsylvania,Adrien Verdelhan,Massachusetts Institute of Technology,Riccardo Colacito,University of North Carolina,Chris Telmer,Carnegie Mellon University,Lucasz Drozd,University of Pennsylvania,,,Robert Ready,Male,,,,,,NA,NA,NA,NA,NA
Robert Ready,Commodity Trade and the Carry Trade: A Tale of Two Countries,University of Rochester,Jan 03 2014,10:15 AM,"Loews Philadelphia Hotel, Commonwealth Hall D",American Finance Association,The Currency Carry Trade: New Evidence and Theory,G1,Chris Telmer,Carnegie Mellon University,Matteo Maggiori,New York University,Adrien Verdelhan,Massachusetts Institute of Technology,Tarek Hassan,University of Chicago,Michael Michaux,University of Southern California,,,Robert Ready,Male,,,,,,NA,NA,NA,NA,NA
