author,paper_title,author_affiliation,date,time,location,association,session_title,session_jel_code,session_chair,session_chair_affiliation,discussant_1,discussant_1_affiliation,discussant_2,discussant_2_affiliation,discussant_3,discussant_3_affiliation,discussant_4,discussant_4_affiliation,discussant_5,discussant_5_affiliation,author.y,gender,alternative_1,alternative_2,alternative_3,alternative_4,alternative_5,X,X.1,X.2,X.3,X.4
Ricardo Perez-Truglia,Tax Audits as Scarecrows: Evidence from a Large-Scale Field Experiment,University of California-Los Angeles,Jan. 6 2018,2:30 PM - 4:30 PM,"Pennsylvania Convention Center, 105-A",American Economic Association,Policy Implications of Suboptimal Choice: Theory and Evidence,"H0, D6",NA,NA,Judd Benjamin Kessler,University of Pennsylvania,Benjamin B. Lockwood,University of Pennsylvania,Jacob Goldin,Stanford University,Alex Rees-Jones,University of Pennsylvania,Keith Ericson,Boston University,Ricardo Perez-Truglia,Male,,,,,,NA,NA,NA,NA,NA
Ricardo Reis,Friedman's Presidential Address in the Evolution of Macroeconomic Theory,London School of Economics,Jan. 5 2018,2:30 PM - 4:30 PM,"Marriott Philadelphia Downtown, Liberty Ballroom Salon A",American Economic Association,The 50th Anniversary of Milton Friedman's Presidential Address,E0,NA,NA,Stanley Fischer,Federal Reserve Board,Emi Nakamura,Columbia University,Lawrence H. Summers,Harvard University,,,,,RICARDO REIS,Male,,,,,,NA,NA,NA,NA,NA
Ricardo Reis,The Role of Countercyclical Fiscal Policy in a Low r* World,London School of Economics,Jan. 5 2018,8:00 AM - 10:00 AM,"Marriott Philadelphia Downtown, Grand Ballroom Salon C",American Economic Association,Fiscal Policy,"E3, F3",NA,NA,Sushant Acharya,Federal Reserve Bank of New York,David Evans,University of Oregon,Kyle Herkenhoff,University of Minnesota,Jesus Fernandez-Villaverde,University of Pennsylvania,,,RICARDO REIS,Male,,,,,,NA,NA,NA,NA,NA
Riccardo Colacito,Volatility Risk Pass-through,University of North Carolina-Chapel Hill,Jan. 5 2018,10:15 AM - 12:15 PM,"Marriott Philadelphia Downtown, Meeting Room 403",Econometric Society,Advances in International Finance,A1,NA,NA,Andreas Stathopoulos,University of Washington,Luigi Bocola,Northwestern University,Rosen Valchev,Boston College,Pasquale Della Corte,Imperial College London and CEPR,,,Riccardo Colacito,Male,,,,,,NA,NA,NA,NA,NA
Richard Akresh,First and Second Generation Impacts of the Biafran War,University of Illinois,Jan. 7 2018,8:00 AM - 10:00 AM,"Marriott Philadelphia Downtown, Meeting Room 305",Peace Science Society International,Developing Country Conflict,"F5, I3",NA,NA,Raul Caruso,Catholic University of the Sacred Heart,Marlon Tracey,Southern Illinois University,David Slichter,State University of New York-Binghamton,Solomon W. Polachek,State University of New York-Binghamton,Carlos Seiglie,Rutgers University,RICHARD AKRESH,Male,,,,,,NA,NA,NA,NA,NA
Richard Blundell,"Labor Supply, Human Capital Investment and Welfare Reform",University College London,Jan. 5 2018,8:00 AM - 10:00 AM,"Marriott Philadelphia Downtown, Meeting Room 414",Econometric Society,"The Effect of Taxes and Transfers on Labor Supply, Savings, and Health Insurance","J00, I1",NA,NA,Zvi Eckstein,Tel Aviv University,Hanming Fang,University of Pennsylvania,Wilbert VanderKlaauw,Federal Reserve Bank of New York,Hamish Low,University of Cambridge,,,Richard Blundell,Male,,,,,,NA,NA,NA,NA,NA
Richard Blundell,Nonlinear Persistence and Partial Insurance: Income Dynamics and Consumption Insurance in the PSID,University College London,Jan. 5 2018,10:15 AM - 12:15 PM,"Marriott Philadelphia Downtown, Grand Ballroom Salon I",American Economic Association,The Dynamics of Income: Celebrating 50 years of the PSID,"J3, E2",NA,NA,Karen Dynan,Harvard University,James Ziliak,University of Kentucky,,,,,,,Richard Blundell,Male,,,,,,NA,NA,NA,NA,NA
Richard Freeman,Chinese-language Scientific Papers in Era of Globalization of Science: Relation Between CNKI and SCOPUS Non-Chinese Language Papers,Harvard University and NBER,Jan. 6 2018,8:00 AM - 10:00 AM,"Pennsylvania Convention Center, 102-A",Chinese Economists Society,"Innovation, Entrepreneurship, and Chinese Economy",O3,NA,NA,Jun Ma,Northeastern University,,,,,,,,,RICHARD FREEMAN,Male,,,,,,NA,NA,NA,NA,NA
Richard Green,Wage Trickle Down vs. Rent Trickle Down: How Does Increase in College Graduates Affect Wages and Rents?,University of Southern California,Jan. 7 2018,1:00 PM - 3:00 PM,"Loews Philadelphia, Washington C",American Real Estate and Urban Economics Association,Education and Homeownership,"R2, D0",NA,NA,Elliot Anenberg,Federal Reserve Board,Rebecca Diamond,Stanford University,Maisy Wong,University of Pennsylvania,Eric Brunner,University of Connecticut,,,RICHARD GREEN,Male,,,,,,NA,NA,NA,NA,NA
Richard Newell,Informing SPR Drawdown Policy through Oil Futures and Inventory Dynamics,Resources for the Future,Jan. 6 2018,10:15 AM - 12:15 PM,"Marriott Philadelphia Downtown, Independence Ballroom II",Association of Environmental and Resource Economists,Economics of Oil and Gas Markets,Q4,NA,NA,Maximilian Auffhammer,University of California-Berkeley,James Stock,Harvard University,Ashley Vissing,University of Chicago,Reid Stevens,Texas A&M University,,,RICHARD NEWELL,Male,,,,,,NA,NA,NA,NA,NA
Rigissa Megalokonomou,Persistency in Teachers' Grading Biases and Effect on Longer Term Outcomes: University Admission Exams and Choice of Field of Study,University of Queensland,Jan. 5 2018,2:30 PM - 4:30 PM,"Pennsylvania Convention Center, 106-B",Econometric Society,Economics of Education,I21,NA,NA,Stephen B. Billings,University of North Carolina-Charlotte,Judd Benjamin Kessler,University of Pennsylvania,Manuel Bagues,"Aalto University, CEPR and IZA",Sally Hudson,University of Virginia,,,Rigissa Megalokonomou,Unknown,,,,,,NA,NA,NA,NA,NA
Rita Ginja,Spillovers in Social Program Participation: Evidence From Chile,University of Bergen,Jan. 5 2018,10:15 AM - 12:15 PM,"Pennsylvania Convention Center, 102-A",Econometric Society,Public Economics,"H2, H3",NA,NA,Owen Michael Zidar,University of Chicago,Michael Best,Columbia University,Katherine Meckel,Texas A&M University,Erich Johann Muehlegger,University of California-Davis,,,Rita Ginja,Female,,,,,,NA,NA,NA,NA,NA
Rob Gillezeau,The Slaughter of the North American Bison and Reversal of Fortunes on the Great Plains,University of Victoria,Jan. 5 2018,2:30 PM - 4:30 PM,"Marriott Philadelphia Downtown, Grand Ballroom Salon I",American Economic Association,Issues in Native American Economic Development,"O1, J0",NA,NA,William A. Darity Jr,Duke University,Randall Akee,University of California-Los Angeles,Matthew J. Notowidigdo,Northwestern University,Krishna Pendakur,Simon Fraser University,,,Rob Gillezeau,Male,,,,,,NA,NA,NA,NA,NA
Rob Gillezeau,Don’t Shoot! The Impact of Historical African American Protest on Police Killings of Civilians,University of Victoria,Jan. 5 2018,8:00 AM - 10:00 AM,"Marriott Philadelphia Downtown, Meeting Room 309",National Economic Association,"Crime, Education, and Racial Disparities","I2, K4",NA,NA,Alberto Ortega,Whitman College,Luisa Blanco,Pepperdine University,Bradley L. Hardy,American University,Patrick Mason,Florida State University,,,Rob Gillezeau,Male,,,,,,NA,NA,NA,NA,NA
Robert Collinson,The Effects of Residential Evictions on Low-Income Adults,New York University,Jan. 7 2018,10:15 AM - 12:15 PM,"Loews Philadelphia, Washington B",American Real Estate and Urban Economics Association,"Housing Tenure, Evictions, and Property Rights Restrictions","R2, J0",NA,NA,John C. Weicher,Hudson Institute,Kevin Corinth,President’s Council of Economic Advisers,,,,,,,Robert Collinson,Male,,,,,,NA,NA,NA,NA,NA
Robert Fairlie,Parental Resources and College Attendance: Evidence From Lottery Wins,University of California-Santa Cruz,Jan. 5 2018,8:00 AM - 10:00 AM,"Pennsylvania Convention Center, 104-B",American Economic Association,Issues Relating to Higher Education Financing,"J0, I2",NA,NA,Seth Zimmerman,University of Chicago,Lesley Turner,University of Maryland,,,,,,,Robert Fairlie,Male,,,,,,NA,NA,NA,NA,NA
Robert Feenstra,Using Online Prices for Measuring Real Consumption Across Countries,University of California-Davis,Jan. 5 2018,2:30 PM - 4:30 PM,"Marriott Philadelphia Downtown, Grand Ballroom Salon E",American Economic Association,New Measures of the Economy,"O0, I3",NA,NA,Hal Varian,Google and University of California-Berkeley,Betsey Stevenson,University of Michigan,Charles Hulten,University of Maryland-College Park,Dennis Fixler,U.S. Bureau of Economic Analysis,,,ROBERT FEENSTRA,Male,,,,,,NA,NA,NA,NA,NA
Robert Huckman,The Adoption and Diffusion of Medical Technology: Evidence From Cardiac Valve Procedures,Harvard University,Jan. 6 2018,8:00 AM - 10:00 AM,"Marriott Philadelphia Downtown, Grand Ballroom Salon J",Health Economics Research Organization,Health Care Delivery: Establishing Links Between Evidence and Practice,I1,NA,NA,David Meltzer,University of Chicago,Atheendar Venkataramani,University of Pennsylvania,Jay Bhattacharya,Stanford University,,,,,ROBERT HUCKMAN,Male,,,,,,NA,NA,NA,NA,NA
Robert Johnson,Input Linkages and International Monetary Spillovers,Dartmouth College,Jan. 6 2018,10:15 AM - 12:15 PM,"Pennsylvania Convention Center, 104-B",American Economic Association,Transmission of Shocks Across Countries,"F4, E3",NA,NA,Yuriy Gorodnichenko,University of California-Berkeley,Ryan Monarch,Federal Reserve Board,Wataru Miyamoto,Bank of Canada,Kei-Mu Yi,University of Houston,,,Robert Johnson,Male,,,,,,NA,NA,NA,NA,NA
Robert Marquez,The Redistributive Effects of Bank Capital Regulation,University of California-Davis,Jan. 5 2018,8:00 AM - 10:00 AM,"Loews Philadelphia, Commonwealth Hall D",American Finance Association,Financial Regulation: Theory,G2,NA,NA,Douglas Diamond,University of Chicago,William Fuchs,University of Texas-Austin and University Carlos III of Madrid,Martin Oehmke,London School of Economics,David Martinez-Miera,University Carlos III,,,ROBERT MARQUEZ,Male,,,,,,NA,NA,NA,NA,NA
Robert Shiller,Crash Beliefs From Investor Surveys,Yale University,Jan. 7 2018,8:00 AM - 10:00 AM,"Loews Philadelphia, Regency Ballroom C2",American Finance Association,Volatility and Tail Risk,G1,NA,NA,Asaf Manela,Washington University-St. Louis,Tyler Muir,University of California-Los Angeles,Kris Jacobs,University of Houston,Jaroslav Borovicka,New York University,,,Robert Shiller,Male,,,,,,NA,NA,NA,NA,NA
Robert Shimer,The Emergence of Market Structure,University of Chicago,Jan. 5 2018,8:00 AM - 10:00 AM,"Marriott Philadelphia Downtown, Meeting Room 406",Econometric Society,Over-the-Counter Markets,A1,NA,NA,,,,,,,,,,,ROBERT SHIMER,Male,,,,,,NA,NA,NA,NA,NA
Robert Town,The Evolution of Returns to New Medical Innovations,University of Texas-Austin,Jan. 5 2018,2:30 PM - 4:30 PM,"Marriott Philadelphia Downtown, Meeting Room 307",American Society of Health Economists,Topics in Health Economics,I1,NA,NA,Jonathan Gruber,Massachusetts Institute of Technology,Mark Pauly,University of Pennsylvania,Laurence C. Baker,Stanford University,Anthony Lo Sasso,University of Illinois-Chicago,,,ROBERT TOWN,Male,,,,,,NA,NA,NA,NA,NA
Robert Townsend,Rise of Bank Competition: Evidence From Banking Deregulation in China,Massachusetts Institute of Technology,Jan. 7 2018,8:00 AM - 10:00 AM,"Loews Philadelphia, Commonwealth Hall A2",American Finance Association,Finance and Development,G3,NA,NA,Sumit Agarwal,Georgetown University,Martin Kanz,World Bank,Janis Skrastins,Washington University-St. Louis,,,,,Robert Townsend,Male,,,,,,NA,NA,NA,NA,NA
Robert W. Staiger,The Economic Structure of International Trade in Services Agreement,Dartmouth College,Jan. 5 2018,10:15 AM - 12:15 PM,"Loews Philadelphia, Lescaze",International Economics and Finance Society,The Economics of International Trade Agreements,F1,NA,NA,,,,,,,,,,,Robert W. Staiger,Male,ROBERT STAIGER,,,,,NA,NA,NA,NA,NA
Roberta Ziparo,Maternal Mortality Risk and the Gender Gap in Desired Fertility: An Experimental Study on Learning and Communication Inside the Household,Aix-Marseille University,Jan. 6 2018,2:30 PM - 4:30 PM,"Pennsylvania Convention Center, 107-B",American Economic Association,How Entrenched Are Gender Norms in Developing Countries?,"J1, O1",NA,NA,James Fenske,University of Warwick,Raquel Fernandez,New York University,Micaela Sviatschi,Princeton University,Rachel Heath,University of Washington,,,Roberta Ziparo,Female,,,,,,NA,NA,NA,NA,NA
Robin Burgess,Demand- and Supply-side Policies to Tackle Youth Unemployment: Evidence From a Labor Market Experiment in Uganda,London School of Economics,Jan. 6 2018,8:00 AM - 10:00 AM,"Pennsylvania Convention Center, 109-A",American Economic Association,Addressing Youth Unemployment: New Evidence From Field Experiments,"O1, J2",NA,NA,Corinne Low,University of Pennsylvania,Paul Gertler,University of California-Berkeley,Sarah Baird,George Washington University,David McKenzie,World Bank,,,ROBIN BURGESS,Male,,,,,,NA,NA,NA,NA,NA
Rodney Andrews,"Price Regulation, Price Discrimination, and Equality of Opportunity in Higher Education: Evidence From Texas",University of Texas-Dallas and NBER,Jan. 6 2018,10:15 AM - 12:15 PM,"Pennsylvania Convention Center, 109-A",American Economic Association,The Supply Side of Higher Education:  University Choices and the Implications for Students,I2,NA,NA,Mary Ann Bronson,Georgetown University,Michael Dinerstein,University of Chicago,Richard K. Mansfield,University of Colorado,Christopher Neilson,Princeton University,,,Rodney Andrews,Male,,,,,,NA,NA,NA,NA,NA
Rodney Ludema,The Sword and the Shield: The Economics of Targeted Sanctions,Georgetown University,Jan. 6 2018,8:00 AM - 10:00 AM,"Marriott Philadelphia Downtown, Independence Ballroom I",Economics of National Security Association,Economics of National Security,"H4, H5",NA,NA,Eli Berman,University of California-San Diego,Martin Feldstein,Harvard University and NBER,,,,,,,RODNEY LUDEMA,Male,,,,,,NA,NA,NA,NA,NA
Rohini Pande,Household Matters: Revisiting the Returns to Capital Among Female Microentrepreneurs,Harvard University,Jan. 7 2018,8:00 AM - 10:00 AM,"Pennsylvania Convention Center, 204-B",American Economic Association,Barriers to the Success of Female Owned Microenterprises,"O1, L2",NA,NA,Rachel Heath,University of Washington,David McKenzie,World Bank,Andreas Menzel,CERGE-EI,Christophe Jalil,French Institute of Research for Development,,,ROHINI PANDE,Female,,,,,,NA,NA,NA,NA,NA
Rohini Pande,Female Labor Supply and Economic Development in India,Harvard University,Jan. 7 2018,1:00 PM - 3:00 PM,"Marriott Philadelphia Downtown, Liberty Ballroom Salon A",American Economic Association,Demography and Development,J1,NA,NA,Matthias Doepke,Northwestern University,Erica Field,Princeton University,Lena Edlund,New York University,Tom Vogl,Princeton University,,,ROHINI PANDE,Female,,,,,,NA,NA,NA,NA,NA
Roine Vestman,Are Mutual Fund Managers Paid For Investment Skill?,Stockholm University,Jan. 5 2018,8:00 AM - 10:00 AM,"Loews Philadelphia, Commonwealth Hall C",American Finance Association,Compensation in Mutual Fund Management,G1,NA,NA,Harrison Hong,Columbia University,Mariassunta Giannetti,Stockholm School of Economics,Susan Christoffersen,University of Toronto,Eric Zitzewitz,Dartmouth College,,,Roine Vestman,Male,,,,,,NA,NA,NA,NA,NA
Roine Vestman,Identifying the Benefits from Home Ownership: A Swedish Experiment,Stockholm University,Jan. 7 2018,8:00 AM - 10:00 AM,"Loews Philadelphia, Washington C",American Real Estate and Urban Economics Association,Real Estate Finance,"G2, R3",NA,NA,Elliot Anenberg,Federal Reserve Board,Alberto Rossi,University of Maryland,Adriano Rampini,Duke University,John Mondragon,Northwestern University,,,Roine Vestman,Male,,,,,,NA,NA,NA,NA,NA
Roland Rathelot,Unemployment Insurance and Reservation Wages: Evidence From Administrative Data,University of Warwick,Jan. 5 2018,8:00 AM - 10:00 AM,"Pennsylvania Convention Center, 203-B",American Economic Association,Designing Unemployment Insurance,"J6, H2",NA,NA,Juan Francisco Jimeno,Bank of Spain,Jeffrey Smith,University of Michigan,Ioana Elena Marinescu,University of Chicago,Pauline Leung,Cornell University,,,Roland Rathelot,Male,,,,,,NA,NA,NA,NA,NA
Romain Ranciere,"Sovereign Bond Prices, Haircuts and Maturity",University of Southern California,Jan. 7 2018,10:15 AM - 12:15 PM,"Marriott Philadelphia Downtown, Meeting Room 309",American Economic Association,Sovereign Default,"F4, H3",NA,NA,Sandra Lizarazo,International Monetary Fund,Leonardo Martinez,International Monetary Fund,Tamon Asonuma,International Monetary Fund,Pablo D'Erasmo,Federal Reserve Bank of Philadelphia,,,ROMAIN RANCIERE,Male,,,,,,NA,NA,NA,NA,NA
Romain Ranciere,Why Do Reforms Occur in Crisis Times?,University of Southern California,Jan. 6 2018,8:00 AM - 10:00 AM,"Marriott Philadelphia Downtown, Grand Ballroom Salon D",Association for Comparative Economic Studies,Innovation and Structural Reforms,"E6, O3",NA,NA,Daniel Berkowitz,University of Pittsburgh,Iikka Korhonen,BOFIT Finland,Catherine L. Mann,OECD,,,,,ROMAIN RANCIERE,Male,,,,,,NA,NA,NA,NA,NA
Ron Siegel,Performance-Maximizing Contests,Pennsylvania State University,Jan. 7 2018,8:00 AM - 10:00 AM,"Marriott Philadelphia Downtown, Meeting Room 406",Econometric Society,Advances in Contest Theory,A1,NA,NA,Johannes Horner,Yale University,Philip J. Reny,University of Chicago,Sandro Brusco,State University of New York-Stony Brook,John Morgan,University of California-Berkeley,,,Ron Siegel,Male,,,,,,NA,NA,NA,NA,NA
Ronald Gilson,"Braiding: The Interaction of Formal and Informal Contracting in Theory, Practice, and Doctrine",Columbia University,Jan. 7 2018,10:15 AM - 12:15 PM,"Loews Philadelphia, PSFS",Society for Institutional and Organizational Economics,Contract Governance,"K2, L2",NA,NA,Avinash Dixit,Princeton University,Robert Gibbons,Massachusetts Institute of Technology,,,,,,,RONALD GILSON,Male,,,,,,NA,NA,NA,NA,NA
Ronan Lyons,"Measuring House Prices in the Long Run: Insights from Dublin, 1900-2015",Trinity College Dublin,Jan. 5 2018,8:00 AM - 10:00 AM,"Loews Philadelphia, Washington C",American Real Estate and Urban Economics Association,International House Pricing,"C2, R3",NA,NA,Thies Lindenthal,University of Cambridge,Rogier Holtermans,University of Southern California,Andrea Chegut,Massachusetts Institute of Technology,Marc Francke,University of Amsterdam,,,Ronan Lyons,Male,,,,,,NA,NA,NA,NA,NA
Rong Li,"Sticky Wages, Private Consumption and Fiscal Multipliers",Renmin University of China,Jan. 7 2018,10:15 AM - 12:15 PM,"Marriott Philadelphia Downtown, Meeting Room 413",Econometric Society,Monetary Policy,A1,NA,NA,,,,,,,,,,,Rong Li,Male,,,,,,NA,NA,NA,NA,NA
Roni Michaely,FinTechs and the Market for Financial Analysis,Cornell University,Jan. 5 2018,2:30 PM - 4:30 PM,"Loews Philadelphia, Commonwealth Hall A1",American Finance Association,FinTech,G0,NA,NA,Russell Jame,University of Kentucky,Zhi Da,University of Notre Dame,Daniel Andrei,University of California-Los Angeles,,,,,RONI MICHAELY,Male,,,,,,NA,NA,NA,NA,NA
Roni Michaely,What Do Insiders Know? Evidence From Insider Trading Around Share Repurchases and SEOs,Cornell University,Jan. 7 2018,10:15 AM - 12:15 PM,"Loews Philadelphia, Commonwealth Hall A2",American Finance Association,Raising Capital,G3,NA,NA,Paige Ouimet,University of North Carolina,Lauren Cohen,Harvard Business School,Philip Bond,University of Washington,Francois Derrien,HEC Paris,,,RONI MICHAELY,Male,,,,,,NA,NA,NA,NA,NA
Roni Michaely,Cultural Diversity on Wall Street: Evidence From Sell-side Analysts’ Forecasts,Cornell University,Jan. 6 2018,10:15 AM - 12:15 PM,"Loews Philadelphia, Commonwealth Hall A2",American Finance Association,"Sex, Race and Finance",G0,NA,NA,Paola Sapienza,Northwestern University,Mariassunta Giannetti,Stockholm School of Economics,Manju Puri,Duke University,Shulamit Kahn,Boston University,,,RONI MICHAELY,Male,,,,,,NA,NA,NA,NA,NA
Rosen Valchev,Economic Agents as Imperfect Problem Solvers,Boston College,Jan. 6 2018,10:15 AM - 12:15 PM,"Pennsylvania Convention Center, 111-A",Econometric Society,Imperfect Information and Learning,"E3, D8",NA,NA,,,,,,,,,,,Rosen Valchev,Male,,,,,,NA,NA,NA,NA,NA
Ross Levine,Law and Finance in China: The Role of Xinfang,University of California-Berkeley,Jan. 6 2018,2:30 PM - 4:30 PM,"Pennsylvania Convention Center, 107-A",American Economic Association,Institutions and Real Sector Activity,D0,NA,NA,,,,,,,,,,,ROSS LEVINE,Male,,,,,,NA,NA,NA,NA,NA
Rowena Gray,"Importing Crime? The Effect of Immigration on Crime in the United States, 1880-1930",University of California-Merced,Jan. 5 2018,2:30 PM - 4:30 PM,"Marriott Philadelphia Downtown, Meeting Room 403",Cliometric Society,The Economic History of Social Issues,"N3, J0",NA,NA,Werner Troesken,University of Pittsburgh,Brian Beach,William and Mary College,James Feigenbaum,Boston University,Sukanya Basu,Vassar College,,,Rowena Gray,Female,,,,,,NA,NA,NA,NA,NA
Ruben Enikolopov,"Social Image, Networks, and Protest Participation",Pompeu Fabra University,Jan. 7 2018,1:00 PM - 3:00 PM,"Pennsylvania Convention Center, 204-C",American Economic Association,Social Media and Political  Economy,"D7, L8",NA,NA,Ethan Kaplan,University of Maryland-College Park,Ruben Durante,Pompeu Fabra University,Gautam Rao,Harvard University,Noam Yuchtman,University of California-Berkeley,,,Ruben Enikolopov,Male,,,,,,NA,NA,NA,NA,NA
Rudolfs Bems,The Welfare Consequences of Income-Induced Expenditure Switching,University of Tokyo,Jan. 6 2018,8:00 AM - 10:00 AM,"Pennsylvania Convention Center, 105-A",American Economic Association,Demand Non-homotheticities over the Business Cycle,"E3, F3",NA,NA,Jing Zhang,Federal Reserve Bank of Chicago,Alberto Cavallo,Massachusetts Institute of Technology,Jessie Handbury,University of Pennsylvania,Colin Hottman,Federal Reserve Board,,,Rudolfs Bems,Male,,,,,,NA,NA,NA,NA,NA
Rudolfs Bems,Input Linkages and International Monetary Spillovers,University of Tokyo,Jan. 6 2018,10:15 AM - 12:15 PM,"Pennsylvania Convention Center, 104-B",American Economic Association,Transmission of Shocks Across Countries,"F4, E3",NA,NA,Yuriy Gorodnichenko,University of California-Berkeley,Ryan Monarch,Federal Reserve Board,Wataru Miyamoto,Bank of Canada,Kei-Mu Yi,University of Houston,,,Rudolfs Bems,Male,,,,,,NA,NA,NA,NA,NA
Ruediger Bachmann,Firms’ Uncertainty and Ambiguity,University of Notre Dame,Jan. 6 2018,12:30 PM - 2:15 PM,"Loews Philadelphia, Washington C",Society for Economic Dynamics,New Approaches in Measuring Uncertainty,"D2, G1",NA,NA,,,,,,,,,,,RUEDIGER BACHMANN,Male,,,,,,NA,NA,NA,NA,NA
Rui C. Silva,The Economic Impact of Religion: Evidence From Ramadan Loans,London Business School,Jan. 5 2018,10:15 AM - 12:15 PM,"Loews Philadelphia, Commonwealth Hall B",American Finance Association,Frontiers of Corporate Governance,G3,NA,NA,Mara Faccio,Purdue University,Claire Celerier,University of Toronto,Manju Puri,Duke University,,,,,Rui C. Silva,Male,,,,,,NA,NA,NA,NA,NA
Rui C. Silva,"Bankruptcy, Team-specific Human Capital, and Innovation: Evidence From United States Inventors",London Business School,Jan. 6 2018,8:00 AM - 10:00 AM,"Loews Philadelphia, Regency Ballroom C2",American Finance Association,Innovation Investment: Human Capital and Stressful Situations,G3,NA,NA,Tania Babina,Columbia University,Lauren Cohen,Harvard Business School,Benjamin Iverson,Brigham Young University,Arpit Gupta,New York University,,,Rui C. Silva,Male,,,,,,NA,NA,NA,NA,NA
Russell Cooper,The Collateral Composition Channel,Pennsylvania State University,Jan. 5 2018,8:00 AM - 10:00 AM,"Pennsylvania Convention Center, 105-A",American Economic Association,Credit Allocation,G2,NA,NA,,,,,,,,,,,RUSSELL COOPER,Male,,,,,,NA,NA,NA,NA,NA
Ryan Decker,Local Economic Shocks and Entrepreneurship: New Business Formation During the Shale Oil and Gas Boom,Federal Reserve Board,Jan. 5 2018,10:15 AM - 12:15 PM,"Pennsylvania Convention Center, 204-B",Association of Environmental and Resource Economists,Local Implications of Shale Gas,Q4,NA,NA,Martin Stuermer,Federal Reserve Bank of Dallas,Nida Cakir Melek,Federal Reserve Bank of Kansas City,Anil Kumar,Federal Reserve Bank of Dallas,Soren Anderson,Michigan State University,,,Ryan Decker,Male,,,,,,NA,NA,NA,NA,NA
Ryan Decker,Using ADP Payroll Microdata to Measure Aggregate Labor Market Activity,Federal Reserve Board,Jan. 6 2018,8:00 AM - 10:00 AM,"Pennsylvania Convention Center, 201-B",American Economic Association,What Can We Learn from Private Sector Data About the Labor Market?,"J0, J2",NA,NA,,,,,,,,,,,Ryan Decker,Male,,,,,,NA,NA,NA,NA,NA
Ryan Kellogg,Information Asymmetry and Second-best Contracts in the Oil and Gas Industry,University of Chicago,Jan. 5 2018,12:30 PM - 2:15 PM,"Pennsylvania Convention Center, 203-A",Industrial Organization Society,Empirical Studies of Contracting: The Case of United States Oil and Gas Leases,"L1, L7",NA,NA,Matt Gentry,London School of Economics,Kenneth Hendricks,University of Wisconsin-Madison,Daniel A. Ackerberg,University of Texas-Austin,Kosuke Uetake,Yale University,,,RYAN KELLOGG,Male,,,,,,NA,NA,NA,NA,NA
Ryan Kellogg,"Crude by Rail, Option Value, and Pipeline Investment",University of Chicago,Jan. 5 2018,2:30 PM - 4:30 PM,"Pennsylvania Convention Center, 109-A",American Economic Association,Economic Implications of Oil Price Differentials and Volatility: Analyses of Recent Shale Induced Price Shocks,"Q4, L9",NA,NA,Akshaya Jha,Carnegie Mellon University,Charles F. Mason,University of Wyoming,Joseph S. Shapiro,Yale University,Arthur van Benthem,University of Pennsylvania,Severin Borenstein,University of California-Berkeley,RYAN KELLOGG,Male,,,,,,NA,NA,NA,NA,NA
Ryan Monarch,Estimating Unequal Gains Across United States Consumers With Supplier Trade Data,Federal Reserve Board,Jan. 7 2018,8:00 AM - 10:00 AM,"Pennsylvania Convention Center, 111-A",American Economic Association,Topics in International Trade,F4,NA,NA,,,,,,,,,,,Ryan Monarch,Male,,,,,,NA,NA,NA,NA,NA
