author,paper_title,author_affiliation,date,time,location,association,session_title,session_jel_code,session_chair,session_chair_affiliation,discussant_1,discussant_1_affiliation,discussant_2,discussant_2_affiliation,discussant_3,discussant_3_affiliation,discussant_4,discussant_4_affiliation,discussant_5,discussant_5_affiliation,author.y,gender,alternative_1,alternative_2,alternative_3,alternative_4,alternative_5,X,X.1,X.2,X.3,X.4
Joshua Aizenman,"China's Growth, Stability, and the Use of International Reserves",University of Southern California and NBER,Jan 03 2014,2:30 PM,"Pennsylvania Convention Center, 109-B",Chinese Economists Society,The Sustainability of the Chinese Growth Model,O4,Tony Fang,Monash University,Jarko Fidrmuc,Zeppelin University Friedrichshagen,Iikka Korhonen,Bank of Finland,Alessandro Rebucci,Inter-American Development Bank,Zheng Michael Song,University of Chicago,Jaejoon Woo,International Monetary Fund,JOSHUA AIZENMAN,Male,,,,,,NA,NA,NA,NA,NA
Joshua Goodman,Intensive Math Instruction and Educational Attainment: Long-Run Impacts of Double Dose Algebra,Harvard University,Jan 04 2014,10:15 AM,"Pennsylvania Convention Center, 112-B",American Economic Association,Policy Interventions and Educational Outcomes,J6,Rodney Andrews,University of Texas-Dallas,Juan Carlos Suárez Serrato,Stanford University,Monica Deza,University of Texas-Dallas,Damon Jones,University of Chicago,Omari Swinton,Howard University,,,Joshua Goodman,Male,,,,,,NA,NA,NA,NA,NA
Joshua Goodman,"Merit Aid, College Quality and College Completion: Massachusetts' Adams Scholarship as an In-Kind Subsidy",Harvard University,Jan 04 2014,2:30 PM,"Philadelphia Marriott, Grand Ballroom - Salons I & J",American Economic Association,Issues in Higher Education,I2,Susan Dynarski,University of Michigan,Sarah Turner,University of Virginia,Michael F. Lovenheim,Cornell University,,,,,,,Joshua Goodman,Male,,,,,,NA,NA,NA,NA,NA
Joshua Graff Zivin,Pigouvian Taxes with Intermittent Billing and Habits,University of California-San Diego,Jan 05 2014,10:15 AM,"Philadelphia Marriott, Grand Ballroom - Salon L",Association of Environmental & Resource Economists,Habit Formation and Voluntary Approaches to Environmental Policy,Q5,John List,University of Chicago,Hunt Allcott,New York University,George Deltas,University of Illinois,Anna Alberini,University of Maryland,Jill J. McCluskey,Washington State University,,,JOSHUA GRAFF ZIVIN,Male,,,,,,NA,NA,NA,NA,NA
Joshua Graff Zivin,Economic Spillovers from Publicly-Funded Biomedical Research,University of California-San Diego,Jan 05 2014,1:00 PM,"Pennsylvania Convention Center, 204-C",American Economic Association,"Patents, Innovation and Growth",O3,Mark Schankerman,London School of Economics,Heidi L. Williams,Massachusetts Institute of Technology,Samuel Kortum,Yale University,John Van Reenen,London School of Economics,Benjamin Jones,Northwestern University,,,JOSHUA GRAFF ZIVIN,Male,,,,,,NA,NA,NA,NA,NA
Joshua Lerner,The Impact of Global Angel Financing,Harvard University and NBER,Jan 03 2014,10:15 AM,"Pennsylvania Convention Center, 103-A",American Economic Association,"Entrepreneurship, Innovation, and Management",L2,Nicholas Bloom,Stanford University and NBER,,,,,,,,,,,JOSHUA LERNER,Male,,,,,,NA,NA,NA,NA,NA
Joshua Lerner,The Disintermediation of Financial Markets: Direct Investing in Private Equity,Harvard Business School,Jan 04 2014,10:15 AM,"Loews Philadelphia Hotel, Regency Ballroom A",American Finance Association,Private Equity,G2,David Robinson,Duke University,Laura Lindsey,Arizona State University,Morten Sorensen,Columbia University,Tim Jenkinson,Oxford University,Yael V. Hochberg,Northwestern University,,,JOSHUA LERNER,Male,,,,,,NA,NA,NA,NA,NA
Joshua Lerner,The Use and Misuse of Patent Data,Harvard Business School,Jan 03 2014,2:30 PM,"Pennsylvania Convention Center, 204-B",American Economic Association,Intellectual Property Rights and Innovation,O3,Heidi Williams,Massachusetts Institute of Technology,,,,,,,,,,,JOSHUA LERNER,Male,,,,,,NA,NA,NA,NA,NA
Joshua Linn,The Costs and Consequences of Clean Air Act Regulation of CO2 from Power Plants,Resources for the Future,Jan 04 2014,10:15 AM,"Philadelphia Marriott, Grand Ballroom - Salon E",American Economic Association,Climate Change Policy after Kyoto,Q5,Nicholas Stern,London School of Economics,Gilbert Metcalf,Tufts University,,,,,,,,,JOSHUA LINN,Male,,,,,,NA,NA,NA,NA,NA
Joshua S. Gans,Exit versus Voice in Driving Open Access,University of Toronto,Jan 04 2014,8:00 AM,"Pennsylvania Convention Center, 109-B",American Economic Association,Academic and Market Power in Scholarly Publishing,O3,Erik Brynjolfsson,Massachusetts Institute of Technology,Ted Bergstrom,University of California-Santa Barbara,Stefano DellaVigna,University of California- Berkeley,Scott Stern,Massachusetts Institute of Technology,David Card,University of California-Berkeley,,,Joshua S. Gans,Male,,,,,,NA,NA,NA,NA,NA
Juan Carlos Conesa,Is it Too Late to Bail Out the Troubled Countries in the Eurozone?,State University of New York-Stonybrook University,Jan 05 2014,8:00 AM,"Philadelphia Marriott, Grand Ballroom - Salon E",American Economic Association,Sovereign Debt Crisis,F4,Gita Gopinath,Harvard University,Vincenzo Quadrini,University of Southern California,Javier Bianchi,University of Wisconsin,Andrew Atkeson,University of California-Los Angeles,,,,,JUAN CARLOS CONESA,Male,,,,,,NA,NA,NA,NA,NA
Juan Carlos Hatchondo,Fiscal Rules and the Sovereign Default Premium,Indiana University,Jan 04 2014,10:15 AM,"Philadelphia Marriott, Meeting Room 402",Econometric Society,"Fiscal Policy, Financial Policy & Default",F3,Guido Lorenzoni,Northwestern University,Satyajit Chatterjee,Federal Reserve Bank of Philadelphia,Leonardo Martinez,International Monetary Fund,Emine Boz,International Monetary Fund,,,,,Juan Carlos Hatchondo,Male,Juan C. Hatchondo,Juan. Hatchondo,,,,NA,NA,NA,NA,NA
Juan Pantano,The Demographic Consequences of Gender Selection Technology,Washington University in St. Louis,Jan 03 2014,8:00 AM,"Philadelphia Marriott, Grand Ballroom - Salon I",American Economic Association,Fertility Decisions,J1,Tom Vogl,Princeton University,,,,,,,,,,,Juan Pantano,Male,,,,,,NA,NA,NA,NA,NA
Juan Pantano,Parental Reputation,Washington University in St. Louis,Jan 03 2014,2:30 PM,"Philadelphia Marriott, Meeting Room 403",Econometric Society,Estimation of Education Models,J1,Christopher Taber,University of Wisconsin-Madison,,,,,,,,,,,Juan Pantano,Male,,,,,,NA,NA,NA,NA,NA
Juan Pantano,"Social Security Benefits, Life Expectancy and Early Retirement",Washington University-St. Louis,Jan 05 2014,10:15 AM,"Philadelphia Marriott, Meeting Room 403",Econometric Society,Life-Cycle Decision-Making with Intergenerational Interactions and Health/Life Expectations,I1,Donna Gilleskie,University of North Carolina,David Blau,Ohio State University,Clement Joubert,University of North Carolina,Dan Silverman,Arizona State University,,,,,Juan Pantano,Male,,,,,,NA,NA,NA,NA,NA
Juan Pantano,Treatment Choice Dynamics with Insurance Mandates: The Case of IVF,Washington University-St. Louis,Jan 03 2014,10:15 AM,"Philadelphia Marriott, Meeting Room 402",Econometric Society,Dynamics of Medical Treatment and Decision-Making,I1,Donna Gilleskie,University of North Carolina,Steve Stern,University of Virginia,Hanming Fang,University of Pennsylvania,Sokbae (Simon) Lee,University College London,,,,,Juan Pantano,Male,,,,,,NA,NA,NA,NA,NA
Juan Vargas,Inside the War on Drugs: Effectiveness and Unintended Consequences of a Large Illicit Crop Eradication Program In Colombia,Universidad del Rosario,Jan 04 2014,8:00 AM,"Pennsylvania Convention Center, 108-B",American Economic Association,Crime & Corruption,K4,Dale Cloninger,University of Houston-Clear Lake,,,,,,,,,,,Juan Vargas,Male,,,,,,NA,NA,NA,NA,NA
Julian Reif,The Insurance Value of Medical Innovation,University of Illinois-Urbana-Champaign,Jan 05 2014,8:00 AM,"Pennsylvania Convention Center, 204-A",American Economic Association,Medical Innovation,I1,Nolan Miller,University of Illinois-Urbana-Champaign,Craig Garthwaite,Northwestern University,Heidi L. Williams,Massachusetts Institute of Technology,Leemore Dafny,Northwestern University,Amanda E. Kowalski,Yale University,,,Julian Reif,Male,,,,,,NA,NA,NA,NA,NA
Julian Schumacher,Sovereign Defaults in Court,Free University and Hertie School of Governance,Jan 04 2014,2:30 PM,"Pennsylvania Convention Center, 204-B",American Economic Association,New Challenges in Sovereign Debt Restructuring,F4,Patrick Bolton,Columbia University,Laura Alfaro,Harvard University,Fernando Broner,CREI and Universitat Pompeu Fabra,Anil Kashyap,University of Chicago,Michael Bordo,Rutgers University,,,Julian Schumacher,Male,,,,,,NA,NA,NA,NA,NA
Juliana Salomao,Trend and Cycle in Bond Premia,Stanford University,Jan 05 2014,10:15 AM,"Pennsylvania Convention Center, 202-A",American Economic Association,Topics in Treasury Markets,G1,Monika Piazzesi,Stanford University,Pierluigi Balduzzi,Boston College,Tobias Adrian,Federal Reserve Bank of New York,Torben Andersen,Northwestern University,Gregory Duffee,Johns Hopkins University,,,Juliana Salomao,Female,,,,,,NA,NA,NA,NA,NA
Julien Matheron,Precautionary Saving and Aggregate Demand,Banque de France,Jan 05 2014,1:00 PM,"Pennsylvania Convention Center, 105-B",American Economic Association,Households and Allocation Decisions,E2,Wenli Li,Federal Reserve Bank of Philadelphia,,,,,,,,,,,Julien Matheron,Male,,,,,,NA,NA,NA,NA,NA
Justin Marion,Do the Laws of Tax Incidence Hold? Point of Collection and the Pass-Through of State Diesel Taxes,University of California-Santa Cruz,Jan 04 2014,10:15 AM,"Pennsylvania Convention Center, 203-A",American Economic Association,Raising Revenue: The Economics of Tax Evasion and Enforcement,H2,Joel Slemrod,University of Michigan,David Merriman,University of Illinois-Chicago,James Alm,Tulane University,Austan Goolsbee,University of Chicago,Nathaniel Hendren,NBER and Harvard University,,,JUSTIN MARION,Male,,,,,,NA,NA,NA,NA,NA
Justin R. Sydnor,Bid Takers or Market Makers? The Effect of Auctioneers on Auction Outcomes,University of Wisconsin - Madison,Jan 05 2014,10:15 AM,"Pennsylvania Convention Center, 204-B",American Economic Association,Understanding the Auction Process: New Theories and Empirical Evidence,L2,Ulrike Malmendier,University of California-Berkeley,David Reiley,Google Inc,Jennifer Brown,Northwestern University,Mallesh Pai,University of Pennsylvania,Steven Tadelis,University of California-Berkeley and eBay Research Labs,,,Justin R. Sydnor,Male,Justin Sydnor,,,,,NA,NA,NA,NA,NA
Kai Li,Creditor Governance with Loan-to-Loan and Loan-to-Own,University of British Columbia,Jan 04 2014,2:30 PM,"Loews Philadelphia Hotel, Commonwealth Hall D",American Finance Association,Financial Distress and Corporate Bankruptcy,G3,Vikrant Vig,London Business School,Ben Iverson,Harvard Business School,Rainer Haselmann,University of Bonn,Nicolas Serrano-Velarde,University of Oxford,Jacopo Ponticelli,Universitat Pompeu Fabra,,,Kai Li,Male,,,,,,NA,NA,NA,NA,NA
Kai Li,Large Shareholders and CEO Performance-Based Pay: New Evidence from Privately-Held Firms,University of British Columbia,Jan 04 2014,10:15 AM,"Loews Philadelphia Hotel, Commonwealth Hall B",American Finance Association,Managerial Incentives I,G3,Gustavo Manso,University of California-Berkeley,Jay Hartzell,University of Texas-Austin,Dmitry Livdan,University of California-Berkeley,David Sraer,Princeton University,,,,,Kai Li,Male,,,,,,NA,NA,NA,NA,NA
Kai-Uwe Kuhn,Financial Constraints and Moral Hazard: The Case of Franchising,University of Michigan,Jan 04 2014,10:15 AM,"Pennsylvania Convention Center, 106-A",Industrial Organization Society,Empirical Studies of Contracts,D8,Bernard Salanie,Columbia University,Pierre Dubois,Toulouse School of Economics,Julie Mortimer,Boston College,Steven Tadelis,University of California-Berkeley,Jaap Abbring,Tilburg University,,,KAI-UWE KUHN,Male,,,,,,NA,NA,NA,NA,NA
Kaiji Chen,The Role of Allocative Efficiency in a Decade of Recovery,Emory University,Jan 03 2014,8:00 AM,"Philadelphia Marriott, Meeting Room 404",Econometric Society,Long Run Changes in Labor Market Outcomes,J1,Sephorah Mangin,Monash University,,,,,,,,,,,Kaiji Chen,Male,,,,,,NA,NA,NA,NA,NA
Kamila Sommer,Implications of United States Tax Policy for House Prices and Rents,Federal Reserve Board,Jan 03 2014,10:15 AM,"Loews Philadelphia Hotel, Washington C",American Real Estate & Urban Economic Association,"Regulations, Policies, and Housing Dynamics",E3,John Duca,Federal Reserve Bank of Dallas,Daniel K. Fetter,Wellesley College,John Krainer,Federal Reserve Bank of San Francisco,Roland Fuess,University of St. Gallen,Don Schlagenhauf,Florida State University,,,Kamila Sommer,Female,,,,,,NA,NA,NA,NA,NA
Karen Dynan,Household Debt and the Weak Recovery of Consumption: Evidence from the Panel Study of Income Dynamics,Brookings Institution,Jan 03 2014,2:30 PM,"Pennsylvania Convention Center, 202-A",American Economic Association,New Directions and Opportunities for Research on Consumption with the PSID,A1,David Johnson,US Census Bureau,Richard Blundell,University College London,,,,,,,,,Karen Dynan,Female,,,,,,NA,NA,NA,NA,NA
Karen Helene Ulltveit-Moe,"Technological Change, International Sourcing and the Joint Impact on Productivity",University of Oslo,Jan 05 2014,10:15 AM,"Pennsylvania Convention Center, 105-B",American Economic Association,Aggregate Models in International Economics,F4,Jonathan Heathcote,Federal Reserve Bank of Minneapolis,,,,,,,,,,,Karen Helene Ulltveit-Moe,Female,,,,,,NA,NA,NA,NA,NA
Karen Palmer,The Costs and Consequences of Clean Air Act Regulation of CO2 from Power Plants,Resources for the Future,Jan 04 2014,10:15 AM,"Philadelphia Marriott, Grand Ballroom - Salon E",American Economic Association,Climate Change Policy after Kyoto,Q5,Nicholas Stern,London School of Economics,Gilbert Metcalf,Tufts University,,,,,,,,,KAREN PALMER,Female,,,,,,NA,NA,NA,NA,NA
Karen Thome,Evaluating Local General Equilibrium Impacts of Zambia's Child Grant Program,University of California-Davis,Jan 03 2014,8:00 AM,"Pennsylvania Convention Center, 106-B",Society of Government Economists,Externalities and the Power of Perceptions for Cash Transfer Programs,D1,David Seidenfeld,American Institutes for Research,,,,,,,,,,,Karen Thome,Female,,,,,,NA,NA,NA,NA,NA
Karl Walentin,Business Cycle Implications of Mortgage Spreads,Sveriges Riksbank,Jan 05 2014,10:15 AM,"Philadelphia Marriott, Grand Ballroom - Salon K",American Economic Association,Credit and Collateral,G2,Aubhik Khan,Ohio State University,,,,,,,,,,,KARL WALENTIN,Male,,,,,,NA,NA,NA,NA,NA
Karthik Muralidharan,Double for Nothing? The Effects of Unconditional Teacher Salary Increases on Performance,University of California-San Diego,Jan 03 2014,12:30 PM,"Pennsylvania Convention Center, 106-B",Society of Government Economists,Education Policy in Developing Countries,I2,Quentin Wodon,World Bank,,,,,,,,,,,KARTHIK MURALIDHARAN,Male,,,,,,NA,NA,NA,NA,NA
Kasper Roszbach,Finance and Growth: Time Series Evidence on Causality,Sveriges Riksbank and University of Groningen,Jan 03 2014,8:00 AM,"Loews Philadelphia Hotel, Commonwealth Hall A2","International Banking, Economics & Finance Association",Finance and Development/ International Finance,G2,Gillian Garcia,Gillian Garcia Associates,Matt Osborne,University of Toronto,Jihad Dagher,International Monetary Fund,Gibran Rezavi,University of Illinois-Chicago,Andrei Zlate,Federal Reserve Board,,,Kasper Roszbach,Male,,,,,,NA,NA,NA,NA,NA
Kate Ho,"Hospital Choices, Hospital Prices, and Financial Incentives to Physicians",Columbia University,Jan 05 2014,1:00 PM,"Pennsylvania Convention Center, 203-A",American Economic Association,Structural Estimation,D0,Petra Todd,University of Pennsylvania,,,,,,,,,,,Kate Ho,Female,,,,,,NA,NA,NA,NA,NA
Katherine Baicker,The Effects of Expanding Medicaid on Health Care Use and Clinical Outcomes: Evidence from the Oregon Health Insurance Experiment,Harvard University,Jan 03 2014,10:15 AM,"Philadelphia Marriott, Meeting Room 305",International Health Economics Association,Health Insurance Markets and Coverage,I1,Laurence Baker,Stanford University,,,,,,,,,,,KATHERINE BAICKER,Female,,,,,,NA,NA,NA,NA,NA
Katherine Baicker,The Use of Analysis Plans in the Oregon Health Insurance Experiment,Harvard University,Jan 05 2014,8:00 AM,"Pennsylvania Convention Center, 204-B",American Economic Association,Research Transparency: Pre-Analysis Plans and Other Approaches for Economics,C9,Edward Miguel,University of California-Berkeley,Uri Simonsohn,"University of Pennsylvania, Wharton School of Business",,,,,,,,,KATHERINE BAICKER,Female,,,,,,NA,NA,NA,NA,NA
Katherine Baicker,The Impact of Medicaid on Labor Force Activity and Program Participation: Evidence from the Oregon Health Insurance Experiment,Harvard University,Jan 04 2014,8:00 AM,"Pennsylvania Convention Center, 201-C",American Economic Association,The Impact of Health Insurance Expansions on Other Social Safety Net Programs,H5,Amy Finkelstein,Massachusetts Institute of Technology,David H. Autor,Massachusetts Institute of Technology,,,,,,,,,KATHERINE BAICKER,Female,,,,,,NA,NA,NA,NA,NA
Katherine Casey,Reshaping Institutions: Evidence on Aid Impacts Using a Preanalysis Plan,Stanford University,Jan 05 2014,8:00 AM,"Pennsylvania Convention Center, 204-B",American Economic Association,Research Transparency: Pre-Analysis Plans and Other Approaches for Economics,C9,Edward Miguel,University of California-Berkeley,Uri Simonsohn,"University of Pennsylvania, Wharton School of Business",,,,,,,,,Katherine Casey,Female,,,,,,NA,NA,NA,NA,NA
Katherine Eriksson,A Nation of Immigrants: Assimilation and Economic Outcomes in the Age of Mass Migration,University of California-Los Angeles,Jan 03 2014,10:15 AM,"Pennsylvania Convention Center, 201-A",American Economic Association,Looking Back at the United States during the Late Nineteenth Century: Lessons from the American Economy during the Time of the Great Migration Era,J6,Ethan Lewis,Dartmouth College,Richard Hornbeck,Harvard University,Darren Lubotsky,University of Illinois-Urbana-Champaign,David H. Autor,Massachusetts Institute of Technology,Elizabeth U. Cascio,Dartmouth College,,,Katherine Eriksson,Female,,,,,,NA,NA,NA,NA,NA
Katherine H. Meckel,The Impact of the Fracking Boom on Infant Health: Evidence from Detailed Location Data on Wells and Infants,Columbia University,Jan 04 2014,2:30 PM,"Pennsylvania Convention Center, 204-A",American Economic Association,Investigating the Determinants of Infant Mortality,I1,Emily Oster,University of Chicago,,,,,,,,,,,Katherine H. Meckel,Female,,,,,,NA,NA,NA,NA,NA
Katherine H. Meckel,"The EITC, Birth Intervals, and Completed Fertility",Columbia University,Jan 05 2014,8:00 AM,"Pennsylvania Convention Center, 202-A",American Economic Association,Children,J1,Anna Aizer,Brown University,,,,,,,,,,,Katherine H. Meckel,Female,,,,,,NA,NA,NA,NA,NA
Kathryn Shaw,Compensation Matters: Incentives for Multitasking in Law Firms,Stanford University,Jan 04 2014,8:00 AM,"Pennsylvania Convention Center, 106-A",Industrial Organization Society,The Organization of Organizations,L2,Peter Cappelli,University of Pennsylvania,Alan Benson,University of Minnesota,Jennifer Brown,Northwestern University,Orie Shelef,Stanford University,Christopher Stanton,University of Utah,,,KATHRYN SHAW,Female,,,,,,NA,NA,NA,NA,NA
Katrine Loken,"Smoking Bans, Maternal Smoking and Birth Outcomes",University of Bergen,Jan 04 2014,2:30 PM,"Pennsylvania Convention Center, 204-A",American Economic Association,Investigating the Determinants of Infant Mortality,I1,Emily Oster,University of Chicago,,,,,,,,,,,Katrine Loken,Female,,,,,,NA,NA,NA,NA,NA
Keith Head,Welfare and Trade Without Pareto,University of British Columbia and CEPR,Jan 03 2014,10:15 AM,"Pennsylvania Convention Center, 103-B",American Economic Association,Gains from Trade When Firms Matter,F1,Pol Antras,Harvard University,Swati Dhingra,London School of Economics,Lorenzo Caliendo,Yale University,Jonathan Eaton,Pennsylvania State University,Gordon H. Hanson,University of California-San Diego,,,KEITH HEAD,Male,,,,,,NA,NA,NA,NA,NA
Keith Marzilli Ericson,How Product Standardization Affects Choice: Evidence from the Massachusetts Health Insurance Exchange,Boston University,Jan 04 2014,10:15 AM,"Pennsylvania Convention Center, 204-C",American Economic Association,Behavioral Economics and Public Policy,H3,Hunt Allcott,New York University,John Beshears,Harvard University,Stefano DellaVigna,University of California-Berkeley,Joshua Schwartzstein,Dartmouth College,Stephan Meier,Columbia University,,,Keith Marzilli Ericson,Male,Keith Ericson,,,,,NA,NA,NA,NA,NA
Kelly Shue,No News is News: Do Markets Underreact to Nothing,University of Chicago,Jan 03 2014,8:00 AM,"Loews Philadelphia Hotel, Regency Ballroom B",American Finance Association,Behavioral Asset Pricing,G1,Nicholas Barberis,Yale University,Dong Lou,London School of Economics,Byoung-Hyoun Hwang,Purdue University,Kent Daniel,Columbia University,,,,,Kelly Shue,Female,,,,,,NA,NA,NA,NA,NA
Kelly Shue,Swinging for the Fences: Executive Reactions to Quasi-Random Option Grants,University of Chicago,Jan 05 2014,10:15 AM,"Loews Philadelphia Hotel, Commonwealth Hall C",American Finance Association,Managerial Incentives II,G3,Bilge Yilmaz,University of Pennsylvania,Mark Jenkins,University of Pennsylvania,Nadya Malenko,Boston College,Robert Marquez,University of California-Davis,,,,,Kelly Shue,Female,,,,,,NA,NA,NA,NA,NA
Kenneth Gillingham,Do Fuel Economy Standards Reduce Automobile Safety? Examining Automaker Choices in the Distribution of Vehicle Attributes,Yale University,Jan 04 2014,2:30 PM,"Pennsylvania Convention Center, 103-A",American Economic Association,"Firm Behavior, Standards, and the Provision of Energy Efficiency",Q4,Robert Stavins,Harvard University,Carolyn Fischer,Resources for the Future,Ashley Langer,University of Michigan,Mar Reguant,Stanford University,Erich Muehlegger,Harvard University,,,Kenneth Gillingham,Male,,,,,,NA,NA,NA,NA,NA
Kenneth Gillingham,Uncertainty Analysis in Integrated Assessment Models,Yale University,Jan 05 2014,8:00 AM,"Philadelphia Marriott, Grand Ballroom - Salon C",American Economic Association,Using Integrated Assessment Models to Inform Decision-Making in the Face of Uncertain Climate Change,Q5,David Anthoff,University of Michigan,Kenneth Gillingham,Yale University,Derek Lemoine,University of Arizona,Charles Kolstad,Stanford University,Maximilian Auffhammer,University of California-Berkeley,,,Kenneth Gillingham,Male,,,,,,NA,NA,NA,NA,NA
Kent Daniel,Momentum Crashes,Columbia University,Jan 05 2014,8:00 AM,"Loews Philadelphia Hotel, Commonwealth Hall C",American Finance Association,Winning and Losing in Asset Allocation,G1,Burton Hollifield,Carnegie Mellon University,Berk A. Sensoy,Ohio State University,Marcin Kacperczyk,New York University,Spencer Martin,University of Melbourne,Bryan Routledge,Carnegie Mellon University,,,KENT DANIEL,Male,,,,,,NA,NA,NA,NA,NA
Kevin Donovan,Factors Affecting College Completion and Student Ability in the United States since 1900,Arizona State University,Jan 03 2014,8:00 AM,"Philadelphia Marriott, Meeting Room 404",Econometric Society,Long Run Changes in Labor Market Outcomes,J1,Sephorah Mangin,Monash University,,,,,,,,,,,Kevin Donovan,Male,,,,,,NA,NA,NA,NA,NA
Kevin J. Murphy,Reel Authority: Relational Renegotiation in the Movie Industry,University of Southern California,Jan 04 2014,10:15 AM,"Pennsylvania Convention Center, 106-A",Industrial Organization Society,Empirical Studies of Contracts,D8,Bernard Salanie,Columbia University,Pierre Dubois,Toulouse School of Economics,Julie Mortimer,Boston College,Steven Tadelis,University of California-Berkeley,Jaap Abbring,Tilburg University,,,KEVIN J. MURPHY,Male,KEVIN MURPHY,,,,,NA,NA,NA,NA,NA
Kevin Lang,The Black-White Education-Scaled Test-Score Gap in Grades K-7,Boston University,Jan 04 2014,8:00 AM,"Pennsylvania Convention Center, 107-B",American Economic Association,Racial Disparities,J1,Kevin Lang,Boston University,Lisa B Kahn,Yale University,Johannes Schmieder,Boston University,Patrick Bayer,Duke University,Flavio Cunha,University of Pennsylvania,,,KEVIN LANG,Male,,,,,,NA,NA,NA,NA,NA
Kevin Roth,Do Fuel Economy Standards Reduce Automobile Safety? Examining Automaker Choices in the Distribution of Vehicle Attributes,Cornell University,Jan 04 2014,2:30 PM,"Pennsylvania Convention Center, 103-A",American Economic Association,"Firm Behavior, Standards, and the Provision of Energy Efficiency",Q4,Robert Stavins,Harvard University,Carolyn Fischer,Resources for the Future,Ashley Langer,University of Michigan,Mar Reguant,Stanford University,Erich Muehlegger,Harvard University,,,Kevin Roth,Male,,,,,,NA,NA,NA,NA,NA
Kevin Roth,The Unintended Consequences of Uncoordinated Regulation: Evidence from the Transportation Sector,University of California-Irvine,Jan 03 2014,10:15 AM,"Philadelphia Marriott, Grand Ballroom - Salon K",Association of Environmental & Resource Economists,"Automobiles, Fuel Markets and Energy Efficiency",Q4,Antonio Bento,Cornell University,Shanjun Li,Cornell University,Ashley Langer,University of Arizona,Steve Cicala,University of Chicago,Kenneth Gillingham,Yale University,,,Kevin Roth,Male,,,,,,NA,NA,NA,NA,NA
Kiichi Tokuoka,The Distribution of Wealth and the MPC: Implications of New European Data,International Monetary Fund,Jan 05 2014,1:00 PM,"Pennsylvania Convention Center, 201-C",American Economic Association,Perspectives on Consumption,E2,Alisdair McKay,Boston University,Sam Schulhofer-Wohl,Federal Reserve Bank of Minneapolis,Toshihiko Mukoyama,University of Virginia,Dirk Krueger,University of Pennsylvania,Jeffrey R. Campbell,Federal Reserve Bank of Chicago,,,KIICHI TOKUOKA,Male,,,,,,NA,NA,NA,NA,NA
