paper_title,author
Algorithmic Fairness,Jon Kleinberg
Welfarism's Envy Problem Extends to Popular Judgments,Matthew Weinzierl
Quadratic Voting: How Mechanism Design Can Radicalize Democracy,Steven P. Lalley
"Should We Treat Data as Labor? Moving beyond ""Free""",Imanol Arrieta-Ibarra
"What Can Machines Learn, and What Does It Mean for Occupations and the Economy?",Erik Brynjolfsson
Modeling Automation,Daron Acemoglu
A Method to Link Advances in Artificial Intelligence to Occupational Abilities,Edward W. Felten
Human Judgment and AI Pricing,Ajay Agrawal
Estimating Heterogeneous Consumer Preferences for Restaurants and Travel Time Using Mobile Location Data,Susan Athey
The Potential of Digital Credit to Bank the Poor,Daniel Björkegren
Estimating Economic Characteristics with Phone Data,Joshua E. Blumenstock
Nowcasting Gentrification: Using Yelp Data to Quantify Neighborhood Change,Edward L. Glaeser
Misperceptions about Tax Audits,Marcelo Bérgolo
Ramsey Strikes Back: Optimal Commodity Tax and Redistribution in the Presence of Salience Effects,Hunt Allcott
Can Information Change Personal Retirement Savings? Evidence from Social Security Benefits Statement Mailings,Susan Payne Carter
Rationalizations and Mistakes: Optimal Policy with Normative Ambiguity,Jacob Goldin
The Elephant Curve of Global Inequality and Growth,Facundo Alvaredo
From Communism to Capitalism: Private versus Public Property and Inequality in China and Russia,Filip Novokmet
Applying Generalized Pareto Curves to Inequality Analysis,Thomas Blanchet
"Extreme Inequality: Evidence from Brazil, India, the Middle East, and South Africa",Lydia Assouad
Challenges in the Measurement of Leakage Risk,Meredith Fowlie
How Trade Sensitive Are Energy-Intensive Sectors?,Carolyn Fischer
Regulating Mismeasured Pollution: Implications of Firm Heterogeneity for Environmental Policy,Eva Lyubich
Is Altruism Sensitive to Scope? The Role of Tangibility,Alex Imas
Mental Budgeting versus Relative Thinking,Samuel Hirshman
When Nudges Are Forever: Inertia in the Swedish Premium Pension Plan,Henrik Cronqvist
Cross-Country Differences in Household Stock Market Participation: The Role of Gender Norms,Da Ke
Gender Norms and Relative Working Hours: Why Do Women Suffer More Than Men from Working Longer Hours Than Their Partners?,Sarah Fleche
The Language of Discrimination: Using Experimental versus Observational Data,Aislinn Bohren
Gendered Language on the Economics Job Market Rumors Forum,Alice H. Wu
Representations of Men and Women in Introductory Economics Textbooks,Betsey Stevenson
What Can UWE Do for Economics?,Tatyana Avilova
A Dialogue between a Populist and an Economist,Tito Boeri
Is Populism Necessarily Bad Economics?,Dani Rodrik
Economic Drivers of Populism,Sergei Guriev
Studying the (Economic) Consequences of Populism,Cristóbal Kaltwasser
On the Returns to Invention within Firms: Evidence from Finland,Philippe Aghion
"Local Violence, Academic Performance, and School Accountability",Marcus Casey
Racial Differences in Police Use of Force: Evidence from the 1960s Civil Disturbances,Jamein P. Cunningham
"Last Place? The Intersection of Ethnicity, Gender, and Race in Biomedical Authorship",Gerald Marschke
Reconciling Results on Racial Differences in Police Shootings,Roland G. Fryer Jr.
Intergenerational Effects of Incarceration,Manudeep Bhuller
Racial and Ethnic Sentencing Differentials in the Federal Criminal Justice System,Brendon McConnell
Participating or Not? Characteristics of Female Entrepreneurs Participating in and Completing an Entrepreneurial Training Program,Leonardo Iacovone
Mind The (Profit) Gap: Why Are Female Enterprise Owners Earning Less Than Men?,Morgan Hardy
Is Personal Initiative Training a Substitute or Complement to the Existing Human Capital of Women? Results from a Randomized Trial in Togo,Francisco Campos
Disability Saliency and Discrimination in Hiring,Philip Armour
The Effect of the Disability Insurance Application Decision on the Employment of Denied Applicants,Mashfiqur R. Khan
Return-to-Work Policies and Labor Supply in Disability Insurance Programs,Arezou Zaresani
Income Volatility and the PSID: Past Research and New Results,Robert Moffitt
Nonlinear Persistence and Partial Insurance: Income and Consumption Dynamics in the PSID,Manuel Arellano
New Evidence on Earnings Volatility in Survey and Administrative Data,Michael D. Carr
On the Heterogeneity in Family Earnings and Income Dynamics in the PSID,Dmytro Hryshko
Beyond the Flipped Class: The Impact of Research-Based Teaching Methods in a Macroeconomics Principles Class,Austin Boyle
"From ""Traditional"" to Research-Based Instructional Strategies: An Assessment of Learning Gains",Sarah B. Cosgrove
Low-Cost Randomized Controlled Trials in Education,Nathan Wozny
A New Look at Lake Wobegone: Who's in Your Canoe?,Chris Bollinger
The Disappearing Large-Firm Wage Premium,Nicholas Bloom
A Cross-Country Comparison of Dynamics in the Large Firm Wage Premium,Emanuele Colonnelli
The Productivity-Wage Premium: Does Size Still Matter in a Service Economy?,Giuseppe Berlingieri
What Matters for the Productivity of Kidney Exchange?,Nikhil Agarwal
Dynamic Incentives in Wait List Mechanisms,Nikhil Agarwal
Dynamics of Child Mortality Inequality,Tom S. Vogl
Cousin Marriage Is Not Choice: Muslim Marriage and Underdevelopment,Lena Edlund
"Women's Empowerment, the Gender Gap in Desired Fertility, and Fertility Outcomes in Developing Countries",Matthias Doepke
Male Social Status and Women's Work,Arielle Bernhardt
Split Families and the Future of Children: Immigration Enforcement and Foster Care Placements,Catalina Amuedo-Dorantes
The Effect of Parental Education on Children's Drug and Alcohol Use,Aaron Chalfin
"The Differential Incidence and Severity of Food Insecurity by Racial, Ethnic, and Immigrant Groups over the Great Recession in the United States",Alfonso Flores-Lagunes
Elasticity of Medicaid Access with Respect to State Financial Distress,Victoria Perez
Trends and Disparities in Leave Use under California's Paid Family Leave Program: New Evidence from Administrative Data,Sarah Bana
Gender Peer Effects in a Predominantly Male Environment: Evidence from West Point,Nick Huntington-Klein
Time and Money: Social Security Benefits and Intergenerational Transfers,Anita Mukherjee
In Debt and Approaching Retirement: Claim Social Security or Work Longer?,Barbara A. Butrica
The Changing Face of Debt and Financial Fragility at Older Ages,Annamaria Lusardi
The Price of Labor: Evaluating the Impact of Eliminating User Fees on Maternal and Infant Health Outcomes,Anne Fitzpatrick
Indoor Air Pollution and Infant Mortality: A New Approach, Imelda
Short-Term Impacts of a Pay-It-Forward Livestock Transfer and Training Program in Nepal,Sarah Janzen
"Intangibles, Investment, and Efficiency",Nicolas Crouzet
"Ownership, Concentration, and Investment",Germán Gutiérrez
Workplace Signaling and Financial Commitment: Evidence from a Field Experiment,Emily Breza
Digital Financial Services Go a Long Way: Transaction Costs and Financial Inclusion,Pierre Bachas
Salary Delays and Overdrafts in Rural Ghana,Niklas Buehren
Carbon Pricing Induces Innovation: Evidence from China's Regional Carbon Market Pilots,Jingbo Cui
"China's Rate-Based Approach to Reducing CO2 Emissions: Attractions, Limitations, and Alternatives",Lawrence H. Goulder
China's New National Carbon Market,William A. Pizer
Institutions and Emissions Trading in China,Valerie Jean Karplus
Measuring Welfare with Massive Online Choice Experiments: A Brief Introduction,Erik Brynjolfsson
The Empirics of Social Progress: The Interplay between Subjective Well-Being and Societal Performance,Daniel Fehder
Using Online Prices for Measuring Real Consumption across Countries,Alberto Cavallo
"Internet Rising, Prices Falling: Measuring Inflation in a World of E-Commerce",Austan D. Goolsbee
Reach for Yield and Fickle Capital Flows,Ricardo J. Caballero
Global Financial Cycles and the Exchange Rate Regime: A Perspective from Emerging Markets,Maurice Obstfeld
Optimal Payment Areas or Optimal Currency Areas?,Patrick Bolton
Financial Cycles and Credit Growth across Countries,Nuno Coimbra
The Effects of Tax Changes at the Zero Lower Bound: Evidence from Japan,Akihisa Kato
Unconventional Fiscal Policy,Francesco D'Acunto
What Do We Know about the Effects of Austerity?,Alberto Alesina
Exchange Rates and the Working Capital Channel of Trade Fluctuations,Valentina Bruno
Foreign Safe Asset Demand for US Treasurys and the Dollar,Zhengyang Jiang
"Trade Invoicing, Bank Funding, and Central Bank Reserve Holdings",Gita Gopinath
The Welfare Consequences of Income-Induced Expenditure Switching,Rudolfs Bems
Wealth Redistribution after Exchange Rate Devaluations,Andres Drenik
What Is the Impact of Food Stamps on Prices and Products Variety? The Importance of the Supply Response,Xavier Jaravel
The Geographic Spread of a Large Devaluation,Javier Cravino
Through a Crystal Ball Darkly: The Future of Monetary Policy Communication,Alan S. Blinder
Central Bank Forward Guidance and the Signal Value of Market Prices,Stephen Morris
Central Bank Communications and the General Public,Andrew Haldane
"The ""Standard Error"" of Event Studies: Lessons from the 2016 Election",Justin Wolfers
Unequal Rewards to Firms: Stock Market Responses to the Trump Election and the 2017 Corporate Tax Reform,Alexander F. Wagner
"Economic Expectations, Voting, and Economic Decisions around Elections",Gur Huberman
